	tweet_id	tweet_text
507	1252447949583499265	These are off the chart numbers and seemingly too high to be realistic but even at a fraction they show why Gov
508	1252447949986107392	Imagine NOT spending your money in a case and saving it for FOOD and Medicine coronavirus
509	1252447951709855746	And yet
510	1252447951743520768	GOP lawmakers introduce bill to allow Americans to sue China over coronavirus
511	1252447952322215936	The coronavirus pandemic is changing work forever Working from home and virtual reality have become the norm of ma
512	1252447952934711297	Pence Your daily reminder that trump lied about COVID19 coronavirus
513	1252447953060540416	COVID19 Swede in Ningbo post How China LIED to the world about COVID 19
514	1252447953727311872	BBC News Coronavirus Plasma treatment to be trialled
515	1252447953794580481	Damn can t believe everyone made up coronavirus just to throw me a surprise party lmao y all wildin
516	1252447956843798530	Wtf is this gonna do corona is already here
517	1252447956898365440	New Yorkers sue World Health Organization over coronavirus response
518	1252447956935913473	This is just to score some politics brownie points as it is offices of USCIS are closed nothing is happening ther
519	1252447956982288387	CoronavirusOutbreak India s Covid 19 cases cross 18 500 death toll at 590
520	1252447957359775744	I challenge you to SaveTheWorld from Coronavirus Recycle empty soda bottles into face shields and become a hero
521	1252447959477743616	Virus upends outsourcing as firms reshore embrace AI FilipinosTogether
522	1252447960656420867	why don t you worry about your own city that you are running into the ground you socialist piece of
523	1252447961331589121	We now have 4 drive thru testing centers in Long Beach If you have symptoms get tested at
524	1252447961667207179	THERE IS A REASON THAT THEY WANT PEOPLE THAT HAVE HAD CORONAVIRUS TO WEAR AN ARMBAND IT CANNOT BE GOOD
525	1252447961818304512	I still think this this is possible Hot take
526	1252447962548121601	CBD THC marijuana Michigan s marijuana industry is deemed essential during coronavirus outbreak
527	1252447962694893569	A strict Covid 19 lockdown gave New Zealand a key ingredient to recover solidarity Morgan Godfery
528	1252447964594831360	Deaths of coronavirus have doubled in the last week but let s reopen
529	1252447965765083137	I am a gun owning hunting farming straight white husband father who is a proud as fuck educated Democrat fuck th
530	1252447966763331585	The COVID 19 pandemic has meant that remote schooling has become the norm with school events among the first thing
531	1252447967161843712	Did COVID 19 unexpectedly spur the adoption of cloud technology Check out this article by
532	1252447967224778753	Meet the Israeli Tech Companies Fighting COVID19 Head On
533	1252447968419999744	Trump to suspend immigration into the United States by executive order amid coronavirus
534	1252447969816739845	If u actually read the article instead of headline reading which obvio
535	1252447969963470850	For as horribly awful amp crazy as this COVID19 is I have to say that we will have incredible family memories w Te
536	1252447969984593920	Jordan Did you forget On March 15 Trump said he was extending the administration s social distancing guideli
537	1252447970768891904	Opinion Hogan needs to keep Maryland closed despite Trump s demands
538	1252447970852614145	25 families of staffers asked to self isolate in Rashtrapati Bhavan
539	1252447970936492033	School closures in 190 countries due to COVID19 have left more than 1 57 billion students out of school
540	1252447971947372544	The news that has gone into voluntary receivership due to covid19 should not surprise us they r
541	1252447973016866817	Good to see Australia s Planning Ministers committing to decision making in the public interest and transparency in
542	1252447973385990147	Women At The Frontlines Of COVID 19 Might Be Starting The Gender Role Reversal Of The Century
543	1252447973621071873	Suspend till further notice
544	1252447973637861379	Heart RT s Day 8 Discharged a patient home today Amazing moment for the patient and the staf
545	1252447974732546049	I love these videos They re always succinct and they always pack a punch Thank you Rampage
546	1252447977290911744	You know what this pandemic has done Made it VERY hard for me to ignore phone calls text from people I really don
547	1252447977739821056	What You Need to Know About Coronavirus via
548	1252447977890775040	A Nice Warm Handshake and Close Love Letter Friendship We can only be so lucky
549	1252447978108805121	It was great to catch up with the DDMAlumni last night we heard some fantastic stories from And yes I
550	1252447980885553152	Stay or go U S citizens living in Baja California make tough decisions amid coronavirus crisis
551	1252447980893859842	Exclusive Charity Anglicare is urging people to stop and think after being forced to pay for unwanted items peopl
552	1252447981149679623	Virgin Australia collapses under coronavirus strain Health Australia
553	1252447981225287680	No basis for this except to appease his racist supporters The US has more cases than any country on earth If so
554	1252447982340972550	Who is hiring in the Pittsburgh area during the COVID 19 pandemic
555	1252447982559133696	aye irls who would let me platonically kiss them like this bc after covid 19 has died down u bet ur bottoms i m giv
556	1252447982881923072	Global Coronavirus Cases Top 2 47 Million Johns Hopkins
557	1252447985063034880	Media should not fall for this he is an expert in changing the narrative you will be tal
558	1252447985230741504	Hey assholes You are spitting in the faces of my sisters my niece and my friends who are all taking care of
559	1252447986082295808	BREAKING North Korean Dictator Kim Jong Un WAS SICK WITH COVID19 GETTING BETTER WI
560	1252447986166034433	The Infection That s Silently Killing Coronavirus Patients
561	1252447986208043009	I don t think anybody believes we won t hit 60 000 deaths We doubled to 42 000 in a week
562	1252447988200493058	Starbucks Howard Schultz warns of carnage to small biz as coronavirus aid falls short by
563	1252447989634936833	Why is South Korea beating coronavirus Its citizens hold the state to account
564	1252447990062579712	The last shred of the small government Republican party is now dead
565	1252447991597760519	Like all white women I read graphic novels Is that acceptable After this coronavirus is gone want
566	1252447991690145793	Smart Step
567	1252447993674039296	I m in dire need of assistance I ve been laid off work since March 12th due to COVID19 I m the sole provider in m
568	1252447994571612160	this game is perfect for stayhome covid 19 coronavirus
569	1252447995024547840	Experts say that reopening the country depends on mass testing capability
570	1252447995431399429	Watch Pelosi Says Weak Leader Trump s COVID 19 Response Has Been A Failure Where do they get this stuff F
571	1252447995439853568	Demonstrators circle Niagara Square to protest Covid 19 stay at home directives
572	1252447995452219392	really
573	1252447995548913665	The same WHO that said there was no human to human transmission of the Coronavirus amp lied covered up for China th
574	1252447998841249797	Coronavirus behavior by viewers differed depending on whether viewers watched Tucker Carlson s warnings about the c
575	1252447999491358720	They are still looking for the misplaced emails
576	1252448000309264384	COVID19 disproportionately harms survivors of Domestic Violence amp Sexual Assault Please support them
577	1252448000741265408	What s the over under on POTUS acknowledging KimJongUn health death before we hear him acknowledge the death of 40
578	1252448001169203201	Schumer amp Pelosi Continue To Shatter American Families Time to boot them out of office
579	1252448003090272257	just blatantly lied about whether the US has the highest number of COVID 19 deaths It does Ch
580	1252448003660541952	If I m not mistaken doesn t the US have the highest number of COVID 19 cases globally Shouldn t ot
581	1252448006109933569	She is not on the side of Covid19 death That s a simple answer You
582	1252448006537764864	This is THE best
583	1252448008567787520	As Amazon cracks down on dissent tech and warehouse workers unite over coronavirus environment The Seattle Times
584	1252448008786055169	Thomas Carle NEW Deutsch amp English CoVid 19 Corona recognize the early symptoms
585	1252448010388160518	The California New Car Dealers Association reported that some businesses are losing out on the sales of
586	1252448011390799872	We are encouraging New Yorkers to go about their everyday lives said Commissioner of Health of Ne
587	1252448011852095488	A strict Covid 19 lockdown gave New Zealand selfdevelopment selfimprovement
588	1252448012401401857	First Palace concedes that China has control over West Philippine Sea Second Phili
589	1252448012707782663	These GOP fools are going to kill hundreds of thousands of people with the Opening Up bullshit and there will be
590	1252448013492068354	Ask how many of these protesters are on Facebook I bet the answer is 100 Someone out there is a genius at g
591	1252448014100201473	COVID 19 pandemic and travail of federalism
592	1252448014133628928	TINYstruggle With What To Pulse During COVID 19 breakingnews news Latestnews
593	1252448015358611459	Chris Hayes and David Wallace Wells On Parallels Between Climate Change And Coronavirus
594	1252448015412916224	Amazon warehouse workers plan nationwide protest this week to demand coronavirus protections
595	1252448020349759495	Of course he will
596	1252448020635009025	Law society demands coroner s inquest over COVID 19 killings
597	1252448020701962241	Hidden from the U S Or the rest of the world
598	1252448021066870785	Yes please
599	1252448024124686336	Australia Loses 6 Of Jobs To Coronavirus Crisis
600	1252448025194217472	Why is she not running this state
601	1252448025349361665	Coronavirus UK only formally asked Turkey for PPE shipment after it said it was already on its way World News
602	1252448025353412609	Given Indias population density and Covid19 spreadibility you really want to take that chance
603	1252448028016795648	CoronaUpdate SouthAmerica CoronaVirusUpdate Brazil 2000 cases amp 100 deaths in row Peru Ecuador 600 case
604	1252448028390121472	India s phenomenal response to Covid19 pandemic IndiaFightsCorona IndiaFightsCoronavirus CoronaVirus
605	1252448028855881728	Res Me amp my family stuck in gurgaon hotel
606	1252448030386601987	Breaking 18 inmates and 1 jail staff at the Correctional Institution for Women in Mandaluyong Philippines tes
607	1252448031258972160	Fox News Is Desperately Trying to Turn Coronavirus Protests Into the Next Tea Party via
608	1252448031364075521	Why you lie Fredo Cuomo then launched into a tale about a loser biker who confron
609	1252448031385047042	What you need to know about COVID 19 in B C on April 20 2020
610	1252448031758221314	Trump knew everything the World Health Organization knew on coronavirus he just chose to ignore it
611	1252448031800246272	IN Seven days No respirator for You and no respirator for u annnnnnd no respirator for you
612	1252448033444413441	Alberta reports four more COVID 19 deaths 105 new cases
613	1252448033607999495	Dear mothers you have all the rights to complains It won t make you a bad mom We all know you try
614	1252448035466088449	Law Enforcement Searches and Seizures During the COVID 19 Pandemic JD Supra
615	1252448035797434368	Better read up big boy
616	1252448036548198400	China the creator of virus ChineseVirus19 WuhanVirus BoycottChina
617	1252448036963287040	COVID19 StayAtHome WashYourHands Jarak1Meter KitaJagaKita KKMM JabatanPenerangan JaPenWPKL KLCeria
618	1252448037596774401	When Italy is laughing at you right now f ing pack it in impeached president trump COVID19
619	1252448037646905346	Good thing I m down one and the other is less than useless
620	1252448040075636738	He s in stable condition The Chinese doctor not so much
621	1252448041161723904	You gotta be lying
622	1252448041291915265	Guys I suggest u to read this one
623	1252448041786728448	Cold Pressed D Viral droplets covid19 drinkpurefruits kingscolddrinks kingsdiet colddrinks contest
624	1252448041887391745	Way to go USA
625	1252448042072014848	PresidentTrump Sir My reply to claim that COVID19 WuhanVirus
626	1252448043108007943	You can always tell when is lying His lips move At a time of national crisis he is quite happy
627	1252448043821142016	Why every household should have a thermometer and one of these my favorite climbing kit tool a Pulse Oximeter
628	1252448043825324032	man been waiting for this day
629	1252448043904798721	Using the same standard measure all executive orders making large changes to immigration should have to meet a hig
630	1252448044500627458	Trump says he ll suspend immigration because of coronavirus offers no details
631	1252448044584300545	Natak He had no problem breaking the rules when he went to Ayodhya for the idol ceremony
632	1252448044584443906	Damnnnn this cannot be real
633	1252448044840374272	What you do if you jump the gun and go into a situation where you have a big spike you re going to set yourself b
634	1252448045419110401	Incrementalism Is Not Helpful in This Moment Ocasio Cortez Rejects Settling for Crumbs in Next Covid 19 Stimulus
635	1252448047772184577	Oh look a total idiot that doesn t understand the term national mitigation Do you need it expla
636	1252448048250322949	En till While school closures help during influenza outbreaks the same may not apply to coronavirus
637	1252448048375980037	MaharashtraPolice Perform CoronavirusAarti to Shame Violators of COVID19 Lockdown in Thane Watch Video
638	1252448049164664833	Last Week Tonjght with John Oliver Coronavirus Ii
639	1252448049231728645	Wow Going to take a wild guess that this doctor is now missing
640	1252448050175500288	AFROCoronavirusUpdate Mayor s Office of Immigrant Affairs MIMA Week ly COVID 19 Update
641	1252448050448142341	perspective Facts over dc truths EpsteinDidNotKillHimself
642	1252448052134047744	alsunnah AlShabaab zahraniabidi MJALSHIRKA The intelligentsia in India friendly Gulf countries has started
643	1252448052335517697	emilia Try again with facts not p
644	1252448052394287106	Shawtee not a shocker the shock would have been if he would have put us first
645	1252448053149253633	Will COVID 19 Kill the Constitution Reason
646	1252448053614702593	What if the coronavirus is a vaccine for the earth to eradicate the human virus
647	1252448053736411137	Dumb
648	1252448057297264640	covid 19 pro cover humanisme dirumahajakimak
649	1252448058102685698	Thus far of my 100 students 8 either have COVID 19 or their spouses or children have been infected Of those on
650	1252448058354339847	A bottle of water is more expensive than a 1 barrel of oil I am one of the who is seeing these things OilCrash
651	1252448059029549056	Trump to temporarily suspend immigration to United States in wake of COVID 19 DonaldTrump Immigration
652	1252448059335872513	Ayooo wtff spectator index really hiding tweets now
653	1252448059428147200	No but Brexit will
654	1252448061051330562	TX Trump s MAGA results 37 63 a barrel US crude oil 42 560 COVID 19 deaths and counting 48 9
655	1252448061286043648	As per below RT India and it s states doing good All other countries in world should learn from India amp from Indi
656	1252448061340766208	What are we waiting for Miami Dade mayor ready to reopen parks marinas golf courses
657	1252448061659308032	I looked through photos of the protestors in Denver yesterday These people don t look like Denver residents the
658	1252448063014105089	South Korea s exports have shrunk by almost a third so far in April according to preliminary data in an indicatio
659	1252448065035755520	This is great I am glad Because on a regular day LAUSD throws away tons extra food and has rules against hungr
660	1252448065488814080	I figured it was a performance artist portraying how easy Coronavirus can spread
661	1252448065539264512	Idiots of the highest order
662	1252448067636400133	According to this in the WSJ the EO suspending wouldn t change current policy much
663	1252448069431549953	Bald people are having last laugh coronavirus SalonClossed
664	1252448070048141319	Legislature passes law expanding workers comp for first responders contracting COVID 19 MinnPost
665	1252448073026088967	So true anybody living in Germany in the 1930 s would immediately recognise what s happening today Hitler and Goe
666	1252448073273442304	Out mental setup is right now such that carnivorous is read as coronavirus Now Read Again
667	1252448075374788608	Love it johnnycashbucks buckinarley
668	1252448075437625344	Cargill is shuttering its High River meat packing plant after it was linked to more than 350 cases of coronavirus
669	1252448075706056704	We must avoid every day debate on TV Channels about COVID19 among political parties and must be disclose
670	1252448077593686017	From a creepy gay rapist
671	1252448077941813248	Lamont updates on coronavirus response efforts arts grants set up
672	1252448078579281926	Your pandemic of crime is ruining NYC And it started a long time before Coronavirus You cannot blame it
673	1252448079523045377	I ve witnessed President Trump make tough decisions to protect Americans from the coronavirus even when it wasn t
674	1252448081578086400	The fivefold way to go on the offensive against COVID It s Not Too Late to Go on Offense Against the Coronaviru
675	1252448083675406336	Sigh
676	1252448084560433152	It s Taco Tuesday and cats letting er loose could be spreading more stanky gases
677	1252448084807671808	VA locks down nursing homes to prevent COVID 19 infections department tracking six cases
678	1252448086103859206	Rilling 16 new positive coronavirus cases in Norwalk 2 more dead
679	1252448086380732419	The drug appears to be working New York Gov said Mon
680	1252448086804160513	00109 00110 CSMT NGP CSMT DAILY SPECIAL PARCEL TRAIN UPTO 03 05 2020 COVID19
681	1252448086883958787	For all the people who suffering with the coronavirus virus God is with until the end
682	1252448087567732742	WORX sent an email to promedical to confirm no reply yet email as follows Thank you for the great work you are do
683	1252448087676792833	LET S GO
684	1252448087815139328	WHO says partisan politics and lack of global solidarity is fueling coronavirus pandemic CNBC
685	1252448088473473029	World class right here
686	1252448088507080704	Employees test positive for COVID 19 at Chick Fil A restaurant in Beaumont forces closure
687	1252448091074150401	This heroes choosethegood Delaware County PA workers going home after 28 days making COVID 19 protective gear
688	1252448091459862528	why must everything be put into militarized language doesn t comfort me to hear our prez call coronavirus the ene
689	1252448091648622592	Judge lets use of Laguna Hills Inn to house homeless with coronavirus go forward Orange County Register
690	1252448092189794304	Carole
691	1252448094509129730	Lux
692	1252448094798692352	Wellp it sounds like Kim Jong Un will be dead when I wake up
693	1252448095612403714	Isn t this normal Here we ve had the borders closed once the quarantine started if not before
694	1252448096547516417	Donald Trump To Order Suspension Of Immigration To US To Fight Coronavirus
695	1252448096677695489	TX Trump s MAGA results 37 63 a barrel US crude oil 42 560 COVID 19 deaths and counting 48 900 gun
696	1252448099710058496	all Western govts did it till COVID19 got out of hand Look at Hong Kong We wear masks once there are signs it
697	1252448099810734080	Only a liar and dumbass would need to say source twice Name your sources or shut the fuck up
698	1252448100389548032	Tharoor Writes to FM Seeks Customs GST Tax Exemption for All Diagnostic Protective Equipment Used in Fighting Co
699	1252448100620341253	Coronavirus Disinformation and the Need for States to Shore Up International Law Lawfare
700	1252448102784684034	Angela Merkel s Germany sends China an invoice for 130bn over coronavirus damages Germany leads they way for
701	1252448103019556865	The chicoms Chinese communist knowingly are responsible for the Wuhanflu coronavirus and sound EXACTLY like the
702	1252448103380156417	I love our Trump to suspend immigration into the United States by executive order amid coronavirus
703	1252448103829028865	Yes Once the CoronavirusPandemic is contained immigration to the USA may be safely resumed
704	1252448107075428352	My governor is better at his job than the President is at his And he s never been impeached
705	1252448107301933056	No Police Raids Syracuse Mosque Continues Holding Daily Prayers Amid COVID 19 Lockdown As Christians Are Threatene
706	1252448107318571008	Says everything about the way NZ is dealing with the Covid 19 pandemic
707	1252448107331117056	This would actually be awesome for the environment
708	1252448107830185986	Labour participation rate has fallen further from 35 5 to 35 4 and the employment rate has now fallen to 26 1 c
709	1252448108153204737	One World celebrity special for coronavirus draws 21 million Americans
710	1252448108572631040	COVID 19 in Sask Top doc says physical distancing must continue until there is vaccine or immunity CBC News
711	1252448110883647488	Covid 19 Over It gt gt gt
712	1252448111395344384	Thank you for standing up for workers on the frontline of COVID19 We appreciate you joining us a
713	1252448111416483847	Ossoff Claims Need for Coronavirus Action was Obvious as Georgia Senate Primary Heats Up
714	1252448112834236423	It is incredibly concerning that our Governor Henery Mcmaster of South Carolina is lifting major
715	1252448117301133315	Fantastic news
716	1252448117435367425	Did KFC actually contributed anything at all towards any fund related to COVID19
717	1252448117519081473	What happens to India if the U S shuts down its borders What about the Indian workforce in the U S
718	1252448120945819649	US Oil Prices Rebound Into Positive Territory After Historic Crash
719	1252448121331888131	Bigger than when China lied about the Coronavirus
720	1252448125769224194	Yes too many Gotta Ya quesruons to Many guys wld lose it Trump s surprisingly steady
721	1252448128210358273	Put to death therefore whatever belongs to your earthly nature sexual immorality impurity lust evil desires
722	1252448128931966976	Democrats Hollywood the liberal left supporting in the name of feminism amp woman s rights murdering up to full te
723	1252448129246466048	Richard Quest reveals positive coronavirus test during his show CNN Video
724	1252448129250623491	Small California Town Hopes Testing Will Show How Coronavirus Is Spread
725	1252448131641487360	Here s a List of All the Drive Thru COVID 19 Test Sites in South Florida Drive thru COVID 19 testing centers are op
726	1252448134120173569	One could cure more than just Covid 19 by that
727	1252448135055540229	Student stats can survey about covid19 this should be useful If you are a student or know one pass it on CERB
728	1252448137328951296	Dr Phil Oz and Drew needed a lead singer
729	1252448137542860804	A few days ago he messaged me basically saying Covid 19 was a joke and blah blah I told him I lost multiple people
730	1252448137714831360	This is how coronavirus has changed media habits in each generation via
731	1252448138343976960	Unbelievable should ve swam for it
732	1252448138604003329	What a great idea No virus in No virus out Trump to suspend immigration into the United States by executive or
733	1252448138758991875	Thanking our Civil Servants on the occasion of National CivilServicesDay Their immeasurable contribution towards
734	1252448138822115335	Black Scientist Says He s Two Weeks Away From Testing COVID 19 Drug Created in an HBCU Lab Black Enterprise
735	1252448138981498880	Well well well isn t this just trump s wet dream cue the bat signal
736	1252448139048517632	Game changer Covid Killer
737	1252448139132493824	BREAKING Multiple US officials tell that Kim Jong Un caught COVID19 from a Chinese doctor flown in to help w
738	1252448140332011524	5 times India dissed Pakistan s propaganda during Covid 19 crisis india news
739	1252448140520800259	Can you please explain why peoplr in age group 41 50 does not get affected by COVID 1
740	1252448140650778624	Private gym owner in Roanoke charged with violation of Executive Order 53
741	1252448140910907392	Brilliant
742	1252448140931641345	India with the right blend of the physical and the virtual can emerge as the global nerve centre of complex moder
743	1252448141577580546	Conspiracy theorist Alex Jones shook hands with fellow coronavirus skeptics at Texas rally Topbuzz
744	1252448141581987842	Birds of a feather
745	1252448141695021057	This makes zero sense Open America cuz the coronavirus isn t a threat Stop immigration cuz the c
746	1252448142286393346	It s going to backfire Fauci warns against reopening too quickly amid coronavirus crisis Topbuzz
747	1252448143171444738	Trumpunfitforoffice any office lock him up because he is a bullying lying cheating criminal he incites violen
748	1252448143209304065	Great legislation
749	1252448144849240065	Betcha it s COVID19 IMO
750	1252448145327489029	This dumb asshole doesnt realize we have more cases here than any other country Banning immigration now is like p
751	1252448145797074946	Heroic Together Festival site is live Check it out and sign up to be a Creative Contributor or Heroic Partner
752	1252448146313093120	US intelligence believe that 40 000 died in Wuhan China and that s just one city So
753	1252448146606743552	These charts show as of Monday SalemMA has 258 lab tested positive coronavirus cases
754	1252448148368359425	B B B B Butt Wait It Gets Worse Aussie Doctors Suggest Not Farting Bare Bottom To Prevent The Spread Of COVID
755	1252448149697748993	I do realize but it could have been done much cleaner It s crazy we get a provinc
