	tweet_id	tweet_text
1004	1252448443835904000	February 5 2020 Everything is well Duterte downplays nCOV threat Link March 20 2020
1005	1252448444964192256	I m hearing about many people with diarrhea who are wondering if they might have COVID19 But gut symptoms are com
1006	1252448446830637056	One World celebrity special for coronavirus draws 21 million Americans
1007	1252448446872576001	DIY mask Lord stop this coronavirus 1st tweet follow me
1008	1252448447057166336	The City of Long Beach COVID 19 Update for Monday April 20 2020 via
1009	1252448447195541509	You have heard it earlier from an Indian Member of Parliament right
1010	1252448447325630466	NOPE NOPE NOPE YOU RE NOT ABOUT TO TELL ME THIS ISNT ARNOLD FROM SPYKIDS 3D
1011	1252448448005025793	Rob maybe you will develop the COVID 19 virus and need meds
1012	1252448448353316864	This has nothing to do with whose coming in the country God a real leader focus on securing more funding to hospit
1013	1252448448990806016	Greene The greatest risk from gyms might stem from lots of people breathing heavily in relatively c
1014	1252448450697822208	China will scapegoat him for the CCPVirus WuhanVirusMadeInChina
1015	1252448450949636101	Listen to this 420day covid19
1016	1252448451146600449	from This is the warning to other countries put out by the WHO on Jan 23
1017	1252448451414994944	CORONAVIRUS CANT SURVIVE LONGER SA HOT TEMPERATURE AND LOOK AT THE WEATHER NOW KAHIT GABI AT PAGSAPIT NG MADALING
1018	1252448451847237634	Four decades of my lifespan it was impossbile to get away with a bankrobbery Now thanks to covid19 it only n
1019	1252448452065312768	All the things COVID 19 will change forever according to 30 top experts Interesante
1020	1252448452698505217	it s gonna draw legal challenges but doesn t he have broad powers here
1021	1252448455072583680	Worthington MN is home to about 13 000 people 2 000 of them will begin a path of uncertainty as JBS company admin
1022	1252448456335130624	Is Kennedy the source
1023	1252448456666484738	My cartoon today Campus Buk Ameenah
1024	1252448460428771328	The dates of these reported illnesses range from early February through early March weeks before COVID 19 became a
1025	1252448460852342784	Siguemeytesigo FollowBack AmigosBrahmaLive villamixemcasa pixote anime naruto sasuke stream fancam Babyfa
1026	1252448460915331072	I agree with and must faciliate remote voting and ensure the continui
1027	1252448463498940416	Spoken by the same county judge who promised Tarrrant County will never close its bars and restau
1028	1252448463557660678	The city s Independent Budget Office forecast that 475 000 people would lose their jobs over the next year other
1029	1252448464337727488	My hometown on the world news
1030	1252448464375603201	President Trump West Africa now has cases of Covid19 Hydrochloriquine would help them in both malaria and fight t
1031	1252448465612726277	Yes Her Surprise You do not need to be an arrogant amp to run a country well in a crisis COVID19
1032	1252448467823124480	Up to 442 000 people in LACO May have already contracted Covid19 according to initial results from USC LACO antibo
1033	1252448468074971142	It s already here and your Republican buddies are about to open up their states again It doesn t make sense becau
1034	1252448468175634433	Global Oral Antiseptics Market to Undergo Rapid Advancements During the COVID 19 Period 2018 2028
1035	1252448468745940992	can we make any donation to be used for Illegal aliens living in the United States NON Tax Deduc
1036	1252448470029332480	Is the Virus on My Clothes My Shoes My Hair My Newspaper
1037	1252448471648518145	In our latest webinar Laurie Kelly CAMS discusses the biggest financial risks as a result of the pandemic
1038	1252448471749218304	What guidance are FIU offering to financial institutions Here s a global summary covid19 riskmanagement
1039	1252448472512397313	This fucking guy and his executive order because of coronavirus
1040	1252448472915218432	dear Sawant Sir We all from Assam would like to congratulate you and your team for making Goa
1041	1252448473376591873	China owned US pork producer Smithfield Foods shut down its operations in South Dakota recently
1042	1252448473904906240	Engineers Respond Quickly to Teleworking Civil Engineering Special Coverage via
1043	1252448474114650112	SEWA women produce 5 lakh masks as a measure against COVID 19
1044	1252448474160824320	WATCH God retweet Maybe it changes at least one poor idiot s mind from going to the beach Coronavirus B
1045	1252448476127850497	HUAWEICLOUD s AI assisted imaging system is helping doctors speed up their diagnosis for COVID19 Discover how t
1046	1252448476446654464	Considering the situation CoVID 19 The central govt of india should take rigid stepes against the state
1047	1252448476794937350	This is the same asshat who said on April 2nd he didnt know coronavirus could be carried spread asymptomatically
1048	1252448477621215239	Home health aides treating coronavirus patients desperate for PPE Fox News CoronaLockdown
1049	1252448478317469696	The free grain that was to be given by the government due to COVID19 has not yet reached our village people of so
1050	1252448479806439424	fratacious laugh heh
1051	1252448480221712384	It is once again that time of year when people s seasonal allergies tend to flare up which is even more worrisome a
1052	1252448480871813121	Coronavirus Cases In India Cross 18 000 Mark 590 Deaths 47 In 24 Hours
1053	1252448480913756161	Jammu and Kashmir cop tests positive for coronavirus pakistan Kashmir
1054	1252448481471533057	Terribly sad As first responders I m sure her parents must wonder if they brought the virus home
1055	1252448481828130817	boogaard Wow Kat Easy to reduce the impact of COVID19 to big numbers and lofty economics but this is a real
1056	1252448483967188993	Healthcare Workers Fighting covid19 To Receive Millions Of New Face Masks more at
1057	1252448484894011392	Trump to order US borders closed to immigrants amid coronavirus crisis CNET
1058	1252448484919111680	Hong Kong extends restrictions to preserve success of coronavirus efforts
1059	1252448484977827840	While talks about leading on COVID19 in front of the cameras his administration is threatening publi
1060	1252448486190129153	Constitution Law Expert weighs in on legality of state shutdowns No constitution gave them that pow
1061	1252448488563945475	Great to see West Sacramento come together like this
1062	1252448488958447617	Probably one of the reason Lagos is a trail blazer in the covid 19 countdown
1063	1252448489553920000	Join in the COVID 19 fight by donating CPU GPU cycles on your own computers servers to run portions
1064	1252448489587437569	Surprising Reports that a world leader is brain dead and it s NOT Trump they mean Covid19
1065	1252448489847521280	And The Traitor wasn t that great Not worth getting coronavirus for
1066	1252448490333990912	My post office has changed its hours due to Covid19 Which is reasonable But those hours aren t posted a
1067	1252448490338344965	Most Immunologists seem to be unanimous about the importance of extensive testing to tackle the COVID19 pandemic
1068	1252448492720730115	Goa The First State to become COVID 19 free Manipur Second
1069	1252448492779442179	1 Vermont Governor Holds Coronavirus Briefing 2 LeeAnna Keith When It Was Grand 3 History Bookshelf Andrew Gumb
1070	1252448492989091840	The slave has to appease his masters
1071	1252448493169446914	I hope more Governors understand that if the economy does not re open soon that many more people will die from eco
1072	1252448493404401665	Fresh23 Whoops
1073	1252448493517459456	The head of the World Health Organisation has warned that the worst is yet ahead of us in the coronavirus outbrea
1074	1252448494377242624	Seals owner wife donate 500 000 pieces of PPE to San Diego health care workers
1075	1252448496554323968	Greatest diplomat in the US Department of State who knows the true nature of the Iranian regime
1076	1252448497577713664	He won t He s a global experiment run amok Along with many other idiot leaders in
1077	1252448497619607552	My COVID19 treatment drug Death 0 Side effects 0 Treatment 100 Because of Intellectual P
1078	1252448497892306946	An entire thread The COVID19 committee was set up the news may have missed me Because effectiveness is greate
1079	1252448498152177664	Diagnostic value and dynamic variance of serum antibody in coronavirus disease 2019 Compare
1080	1252448498689224705	essential workers using public transport at a risk of Coronavirus infection due non
1081	1252448501478248448	the people in my town are so stupid they legit believe covid19 is a chinese plot i hate it here
1082	1252448502040465413	Can African Tailors Help End COVID 19 Mask Shortages Africa
1083	1252448503005052929	Lockdown Diaries COCO from Balewadi is one of the dogs that is fed under our waragainsthunger program during the
1084	1252448505211138049	It s Not Too Late to Go on Offense Against the Coronavirus via
1085	1252448505626595328	Seeing what it s like in your local hospital brings it all the closer Proud and grateful Thanks
1086	1252448505928564736	Frustrated by Lack of Coronavirus Tests Maryland Got 500 000 From South Korea
1087	1252448506008264707	Liberalism is a disease I d rather have coronavirus than be a Liberal Democrat
1088	1252448506314231808	Dear Impeached if you want to reopen the economy take a few steps that these countries have taken Use their meth
1089	1252448506322710528	Weren t these mf crying about how people were being racist against them bc of COVID 19 but they re o
1090	1252448506335420416	then say hello to covid19
1091	1252448506939236353	If I hear one more person say the coronavirus is blown out of proportion because it s an election year Seriou
1092	1252448509489319939	Long guns plaid work shorts cowboy hats flag shirts nah These maga hat wearing kag folk don t represent the
1093	1252448510336786432	lambeth Tim loves Bill Tim doesn t know that the money
1094	1252448510357598208	Cold Pressed A Covid 19 covid19 drinkpurefruits kingscolddrinks kingsdiet colddrinks contest
1095	1252448510462566402	How is this pervert still in Congress Oh yeah he s a Republican
1096	1252448510596780033	A poll designed to test Trump s vulnerabilities on foreign policy finds that 56 of voters in 12 battleground state
1097	1252448510605168642	Guys like are touted as rock star entrepreneurs This guy could never survive running a barbersh
1098	1252448511217500160	Hopefully s legislation becomes law and this will cover all 50 states cause as it is not being able to u
1099	1252448514421989383	Trump Steaks Vodka Ties Water airplanes casinos University Charity golf courses hotels b
1100	1252448515088879617	Poor Killary is trying to be important Guess what I am NOT being tested nor getting a vaccine Go back to the wo
1101	1252448515843735552	Is Kinley Brand 20 Ltrs Mineral Water Supply PROHIBITED in Hyderabad We are DRINKIN
1102	1252448515843862531	Why is he not quarantined
1103	1252448518146531328	Airports Closure FG Okays 2 Weeks Extension Over COVID 19
1104	1252448518863761409	Dan Crenshaw s viral defense of Trump s coronavirus response isn t all it s cracked up to be
1105	1252448519064936451	Dr Maria Van Kerkhove intelligent well spoken and attractive This could explain part of trumps lashing out aga
1106	1252448519547387904	Your kids and wife they are not really happy to see you again
1107	1252448520088383494	STAY AT HOME staysthome dontgoout cuban COVID19 STAYATHOMECHALLENGE StayHome QUEDATEENCASA MUSICA ACAPELLA
1108	1252448520230989824	How the Coronavirus spawned a culture war in the US The new patchwork of state and local policies designed to fla
1109	1252448522466623488	Every respiratory illness no matter what listed as covid19 to drive the numbers up Amazing that there seems to be
1110	1252448522516881409	The Hill Rubio warns he will subpoena companies as part of coronavirus aid oversight TheHill via
1111	1252448522563203073	Video showing front line healthcare workers blocking coronavirus liberators surface
1112	1252448522701623296	Literally Fake News Cuomo has been seen out and about in the Hamptons There s even a police report filed as Cuo
1113	1252448523229917186	Gonna watch
1114	1252448523594764288	Stop thinning then oh and by the way Fox news appeared in court last week due to their
1115	1252448523859230727	Private Kit Safe Paths Privacy by Design Covid19 Solutions using GPS Bluetooth for Citizens and Public Health Off
1116	1252448523997544454	Truth of new India COVID 19 coronavirus Covid 19 lockdowneffect lockdowneffect
1117	1252448524777721861	Fairfax Circuit Court clerk rolling with COVID 19 punches
1118	1252448526329679872	Cuomo didn t know coronavirus patients are being sent back to nursing homes
1119	1252448526484848642	RATHER BE SAFE Then Loose registered voters Keep them closed So all of us are safe
1120	1252448526539190272	lights the path ahead Great
1121	1252448527277608960	Essential Tex Mex Restaurant Enchiladas Y Mas Closes After 26 Years
1122	1252448527902482434	Fuck the Patriarchy when the terrorist is closer to home that the deadly virus
1123	1252448531690008576	I like the direction that the SportsUg has been providing about schools during the COVID 19 pandemic I think
1124	1252448532033728513	Deepest condolences to for the loss of his father Saddam Ali who lost his fight with the coronavirus
1125	1252448532977631232	Joe is going to fundamentally change the Science of global warming Change the science on global warming but
1126	1252448533195526145	US sailor on coronavirus stricken Navy ship dies from virus related complications officials say FoxNews
1127	1252448533493379072	US must improve COVID 19 strategy to keep tens of millions from falling into poverty urges rights expert
1128	1252448533967450114	THIS THIS THIS READ THE BEST THREAD EVER READ THE EXPLANATIONS IN THE THREAD BEST EVER
1129	1252448534634225665	Just saying I m born and raised in the US holds no more pride The ppl here have let me down because all they re wo
1130	1252448535410282496	COVID 19 Medical Care Expats or Qataris there is no difference because we are brothers and sisters We are o
1131	1252448535473160193	i pray tomorrow is my day its been mow 6 weeks that ive been trying i know its late but i hope
1132	1252448536223862786	If you re going to protest practice physical distancing If you re going to protest and express your right of fre
1133	1252448536895119366	America And The West s Way Of Life May Not Survive The Coronavirus
1134	1252448537222082560	The coronavirus has forced CCP to change its ensure 6 GDP growth for China in order to protect Xi s job t
1135	1252448538467995648	Coronavirus Latest Montgomery County Pharmaceutical Company Continues Work On COVID 19 Vaccine First Clinical Tri
1136	1252448539394871297	City of Stamford updates on coronavirus situation 04 20 2020
1137	1252448543077478401	University s antibody tests reveal 55 times more Californians have had coronavirus than reported
1138	1252448543589179394	coronavirus immigration to US to be suspended amid pandemic says Trump in an effort to protect American jobs
1139	1252448543958118401	Some facts about 1 Curt director is an Ethiopian politician with huge China ties 2 Ethi
1140	1252448545505832961	See The Daily s updated visualizations of COVID 19 cases in the Bay Area
1141	1252448545644445697	The way they dig in to find the source of fake news if that was the energy channelled towards Covid
1142	1252448545732526081	Haha haha haha I cant stop laughing imagine they don t need it to covid19 oh wait gop never
1143	1252448547653349378	In Gujarat India 108 new COVID19 confirmed cases were reported in last 9 hours
1144	1252448547770781697	Perfect response Cari That needs to go on billboards across the nation
1145	1252448547787571200	Which reality TV show Wrong answers only
1146	1252448548966277120	BUSTED Bill Gates Slips Reveals TERRIFYING Coronavirus ENDGAME Ted Ta via
1147	1252448549213810689	OPINION How employers can manage working parents during coronavirus
1148	1252448550132150274	Wishing you a speedy recovery
1149	1252448550723579905	Coronavirus Hong Kong government extends restrictions in city for another two weeks keeping bars pubs and other
1150	1252448551562608647	Samar hospital worker is 6th Covid 19 case in Eastern Visayas BestArticle
1151	1252448551990370304	We got around 3 months to respond covid 19 but it s too late We already lost 101 people from beloved Bangladesh S
1152	1252448555505201153	Billy Graham s daughter God is using coronavirus to turn us away from secularism Holy SHIT This bitch is scar
1153	1252448555668824066	americans be like but my freedom then contract coronavirus
1154	1252448555886956544	Love this drama
1155	1252448556222304256	Is this why Trump hasn t contracted it yet
1156	1252448556633317378	ALL THE DATES ON THIS LIST FOR HIS RALLIES ARE ALL ON YOUTUBE SO YOU CAN VERIFY
1157	1252448557132644352	Serology is like Wittgenstein s ruler
1158	1252448557950480384	Nobel Prize Winner Says Coronavirus Had To Come From A Lab
1159	1252448558487404544	Headline Chairperson of the Private Hospital explains why the stigma fears and panic around COVID 19
1160	1252448558491602944	Pentagon Seeks Billions for Arms Companies in Coronavirus Funds
1161	1252448560131346436	A Whyalla man being arrested for an assault told a police officer he had coronavirus and then coughed in his face
1162	1252448560953593856	Took you clowns long enough Welcome to where we were back in March
1163	1252448561108791297	NEDA ICC approves DOH s P5 B Covid 19 emergency response project BestArticle
1164	1252448561259823104	Angelina Jolie s Coronavirus Moved to Extremely Critical Plastic Surgery Hollywood Actresses Sahar Tabar Ventilator
1165	1252448561574236160	Govt Issues Guidelines to be Followed on Detection of Covid 19 Cases in Non coronavirus Hospitals
1166	1252448562652348416	Trump offers PH add l assistance to fight Covid 19 BestArticle
1167	1252448564116180993	Public health experts Parks are a safer bet in the age of coronavirus
1168	1252448564497666053	Garden exercise bake eat repeat
1169	1252448564715950086	Humanity vs COVID19 what a thing I know it s been weeks but it s still fucking mind blowing Be safe out there
1170	1252448564732665857	You must be new here
1171	1252448564892127233	Of course this is from the trump led CDC that debt faulty defective COVID 19 tests told the American people in Mar
1172	1252448565894529028	Coronavirus doctor s diary The patient who married hours before dying Dr John Wright re
1173	1252448565911326722	We ll miss you Julia You took such great care of so many of our kids Thank you and God bless
1174	1252448568830558210	Soon everything is gonna be alright and the COVID 19 of a thing will be history In Shall Allah
1175	1252448569258389508	Black people our numbers are too high Stay home COVID 19 is not a joke
1176	1252448569510047745	Shame on you for posting this picture of a patient who clearly is not able to give his consent Anything for a clic
1177	1252448569690411009	Is 5G technology behind COVID 19 outbreak
1178	1252448569765900293	Global coronavirus deaths pass 170 000 CoronavirusPandemic
1179	1252448569904300032	Well what about you sir Have u said any sympathy words for 42 000 Americans and thousands of other
1180	1252448569912692736	Trump says he ll suspend immigration due to coronavirus offers no details
1181	1252448570130591746	Top marks Susan very well orated amp very important tips for all students regardless of age who are forced to
1182	1252448570709430273	Plasma therapy shows positive result on critical Covid 19 patient Max Hospital
1183	1252448573490442240	bihar Bihar government should learn from COVID 19 period that they should have a proper channel of trackin
1184	1252448574064988160	Why Trump s efforts to blame Obama for the coronavirus make absolutely no sense
1185	1252448575046463488	Fauci US Economy Won t Recover Until Coronavirus Controlled BestArticle
1186	1252448575063130112	Shake Shake will benefit greatly from this move
1187	1252448576292225024	This clown blaming immigration Obama China for the Coronavirus Blames Obama for not havi
1188	1252448576690511874	My advisor lost her mother to covid 19 this week
1189	1252448576896217088	Done readallthebooks coronavirus ShelterInPlace Before the Fall
1190	1252448577084887040	BillionShields Challenge is here I challenge you to SaveTheWorld thanksdoc from Coronavirus
1191	1252448577185513472	LOL I like s style with SocialDistancing What s your favorite place to get some Cajun food
1192	1252448577441366016	The not so easy to forget impact of COVID19
1193	1252448577697263618	I m supporting care workers to StopTheSpread of coronavirus Sign and share to help care workers get the resource
1194	1252448578338828289	This is why neoliberals should stay the fuck away from Reason and most of the Cato Institute
1195	1252448578795999233	Your objective is to lessen people with Covid 19 Solusyong medikal pls
1196	1252448581606232064	This rat must be destroyed to prevent further Chinese virus spreading throughout the world
1197	1252448581803323394	Imagine he just announced that he had COVIS 19 Coronavirus stricken GeorgeStephanopoulos ignores mask mand
1198	1252448582285832199	Israelis Running Tests on New Breath Analyzing Device to Detect COVID 19 in Less Than One Minute
1199	1252448582428434432	What a tweet
1200	1252448582621421568	I see so many tiny cracks where coronavirus can sneak through
1201	1252448582713688065	TDS much You just don t get out much either right They re still clamoring to come here flu virus
1202	1252448584462675968	COVID ALERT CNN s Brooke Baldwin Details Just How Different Coronavirus Feels From The Flu Global Pandemic News
1203	1252448584911355904	Once again GOP 1 use STUPID GULLIBLE ppl 2 do their dirty wrk 2 STAY IN POWER keep stocks frm plummeting ppl voti
1204	1252448584936697856	COMMUNIST CHINA has been the big winner from GLOBALISM The WESTERN DEMOCRACIES have all lost and now China gi
1205	1252448585683275776	That can t be possible for only 250k
1206	1252448585779572737	Google launched a commercial zerotrust remote access service that enables WorkFromHome employees to access inter
1207	1252448586471739392	I still didn t get to read her research yet as I just finished my last final this afternoon However she states in
1208	1252448586899623936	COVID 19 Marion prison home to one of Ohio s largest outbreaks CoronavirusOutbreak covid19
1209	1252448587490918400	Stephen Miller s dream and designed to set the news cycle for the week
1210	1252448589206499328	Times of India Live Covid 19 positive case found in Rashtrapati Bhavan
1211	1252448590770954242	Idris Elba wants whole world to lock down for a week every year to remember coronavirus
1212	1252448591509106688	Anyone had a test What does it consist of Swab COVID19
1213	1252448591525769216	Worst of Covid 19 will come May 2 8 says AMLO but Mexico is ready
1214	1252448593950191621	CHICKEN EMBRYO FORMALDEHYDE CALF BOVINE SERUM MONKEY KIDNEYS
1215	1252448594344292352	reveals why he chose not to announce his donation amid Coronavirus pandemic
1216	1252448595103690752	Oh if only we had a leader over here who could explain things so rationally amp clearly pipedreams
1217	1252448597947236356	He gets his medical insight from Putin As the pandemic has swept the globe it has been accompanied by a
1218	1252448598576582658	These examples are just the ones that made headlines Expect that a many other players were sidelined with flu li
1219	1252448599071309824	Gov J B Pritzker of Illinois provides a daily update on the COVID 19 pandemic watch live video stream now
1220	1252448599222321152	6 of Americans have lost their jobs Less than 1 of Americans have died from the coronavirus
1221	1252448602229813248	Great work
1222	1252448602359844866	Doug Saunders on covid19 as the nationalists dream borders closed to both immigration and trade
1223	1252448602489786369	Welcome to our new normal newnormal COVID19 ai art transfer
1224	1252448603228049408	Coronavirus Impacts Make LUV Southwest Airlines World s Largest Airline
1225	1252448603605434369	He watched Fox and believed it was under control New York bar owner dies of COVID 19
1226	1252448606990237696	In the rush to return to normal use this time to consider which parts of normal are worth rushing back to Dave
1227	1252448607795585025	The latest Khaopan Thanks to covid19
1228	1252448607854366720	Is it true for covid19 We need docs to explain to us We should avoid the same mistakes
1229	1252448608001105923	Media Restrictions a Blow to COVID 19 Coverage Kyrgyz Journalists Say BestArticle
1230	1252448608890339330	The Infection That s Silently Killing Coronavirus Patients
1231	1252448608944824320	The biggest threat to America is not COVID19 It s now gone full off the rails
1232	1252448610001711104	I thought I read somewhere that this manufactured coronavirus has HIV DNA present
1233	1252448610047811584	Constitution Law Expert weighs in on legality of state shutdowns No constitution gave them that power
1234	1252448610324754437	Stay strong Sis you got this
1235	1252448610496765952	Countries Reopen After Flattening Coronavirus Curve BestArticle
1236	1252448611155226624	Seriously I can t believe this year is really happening The Post Office deal is insane they were on fucking p
1237	1252448611981549569	Sisters die 102 years apart one from the Spanish flu the other from coronavirus
1238	1252448612115767298	You mean calling the Covid 19 a Hoax by the Democrats and you took no action
1239	1252448612249997314	LLC Um Sweden didn t do so great on this y all
1240	1252448614145839104	L I A R please stop
1241	1252448614506467330	UPDATE Coronavirus status worldwide 2 481 528 cases 170 439 deaths 647 734 recovered
1242	1252448614745378817	ALL THE DATES ON THIS LIST FOR HIS RALLIES ARE ALL ON YOUTUBE SO YOU CAN VERIFY THESE ARE TRUE
1243	1252448615638818816	Speaking of recovered COVID19 patients how is Senator Pimentel doing pandemicdiary
