	tweet_id	tweet_text
1000	1250641991937019904	This fantastic Webinar on lung US for COVID19 is going to be exciting My favourite topic by my favourite educat
1001	1250641992058429440	That sounds really great Humanity is alive and we ll definitely win
1002	1250641994025783296	WHO Thanks India For Using Polio Surveillance Network In COVID 19 Fight
1003	1250641994218528768	COVID 19 Update CDC Issues Interim Guidance on Safety Practices for Critical Infrastructure Workers Who May Have H
1004	1250641994294202368	How Greece is beating coronavirus despite a decade of debt
1005	1250641994336161793	Covid 19 myths Stay home Stay safe My Gov who unicefindia medicholics unicef aiims delhi india I P Extension
1006	1250641994340356103	Coronavirus vaccine when will we have one
1007	1250641994805907459	It was about the economic conditions and in relation to his earlier comments The man just speaks ho
1008	1250641994881232897	WOW US explores possibility that coronavirus started in Chinese lab not a market
1009	1250641995116109825	well i have to say what i believe now while blaming china is good news truth be told a outbreak every 100 years
1010	1250641995309019136	Tomorrow I get to take the garbage out I m so excited I can t decide what to wear QuarantineLife SocialDistancing fashion COVID19
1011	1250641998287011841	There s an entire nation of people who need you to succeed Amy Don t let up DitchMitch2020
1012	1250641998865932288	Take the time to view the visual curve for each state and you ll get a better understanding of where this is heading
1013	1250641998882705408	for reallifemag grapples with the Global War on coronavirus and the difficult politics of crisis
1014	1250642000153587713	Son of Anson Place resident hit a brick wall trying to get mom out Then she tested positive for COVID 19 Gran
1015	1250642001776836610	Let s do this part forever
1016	1250642002707804166	Hi everyone I am humbly asking for your time to read our campaign for the Filipino Health Workers Kailangan natin
1017	1250642003450146821	Of course he is unhappy it interrupts his worldwide agenda for control by the elite BillGatesIsEvil
1018	1250642003500560384	I want to of course personally stay alive and make sure everybody else stays alive as well but honestly this pandem
1019	1250642003580329984	It s gonna be lit When have I lied Prepare for post coronavirus revolutions
1020	1250642004066709504	A doctor admits That the government is paying doctors to diagnose coronavirus based on assumptions
1021	1250642004318408704	i dint know if you guys have seen read this yet but i find it very interesting
1022	1250642005803307008	Every one of these folks were asymptomatic None of them had a fever and none of them reported symptoms So this
1023	1250642006633783297	Starting tomorrow we will start our discussions with international health organizations on how to ensure the deliv
1024	1250642007040462848	China s contradictory propaganda Surely some diplomats know that outside the world blames China that the propag
1025	1250642010303758336	Yes you read that right Asia s economic growth will grind to a halt for the first time in 60 years
1026	1250642010622459904	Take up the yellow man s burden the savage plague in peace to shield the mouths of coughing in hope the sickness ce
1027	1250642011880734720	Wipro s outlook impact IT stocks TechMahindra infosys stocks drop Sensex nifty stockmarkets
1028	1250642012199702529	Brazil congress demands Jair Bolsonaro release results of his Covid 19 tests
1029	1250642012736389123	Not up on the news are you
1030	1250642013080489984	AI 5G Covid 19 and the Canadian Choice with Cyrus A Parsa via
1031	1250642013118255104	soo all you artist are we gonna get a bunch of new music released when this coronavirus bs is done or
1032	1250642014858813440	South Korea and China earn high marks in pandemic safety ranking
1033	1250642014934196224	Fang Fang kept an online diary about lockdown life in Wuhan that comforted millions of Chinese including me during
1034	1250642016171589632	Are you worshipping Pombe ya Tanzania surely
1035	1250642018151403521	I was cancel flight 18th April 2020 DEL to CCU PNR N11U2M due to coronavirus As the govt declare
1036	1250642018545565696	South Korea briefly had the world s second largest outbreak of COVID19 but it was largely brought under control th
1037	1250642020227411971	As the World is fighting the Coronavirus Pandemic Jim Acosta is criticizing President Trump for withholdin
1038	1250642020319875072	Protesters clog streets in Michigan over Whitmer coronavirus stay home order via
1039	1250642023649906689	Also i didnt know it was a medical profession I thought it was always a medical PRACTICE
1040	1250642024228769795	Roque says Duterte willing to stop infrastructure projects just to free up more funds for COVID 19 response
1041	1250642024396537856	j putin It feels like evil Donny is turning towards Russia again these days d
1042	1250642027127230465	COVID 19 IMF Predicts Zero Asian Growth Korean Ruling Party Gets Election Lift
1043	1250642027504521216	My office shoes my office bag must be thinking that I am no more COVID19 humorcoronavirus
1044	1250642027621965824	BBC News Coronavirus The unexpected items deemed essential
1045	1250642027835912192	No but surely a COVID19 patient will do He ll also help you keep clean n fresh by spittin
1046	1250642028712660992	For Centenarian Survivor Of 1918 Flu Pandemic Coronavirus Is Just Another Problem
1047	1250642032055517184	US explores possibly that Coronavirus started from Chinese Lab and not Chinese wet market
1048	1250642032395120642	Former NYPD Commissioner Condemns Officials Using COVID 19 to Trample Americans Freedoms
1049	1250642032621752321	Nervous Nancy Deletes Video of Herself in Chinatown on February 24 Downplaying Coronavirus But the Internet is Fo
1050	1250642033187991552	Law firms brace for surge in divorce cases during coronavirus lockdown
1051	1250642033330606080	sam problem solved
1052	1250642034970562561	Coronavirus 65 doctors infected across Bangladesh so far
1053	1250642035121373184	coronavirus vaccine Six Indian companies working on COVID 19 vaccine many challenges in finding a preventive Exp
1054	1250642035616423938	Lolz
1055	1250642036367261697	n TX Visit this guys timeline ITS VERY SOLID
1056	1250642036518039552	However Roque said the government recognizes the need for businesses to continue their operations amid the COVID19 crisis
1057	1250642036841017344	China Covers Up Coronavirus for Weeks Now They are Top in Zoom Corporate Espionage Foreign Spies Target Zoom
1058	1250642037038288896	3 Black Female ER Doctors Launch Free Telehealth Service For Marginalized Communities To Deal With COVID 19
1059	1250642041073070080	Don t push him
1060	1250642041882603521	Coronavirus India Live Updates IMF Backs India s Proactive Response All Major Cities Marked Red In COVID 19 Lis
1061	1250642041949704192	COVID19 What the world can learn from Kerala about how to fight covid 19
1062	1250642041991761926	Climate Models and COVID 19 Models
1063	1250642043640131584	That s right we want our state opened up and all the parks The business in this state need to be open and The Pres
1064	1250642044160299010	BBC News Coronavirus Social care concerns revealed in leaked letter
1065	1250642044533473282	Sources believe coronavirus originated in Wuhan lab as part of China s efforts to compete with US coronavirus
1066	1250642045175119879	so the CEO of the insurance company I work for in Sydney Hollard has taken a 100 pay cut until Covid 19 has comp
1067	1250642047972839425	Here s what parents need to know about COVID 19 and face masks for kids Hint They re not a substitute for social
1068	1250642048039829504	COVID 19 in detention prevention protection and information for visitors via
1069	1250642048157396992	What US funding cut means for WHO s fight against coronavirus
1070	1250642048677543938	on rebuilding the higher education system after the pandemic The question now is whether we heighten
1071	1250642050384572416	Sean McVay confirms Rams Brian Allen tested positive for coronavirus says he s on the road to recovery
1072	1250642050468524032	Carlson29 Didn t write anything about GC Am saying that schools are not the
1073	1250642052271964161	Where have you all been for 8 weeks Back locked in the Capitol basement again devising amp chasing lies about Presi
1074	1250642052485914624	Ways to deal with staying at home WHO Tips COVID19
1075	1250642052494143488	Gujarat govt refutes Indian Express concocted lies on civil hospital segregating coronavirus patients on a religio
1076	1250642052586655746	Possibly the only time in my life I ve agreed with Nadine Dorries but I completely agree with this Repeated questi
1077	1250642053400350723	Meanwhile HungerVirus Coronavirus
1078	1250642086883471360	Not just China the W H O House and Senate Democrats but also the propaganda arm of the Dem Party the so called
1079	1250642091396358144	Your low t cell levels must be messing with your brain functions
1080	1250642091845144577	Although it is already crystal clear that the virus started from China the Chinese are still denying the facts and
1081	1250642092130365440	Here s the detailed review of a Chennai city resident about his Covid 19 testing experience Team GCC works hard
1082	1250642092537176064	WHO Do not follow Trump s knee jerk reaction It s to cover up his inaction WHOfunding
1083	1250642092591702016	Wife s COVID19 test came back negative and that s a positive
1084	1250642094441426944	And then there s this
1085	1250642094810714114	Two more years of social distancing will be followed a Harvard University study reveals read full article
1086	1250642095032815616	Bayes Rule Unreliable Diagnostic Testing And Containing COVID 19
1087	1250642095053787136	COVID 19 has taken the focus away from the ongoing impact of the summer bushfires Together with Aus we have
1088	1250642095490113538	The Cardinals are one of the teams who enlisted voluntary participants from various departments in their organizati
1089	1250642095741603841	I m from Bengal amp the Situation is worst in Bengal Government is Hiding the data of covid19 case Stil
1090	1250642097868333057	64 It was about the economic conditions and in relation to his earlier comments The man just speaks horrib
1091	1250642098740555777	KNBR really likes anything Coronavirus
1092	1250642098744745985	I think Covid 19 has produced more Gila May then ever
1093	1250642099126431750	Coronavirus Lockdown UK Economy Could Shrink 35 This Quarter via
1094	1250642101815193601	Dictator Daniel Ortega reappears without any plan to face the Covid 19 pandemic
1095	1250642102314127360	Should the KRLCommuterline service be suspended to curb the spread of COVID19
1096	1250642102721093632	Nobody died in our hospital we have been on break due to coronavirus LekkiHill
1097	1250642102960091138	The center cannot hold COVID 19 fractures food supply chain
1098	1250642103962664960	K Yes I would only agree with this if it assists them wherever they are to combat coronavi
1099	1250642104113664000	How Africa s tech innovators respond to the coronavirus pandemic
1100	1250642104524521472	Pix Australian Jobs COVID 19
1101	1250642107221585923	Apple is Making Use Of Data From Maps to Curb Coronavirus Spread
1102	1250642107917885440	Bengals
1103	1250642108098191363	For those of you overwhelmed by money health access to goods grief loss and loneliness I m sorry You are no
1104	1250642110463700994	Support Claire by signing Support the USPS and I ll deliver a copy to your officials too
1105	1250642111461904385	Agree with MP regarding all international institutions like the need major reform Dictator countr
1106	1250642112368041984	I live in a care home for vulnerable people The staff will be tested but the residents will
1107	1250642112527208449	aMeRiCa iS tHe GreAteSt cOuntRY
1108	1250642113198514179	Coronavirus Has Passed the Peak and the U S to Reopen Soon
1109	1250642113600958465	Perhaps They Knew What Was Going On BOOM President Trump Accuses WHO of Knowing the Dangerous Nature of Corona
1110	1250642113966018560	Chris Cuomo s wife diagnosed with coronavirus
1111	1250642114939142149	Surprise
1112	1250642116818001920	Americans Begin Receiving Coronavirus Stimulus Checks via
1113	1250642119666143245	SmartCompany RT peterxing Funding worries community values and hunting for opportunities How Aussie startup fou
1114	1250642119733112833	you re the man 51
1115	1250642121272389632	The worst part is that they are taking it home to family and friends
1116	1250642121322872833	I have a feeling we ll be hearing more about the possible origins of the Coronavirus in the coming weeks If this
1117	1250642121654022144	sister just said a youtube video said so so it s right god how i wish coronavirus targeted low iq people
1118	1250642121876402176	Opinion What explains price volatility of especially vegetables amid COVID19 asks Parikrama Chowdhry
1119	1250642121947668480	Updated State Tax Relief Available Due to COVID 19 Crisis by
1120	1250642123566678021	And s amp s disastrous handling of it not to mention their blatant corruption will hand Dems
1121	1250642123734556672	Isn t this the same man that also called it a Hoax said it would disappear or that warm weather would mak
1122	1250642123906482176	UPDATED 12 dead as Nigeria s coronavirus cases rise to 407 via
1123	1250642124175020033	knowtheirname morethanstatistics forever remembered
1124	1250642124183388161	COVID 19 be like
1125	1250642124393119747	Image of the Day Tokyo Narita offers cardboard beds to travellers awaiting COVID 19 results
1126	1250642125160677376	Trump Accused of Actively and Knowingly Spreading Coronavirus to Central America Through Deportations
1127	1250642125320073216	2 MILLIONS plus INFECTED Breaking Update COVID 19 CORONAVIRUS PANDEMIC DEATH TOLL Cases 2 083 326 D
1128	1250642125722718209	has many questions for the Modi government about how the the COVID 19 pandemic is being handled and th
1129	1250642127622737920	Office lookin good tonight Thanks to everyone on the front lines
1130	1250642128138469377	People have a harder time understanding the threat of the unknown than that of what they have so routinely experien
1131	1250642128549470208	Western Sydney s first drive through COVID 19 clinic to open
1132	1250642128788733952	CoronaVirusUpdates Closed Cases CoronavirusPandemic coronavirus COVID 19 CoronaOutbreak
1133	1250642131863040001	Unadulterated Bullshyt these Cretans do not deserve any GOP giving peanuts to the majority of hardworking Ameri
1134	1250642132152524801	German lawyer sent to PSYCHIATRIC WARD after mounting serious resistance to unconstitutional Covid 19 lockdown
1135	1250642132680839168	don t you mean the best state WeAreNumberOne
1136	1250642135898079233	I hope come November America will see sense and vote out of office for
1137	1250642136963387393	Tomorrow at 2pm CDT join HomeInstead for a FacebookLive to learn tips on how to positively manage your mindset du
1138	1250642137911353344	So glad to see this
1139	1250642140088209409	COVID19 is far from the great equalizer The higher the income bracket the safer you are
1140	1250642140616462336	For those earning 1 million annually a tax break buried in the recent coronavirus relief legislation i
1141	1250642141425987585	Would you look at that being defiant and imposing your rights actually gets you somewhere Kakareklamo mo yan Mayo
1142	1250642141489045505	Hollywood Elitist Rita Wilson Whines About Temporary Nausea Dizziness After Taking Cholorquine To Cure Coronavirus
1143	1250642142298595328	I never imagined this would happen
1144	1250642142382321665	All private health insurance companies should have a cap of 2 net profits Every dollar over amp above that amount
1145	1250642142537670657	Read
1146	1250642142671917056	Every Muslims who love their Families should come out and condemn like Salman Khan COVID19
1147	1250642142923558912	Nancy saw the same CDC WHO reporting as the President Yet this is 2 24 20 Nancy Pelosi Visits Sa
1148	1250642144512991233	Lockdown Quiz Do you know the answer Coronavirus COVID2019 CoronavirusOutbreak Lockdown QuestionOfTheDay
1149	1250642144525606912	No we don t We need the sun to shine hot as we ve just got 1st case of COVID19 in city
1150	1250642144974581760	She s too busy bragging about her 12 00 per pint Jeni s ice cream is a fraud
1151	1250642145297469440	WestJet lays off 1 700 pilots amid COVID 19 pandemic
1152	1250642145691590658	How bad of a journalist do you have to be not to notice the Wuhan Institute of Virology which just so
1153	1250642148531134464	ADAM VS THE MAN Coronavirus guidelines from anonymous
1154	1250642150058065924	Coronavirus Fears of spike in poaching as pandemic poverty strikes
1155	1250642150552858624	You can now track information regarding your stimulus payment here It seems some people don t appear on the IRS
1156	1250642150758350849	GOP Buried Overwhelming Benefits for Millionaires in COVID 19 Relief Package via
1157	1250642152939384832	COVID 19 Sickens Some Members Of Congress Forces More To Quarantine NPR Look at all the Rs in the Senate Wha
1158	1250642153044275203	These people are literally insane and irresponsible
1159	1250642153107226626	just saw fox news say that covid 19 started in a chinese lab great as if there already wasn t huge amount of ra
1160	1250642153732280322	check mate coronavirus
1161	1250642154009038849	Evangelical academic decries spread of coronavirus conspiracy theories Gullibility is not a Christian virtue
1162	1250642155183333378	As employers eventually shift to recovery from the impacts of COVID19 looking at their employer sponsored
1163	1250642155720396801	Start of free provision of online denture consultation that allows you to consult a dentist who specializes in de
1164	1250642155825135617	Impact of new coronavirus on children under abuse and poverty
1165	1250642156231880705	This is a virus that cannot be careless COVID19 COVID Come on go
1166	1250642156869517313	How can this be explained to very ignorant idiots
1167	1250642156944945152	Major stock indexes in the region traded lower on Wednesday as the COVID 19 pandemic continues to rage worldwide a
1168	1250642157012213762	This makes me sick 4800 deaths in one freaking day In our great country Smdh We should ve been better prepa
1169	1250642157704110080	Maintaining Our Humanity Through the Mask Mindful Communication During COVID19 a new paper in the Journal of the
1170	1250642158178074627	It s been a pure disaster People are desperate You are tainted by your master Trump
1171	1250642158253535232	Anyone else remember when this same minister invented a DDoS As I write about this app I cannot help but recall
1172	1250642158983483393	I hope this is true As always I ll be tweeting daily number of new tests every day at noon so you can see for you
1173	1250642159356784640	What about the other 2 consignments brought to SL amp PL these hand soaps to be thoroughly tested it could be Hazar
1174	1250642161432920064	US friends this might interest you EXCLUSIVE Trudeau gave 830K for COVID19 research to WUHAN LAB suspecte
1175	1250642161462321162	The coronavirus got me looking like 12 Years a Slave Free my Barber
1176	1250642161974104065	You first
1177	1250642162271662081	Why we re tracking every US health worker who dies from coronavirus US news The Guardian
1178	1250642162699702273	COVID 19 can cause stroke seizures confusion and coma Some patients develop neurological symptoms such as loss
1179	1250642162859028480	Body condoms for the Coronavirus coming soon Design your own too
1180	1250642166155747331	Follow the steps for COVID19 and be Survivor StayHomeIndia StayHomeSaveLives IndiaVsCorona NarendraModi
1181	1250642167246262277	I feel like we would be done with covid 19 if it weren t for that bitch Carole Baskin
1182	1250642168357634048	the strategic and timely use of the already existing India field sta
1183	1250642169267970048	SEBASTIAN SHAKESPEARE Old Etonian mercenary Simon Mann has tips to handle coronavirus lockdown
1184	1250642169624276992	This is what Class Integrity Humility and Kindness looks like Take note world leaders bankers CEOs and the li
1185	1250642169892765696	That is nice of the WHO to let us know that I would have been more impressed if they would have let us know
1186	1250642170639519745	Someone please tag our dear Mufti muneeb amp other so called ullema Are they adopting jewish methodology
1187	1250642170744172544	Why recovery rate is less in AP compared to other states Coronavirus
1188	1250642171268673536	Ask nguyo why most retailed masks don t have KEBS watermark ama pia wao wako self quarantine before covid 19
1189	1250642171604209665	Ummm it comes from CHAI NUH Trump Voice COVID19 facemasks CoronavirusPandemic ChinaLiedPeopleDied
1190	1250642173789270017	Insane shouldn t this be major SAVE the hedge funds and the oil and fracking companies AmericaFirst
1191	1250642174728781824	Name Coronavirus Nick Name Covid Age 19 Cast SARS COV 2 Father China Place of birth Wuhan GF US X
1192	1250642174896734208	BREAKING New Memo Shows China Knew Coronavirus Was Highly Contageous But Kept it Secret
1193	1250642175458672646	Do it tell Trump sir step back 4 college defermants and one medical fake bone spurs You bowled on the team With t
1194	1250642175702052864	3 7 Million Grant to Wuhan Lab at Center of Coronavirus Outbreak
1195	1250642176079519744	1 They should make every stimulus check to normal people out for 12 000 not 1 200 dollars 2 Ric
1196	1250642179443179520	COVID19 is not partisan So unless death s touch you ple
1197	1250642179770343424	If this is true WTAF
1198	1250642180458217472	Hyderabad on high alert after city reports 33 new COVID 19 cases in a day total at 249
1199	1250642181963968514	huge fan of yours But you support an organization that won t recognize Taiwan or help them in a Pande
1200	1250642182920421376	COVID 19 Don t take small social risks during coronavirus pandemic epidemiologist pleads
1201	1250642183536992263	Dear Customer due to the Coronavirus effect and sudden crisis in situation the order got delayed Hope to
1202	1250642183545401344	South Korea s ruling party wins election landslide amid coronavirus outbreak World news
1203	1250642184694575104	Yes I will
1204	1250642184975446016	California Set the Tone on Coronavirus Shutdowns What s Its Next Move
1205	1250642186204397568	It was your story that prompted this conversation
1206	1250642186586271747	here is someone tracking us healthcareworker deaths
1207	1250642186682667008	FAKE NEWS What other theories Liars
1208	1250642187110367233	At this point I have no words for these greedy conniving selfish bastards except I hope they ALL get COVID 19 now
1209	1250642187160653824	COVID 19 Isn t the Only Virus to Fear Cybersecurity Attackers Target Hospitals Amidst COVID 19 by Law
1210	1250642187253157889	Feds will not subsidize nanny states with low COVID 19 rates The money will run dry and then an
1211	1250642187299192833	Check this out
1212	1250642187831803904	Digital Supply Chains and the impact of the Covid 19 Coronavirus a chat with Richard Howells
1213	1250642190432235520	Photojournalists Struggle Through the Pandemic With Masks and Long Lenses
1214	1250642191225106433	I have a friend who is 70 yrs old and learned a couple she knows died within hours of one another COVID 19 ended t
1215	1250642191392755712	Please take action
1216	1250642192202436610	BAJACALIFORNIA In just one day coronavirus cases in Mexicali rise to 207
1217	1250642194727350273	Gen Jack Keane China had their hands all over the spread of coronavirus
1218	1250642194794524672	Tag your covidiot of choice mine is the one holding the I JUST WANNA MOTOR BOAT sign Toddler mentality You
1219	1250642195096334336	Trump thinks reopening our country soon is a great idea Yes seriously I m thankfu
1220	1250642195201183746	David Squires on the coronavirus hot take factory
1221	1250642195318784001	How many of them will be dead of Covid 19 a month from now
1222	1250642195373125633	Agree
1223	1250642196056989697	As per below RT this is a really a good news for India thanks to all States governments efforts amp decisio
1224	1250642196522549249	Coronavirus right now C mon I mean at least make this a challenge
1225	1250642196795060224	Congress must dream big to address the pain of covid 19
1226	1250642201367007232	Over 100 Christian Families Denied Food Aid Amid COVID 19 Crisis in Pakistan Persecution
1227	1250642201576714240	Prince George s godfather donates over 15M to coronavirus relief in Britain praises health workers
1228	1250642202893656064	US marks record 2 569 coronavirus deaths in 24 hours Johns Hopkins
1229	1250642203136782336	As dangerous as it sounds is a domestic terrorist Period
1230	1250642204512514048	Good It s literally the least we can do but it s a start
1231	1250642205082939392	Compared even to nations like Germany that have earned plaudits for their response the number of deaths in Japan
1232	1250642205183627268	This is the headline from Trump claims NYC inflating its coronavirus death toll THAT S NOT WHAT
1233	1250642206697885699	Spread of Coronavirus Prompts Changes in US Immigration Policies
1234	1250642207041675266	Brazil s Amazonas state warns its health system overwhelmed by coronavirus
1235	1250642207247405057	US explores possibility that coronavirus started in Chinese lab not a market
1236	1250642208228651013	Given resurfaced talks about COVID19 origins from the Wuhan lab today it s worth to indicate that despite the cc
1237	1250642209629777926	How To Protect Yourself From CoronaVirus Covid 19 2 Avoid touching your eyes mouth and nose
1238	1250642211412140032	Navy May Reinstate Fired Captain to Command of Roosevelt
1239	1250642211424919552	is this okay during the COVID19 pandemic Is there social distancing happening Happened tod
1240	1250642211634470912	This has been hard but I am lucky to have a good household Stay safe
1241	1250642212096000004	Big names in agri value chain contribute to COVID 19 fight
