	tweet_id	tweet_text
0	1250635754063171584	Hi Chris sorry to hear Kristina has the Coronavirus It seems that you re getting better your facial
1	1250635754348466176	GOD IS GOOD
2	1250635754725797888	But you should definitely go back to work because declines in your 401K are far worse than this
3	1250635756718174209	But is she concerned yet
4	1250635756852269056	NEW PODCAST Freedom of speech is one of our to quote Justice Carpio one of our greatest freedoms We talk Chavez
5	1250635757242462208	Meanwhile some idiots in Michigan
6	1250635757418459137	Correct
7	1250635757468999680	In short he used Brian Allen s Rams backup center medical history tested positive for coronavirus
8	1250635757640876033	You have to wonder what they re doing in MI
9	1250635760723570689	WUHAN CHINA At a large food market in the Chinese city of Wuhan signs forbid the selling of wild animals and l
10	1250635761029754880	Positive News
11	1250635761088524288	Being Indians we maintain good enough hygiene there anyway But oh there is a study detailing how coronavirus spreads thru poop
12	1250635761390686209	Root cause for the backlog for these doctors is Q hogged by cheap fake proxy h1b IT workers from India Address
13	1250635761453420544	Govt of India Need to use plasma therapy and fight back against corona
14	1250635761503866880	Oh my Did CNN just call it a Chinese lab Isn t that racist
15	1250635761956708352	Adds to the conspiracy and makes it true
16	1250635762976141313	he IS coronavirus
17	1250635764829995008	It is too soon to say They might find a treatment amp maybe a Vaccine
18	1250635765282820096	Said this weeks ago
19	1250635765534449665	Stay Home coronavirus
20	1250635765735972864	Gravitas 5 questions WHO must answer Wuhan Coronavirus via
21	1250635765920362497	How I ve been remembering these CDC guidelines TikTok comedy StayAtHome TheChallenge COVID19
22	1250635766218268672	You may have misunderstood the announcement of count totals are a sham Not everyone affe
23	1250635766297849856	Thank goddess
24	1250635766792847361	All the humans that Thanos snapped from existence didn t have to live through the Coronavirus LUCKY
25	1250635769141555200	Make this make sense
26	1250635769699381250	Terrible beyond comprehension
27	1250635770441936896	He gives the best hugs on the hardest days Another loved one lost this time courtesy of the coronavirus Third
28	1250635770739585024	The Crappler Report PH among riskiest countries to be in during coronavirus pandemic via
29	1250635770815115266	An old friend of mine just died of Covid19 We used to go to Burning Man together in the 90 s I still have a c cla
30	1250635770857164801	just made us wait an entire day a day that of which had a potential historic trade rumor swirling among
31	1250635771133992962	Obviously he doesn t take coronavirus as serious as he says Why would you give it to your family
32	1250635775118462976	The most misleading cliche about the coronavirus is that it treats us all the same It doesn t and before long thi
33	1250635775395454979	I am so sorry to hear about your Aunt Bert This is Brutal and it s serious At this horrific time we have a lead
34	1250635775483367425	A senior figure at the company behind a major NT resources project does not expect coronavirus restriction measure
35	1250635775881830400	So LA s traffic has ceased LA s trafficking has not
36	1250635776120909824	How do you spell appeal
37	1250635777249247232	Coronavirus symptoms 10 key indicators and what to do CNN WISH I DIDN T HAVE TO LOOK AT
38	1250635777425330176	if you think 5g towers are causing coronavirus you can go ahead natural selection will do its job nicely
39	1250635777446424576	this part isn t just hard it s rock solid
40	1250635778247581696	TablighiJamaat leader Maulana Saad Kandhalvi has been booked for culpable homicide after some attendees of the rel
41	1250635778763501570	Israel Shuts Palestinian Coronavirus Testing Clinic in East Jerusalem Activists arrested because kits were provid
42	1250635778771677184	Yeah and old Elvis in the front probably won t fair too well either
43	1250635781380534272	Provide quick access to the latest most accurate local information through IBM Watson Assistant for Citizens Get
44	1250635781565276160	Testing all staff PSWs seems so elementary to me LTC residents are not sauntering around the grocery stores ming
45	1250635781737197570	BRIEF Maccura Biotechnology s Coronavirus Testing Kit Receives U S FDA s Emergency Use Authorization Reuters
46	1250635781997318145	COVID 19 and African Americans JAMA JAMA Network
47	1250635782122901506	I just read that the auto protest in Michigan went right by a hospital That s ridiculous and it was
48	1250635782160875521	Andrea Bocelli s Easter concert from Italy sets a major record for classical music
49	1250635782693347329	In January World Health Organization declared a global emergency because of coronavirus That was 4 weeks before
50	1250635785851875332	Report Migrant workers faced dangerous conditions even before COVID 19 Cronkite News Arizona PBS
51	1250635785876865024	Who Should Notify OSHA of a Workplace Injury During Multi Employer COVID 19 Essential Work by attorneys
52	1250635786313256962	Love it here here s twice the evidence
53	1250635787210801153	Science says that Laura Ingram and her right wing conspiracy theorist sources are idiots
54	1250635787982405632	The Government has withheld crucial information for the discussion The Doherty Institute modelling
55	1250635789920342020	Fuck you Covid 19
56	1250635790511566850	Check out my latest article Offering Queue Pro and OSSP for maintaining social distance to ensure your customer
57	1250635791694540802	Cardi B singing Coronavirus Coronavirus That shit is real That shit is real
58	1250635794080923648	Fuk Triads n LeekarShing and Ccp WeWon YouLost
59	1250635794760466433	This piece articulates something that s been difficult for me to confront normal isn t coming back Not for a whil
60	1250635794844442624	Is there a dumber person
61	1250635795393896453	Leading and Managing Through the Coronavirus Crisis Legal Talk Network
62	1250635796341821443	The Definitive Guide To Dog Care During The COVID 19 Pandemic animalhealth healthcare
63	1250635798065459210	TOMORROW Learn more about the JobKeeper assessment process and how to calculate GST turnover in line with ATO req
64	1250635798443147264	WHO welcomes joint efforts with India to fight COVID 19
65	1250635799131029504	Headline says all It was just March 11 that W H O declared COVID 19 outbreak a global pandemic To
66	1250635799839641600	get well soon COVID19 44
67	1250635802612121601	BBC It s the end of globalisation as we know it All major economies have been hit almost at once It s done da
68	1250635803153268739	Coronavirus and Elections Changes Increase Risk of Voter Fraud via
69	1250635803715186690	Should have known that corporate greed and corruption would suck up the aid One restaurant chain got enough money
70	1250635803941761024	Fauciand Birx s fake advice resulted in near total lockdown of USA economic Armageddon published editorial in NEJ
71	1250635804331913221	This is why dems are mad at trump for cancelling WHO
72	1250635804650676229	Local businesses are starting to receive federal loans to provide relief during the COVID 19 pandemic Now the Kas
73	1250635804843507715	It s always the commies at heart of the problem commie ChinaVirus
74	1250635804881256448	method of picking our crops There are better ways to get the crop in They are not necessary It is just anoth
75	1250635806735122432	We can t allow the lockdown to slow down our life saving work for animals Will you support PETA India s emergenc
76	1250635806823329793	Dr Fauci caught on camera contradicting himself about severity of coronavirus video Must see
77	1250635807381168128	I m a proponent of capitalism but to the extent it turns is into lowing cattle I m beginning to think it works too
78	1250635807506849793	The President is an evil piece of shit and America is a wook covid19 breadlinesforcapitalism thepresidentisinsane
79	1250635808404455425	Although the COVID19 pandemic has caused disruption to businesses worldwide says its supply chain is
80	1250635808530468865	Attention The long awaited podcast from Dr Umar Johnson and Bro Michael Muhammad is now available Dr Umar di
81	1250635809205542913	I ve watched WWE since I was 12 went to the local video store and rented King of the Ring 98 Mankind Taker HIA
82	1250635809247629313	US President Donald Trump suspended funding to the World Health Organisation WHO over its alleged poor handling o
83	1250635809516118017	Benjamin Franklin s coronavirus advice would have been to socially distance and find a vaccine
84	1250635810786828288	NOW you can generate excellent profits and get FREE vacation incentives Join KANGOT Viet
85	1250635810971570178	Oh my god 4 811 deaths in one day This is tragic Just stop and think for a moment that each number is a re
86	1250635811013267461	Are you talking about the 1 7 million that every one making more than a million dollars will get
87	1250635813169348615	Coronavirus COVID 19 NHL Update March 31st Edition
88	1250635813299408896	Every day and go on TV and brag about what a wonderful job they re doing
89	1250635815547473921	Congrats
90	1250635815635554304	Who gets their mail going commando
91	1250635816180867072	The Coronavirus has ended sports at all levels from professional all they way to little league which includes yo
92	1250635816440786944	I really want to go to Bali it s only 7 hours away Hurry up coronavirus
93	1250635816520626176	stay safe norman reedus everyone really really really love
94	1250635816642031616	Tweet did not age well
95	1250635816671600641	GBP USD extends losses below 1 2500 as risk off favors US dollar GBPUSD Brexit
96	1250635816847712256	the Office of Refugee Resettlement reported 21 new cases of coronavirus among children housed at two facilities
97	1250635819238424576	Americas embarrassingly mediocre coronavirus testing in 2 charts
98	1250635819695714306	US has passed the peak on new coronavirus cases says Donald Trump
99	1250635819976732672	Be smart Be strong Be safe Michigan plz believe the governor s have mo
100	1250635820496642050	People watching Late night shows on 55 4k High Def TVs that are being produced over us with front f
101	1250635820853194754	The Digital Updates You Need To Make For Your Business Throughout COVID 19 COVID19 coronavirusaustralia fitness
102	1250635821092188161	We knew already
103	1250635823449542657	Oh how times have changed
104	1250635823491485698	Michigan has changed their state motto Eat terrible food in an environment that presents
105	1250635824095428608	Yup she really said that
106	1250635824191987713	I m guessing Dennis Miller is trending because his coronavirus infected rotting corpse was found in the woods somewhere
107	1250635825106173954	Coronavirus May Finally Bring Online Car Shopping into Mainstream
108	1250635825240473602	There is a Democrat governor he can veto And should
109	1250635825337061377	Interesting thought
110	1250635825345294336	Moradabad 25 including 13 women pelters arrested for pelting stones at medical team via OpIndia com
111	1250635825454383105	Antibody tests could be the key to reopening Italy s economy
112	1250635828281425921	Ontario COVID 19 cases by age and gender Revised to include fatality rates COVID19
113	1250635828453203968	All the more reason NOT to trust CNN and all other sinister news media organizations that have taken sides with the
114	1250635828503760902	Active smoking is not associated with severity of coronavirus disease 2019 COVID 19
115	1250635828742615041	When I see coronavirus spreading in some countries that Chinese did not travel there a lot I wander how the virus
116	1250635828902211584	Thanks for supporting our hardest hit Nevadans
117	1250635829350936576	Trump or Bush didnt give or do shit a part of congress did the shit bills they just signed the bills Covid19 bill
118	1250635829434867713	I had another dream i m closeted when it comes to my family i live at home they cannot find out i can t sha
119	1250635829447462912	you can t make this stuff up
120	1250635829480849410	As Trump pushes to reopen the economy most of the country is not conducting enough testing to track the path and p
121	1250635831817142272	Do they know that TrumpsChumps are not immune to the coronavirus and Trump doesn t care if they catch it
122	1250635832702033921	good
123	1250635833683570688	get well soon COVID19 45
124	1250635833847148546	LIVE RDocDChannel POTUS Article 2 Powers WuHan BSL4 Source Coronavirus Curve and QQQ
125	1250635834082168832	Area code 1426 I have enrolled for full time studies this year since the Pandemic COVID 19 I have be
126	1250635836426682370	Karnataka reports 19 fresh cases as numbers continue to rise in Mysuru Covid 19 cluster
127	1250635837051568128	J amp K is also among most coronavirus hotspot districts Testing should be increased on large scale not in small incre
128	1250635837408186368	It s so nice of all you Californians to pay those extreme taxes to babysit illegal alien migrants Newsom is breaki
129	1250635838523871233	Gates and Company s COVID 19 Vaccine Boosterism Ignores Significant SARS Coronavirus Vaccine Risks Known for Over a
130	1250635839782047744	COVID19 CavitePPO PNP RDDanaoJr PNPKakampiMo PNPPATROLPlan2030 PulisAtKomunidad WeServeandProtect TeamPNP
131	1250635840088420353	Folks when you see headlines without reading the article evaluating the facts amp thinking about the content don t
132	1250635840260239360	IS this chick for real she is in trumps administration It was NOVEl CORONA VIRUS 2019 MEANING NEW COVID 19 stand
133	1250635840369418245	When any natural calamity occurs Sant Shri Asharamji Bapu s disciples serve the Nation with inspir
134	1250635841216450561	He knows his marketing and branding Covid19 ChinaCoronaVirus
135	1250635841321517056	Who cares where it originated At this point it doesn t matter Where COVID19 originated doesn t
136	1250635841631932418	NJGovernor does not have the authority to nullify your bill of rights There s common sense safety measures and th
137	1250635842097307651	Don t compromise your business continuity during this crisis Build IBM Cloud Virtual Servers for VPC configuration
138	1250635842395213827	Devin Nunes Demands Criminal Charges To Distract From Coronavirus
139	1250635844593033217	Two inmates at a Northwest Florida prison have died as a result of COVID 19 the local medical examiner s office co
140	1250635845989695489	While politicians promise personal protective equipment PPE nurses and health care workers are left without any
141	1250635845994000385	Look at this none from a few days ago haha
142	1250635848741085186	nasaan na ang MassTestingNowPH how many tests are you doing per day
143	1250635848984469504	The latest es aqui JORNAL Thanks to oficial pandemia covid19
144	1250635849751916545	I heard people who do all this are apped to be more prone to get Covid 19
145	1250635849865351169	Okay what is going on here Covid Kim locks up under contract to produce a model that will tell her ho
146	1250635850351702016	why the fuck is plucky sick right now THIS BITCH BROUGHT COVID 19 TO MY FUCKING ISLAND WTF
147	1250635850968432642	Prince Andrew Accused of Trashy Coronavirus PR Stunt for Hospice After Jeffrey Epstein Scandal
148	1250635853405159427	Frontline careworkers describe living hell of equipment shortages
149	1250635853514170368	get well soon COVID19 46
150	1250635854034288640	She s a good un Voting Katie again happily
151	1250635854264954880	That s what WHO said If you don t understand that what Tim said is
152	1250635858014662662	117 hospitals furloughing workers in response to COVID 19
153	1250635859147337728	Scary
154	1250635859465924608	wa This just in Seems I was right about inflating
155	1250635861068140545	It seems like no matter what I do to avoid runners on my hill hikes with my mask on they come up on me and there
156	1250635861797945346	Come on man WHO
157	1250635861915504640	Commie news network at home jeffzucker should be bumrushed outta every restaurant he eats in Street he walk
158	1250635862456459264	Is this right COVID19 COVID
159	1250635862741676033	Pandemic shines harsh light on Trump s failure to protect pangolins
160	1250635863010226181	This was so clear from begining that early actions wil save lives Wonder why it is not done Early
161	1250635865375858690	The only viable endgame is to play whack a mole with the coronavirus suppressing it until a vaccine can be produc
162	1250635866273280000	COVID 19 could permanently redraw Robson retail landscape via
163	1250635867103821824	Coronavirus lockdown Amazon Flipkart may resume full operations after April 20
164	1250635867309441032	80 of financial sector IPOs since four years trade below issue price india breakingnews latestnews
165	1250635870245457921	They did it on purpose next Question
166	1250635870341750792	Seriously China SHUT THE FUCK UP ccp coronavirus WHO The US is the biggest contributor with US553 1 million
167	1250635871314829312	Case Update Idaho confirmed 43 new cases of COVID 19 across the state today About 10 of tests have been positiv
168	1250635871474405376	To all doctors nurses and medical workers thank you covid19 dorangepark dorangespiration D Orang
169	1250635871637946373	Sources believe coronavirus originated in Wuhan lab as part of China s efforts to compete with US
170	1250635872007008257	I was at a sales call at a hospital today in Hamilton County not a single case of COVID19 in the
171	1250635873642668033	India s exports witnessed the steepest monthly decline since at least economic liberalisation in 1991 slumping alm
172	1250635873672019968	Fantastic
173	1250635873735135232	love to play in slime and so do we lol shopkins covid19 coronavirus saferathome isolation
174	1250635874720768000	Go away Palpatine
175	1250635875354062849	The latest Khorshung Thanks to discourse manipur covid19
176	1250635875370835970	The latest The Silent Services Inc S T E M Sports Entertainment Daily Thanks to
177	1250635877954379777	For those non filers that thought you wasn t getting a check I got you Be careful they definitely coming for yo a
178	1250635878113792000	Need an additional income on a flexible schedule Sign up to be a provider today
179	1250635878336266242	I m 25 and healthy Coronavirus almost killed me Shove this up your ass
180	1250635878780694528	I hope people do change their consumption behaviour which will change the production behaviour too It is also one
181	1250635882329063426	US explores possibility that coronavirus started in Chinese lab not a market
182	1250635882744274944	An incredible breakdown of the details behind the CCP s cover up Watch it now before it s taken down Hat tip
183	1250635883092434946	Never imagined 3 rooms of my apartment could be turned into 5 km walking loop COVID19 ActivityOfTheDay
184	1250635883130187781	Fox News coronavirus is a joke Open up the economy Trump handled this perfectly Fox Sports
185	1250635883189096451	DYK how coronavirus disease COVID 19 is transmitted It is transmitted via respiratory droplets through coughin
186	1250635883289559045	Trump just cut all funding to the World Health Organisation in the middle of the Covid19 pandemic Now this mas
187	1250635887144296449	I hope it doesn t kill the shows of the housewives I m sure everyone including Andy will donate
188	1250635887190265857	When are you planning to visit Wakatobi Comment down bellow More Info amp Reservation Call 62 82197928872 ma
189	1250635887433506816	Everything is Hard core Truth
190	1250635888675127301	For Archie s dad its about supporting his patronages The Duke of Sussex talks to families about COVID 19 challenges
191	1250635888721301505	The protection of elderly in facilities is a nationwide challenge exacerbated by too few tests More than 21 000
192	1250635888788418562	BBC News Coronavirus Army veteran Tom Moore 99 raises 4m for NHS
193	1250635888939294725	Hot spots erupt in farm belt states where governors insist lockdowns aren t needed POLITICO via
194	1250635889161707520	Democrats Demand Trump Stop Building Border Wall During Coronavirus Crisis
195	1250635890621329409	Only thing I ve seen from him is about covid 19 and the Rams Maybe more to come
196	1250635890637996032	French scientists are using the measles vaccine to develop a Trojan horse against the coronavirus
197	1250635891246346240	One of New Jersey s rural counties Sussex
198	1250635891544129536	Peter Navarro warned Trump coronavirus could kill 500 000 Americans back in January NYT Raw Story
199	1250635891682525184	Alex I ll take what is exponential for 500
200	1250635891694907394	Of course they are
201	1250635892450041857	Software is eating the world but the coronavirus shows some parts still haven t been digested
202	1250635892647170054	Movement towards global government NEVER
203	1250635892684779521	We are here for you We have redesigned we have set up screening and we have run countless practices If you need
204	1250635894769373185	The money they re referring to was appropriated for businesses closed by COVID 19 lockdowns DSP wou
205	1250635894840852485	WHO chief hails India s step to engage in polio surveillance network to fight Covid 19 via India News Latest New
206	1250635894874349568	Because someone told them to make it public Wonder who that was COVID US explores possibility that coronavirus
207	1250635895910412288	Great work smithfield
208	1250635896023429122	Republicans continue to try and suppress Americans rights to vote GangOfPutin are Corrupt Traitors and
209	1250635896166252544	You nailed it
210	1250635899089694720	WSJ Banking amp financial services executives told President Trump that his administration needed to dramatically i
211	1250635899257454592	It turns out that Coronavirus is an anagram of Carnivorous That d explain all the barbecues then
212	1250635899353747456	Jason Momoa very thankful to be stuck at home with family amid coronavirus
213	1250635899525791745	Shameful
214	1250635899546681344	India s COVID 19 tally reaches 12 380 death toll crosses 400
215	1250635900104499202	As a rule of thumb if there is any list regarding COVID that has China on it it s good to be a country that doesn
216	1250635900817534977	get well soon COVID19 48
217	1250635904357511170	No plan for poor migrant labourers in India Migrant Labourers are sifting through Rotten bananas on the banks o
218	1250635904542281728	Admirable leadership out of France Meanwhile at the White House the shit show continues
219	1250635905288699905	Don t again draw any parallels that it happens other times too This time and other times r different Th
220	1250635907637686273	PDP advises FG to address concerns of Nigerians over Coronavirus
221	1250635908682047489	enthused They think more coronavirus are coming out of that lab Good to contain ships such as aircraft carriers
222	1250635908790935552	It s been a nightmare Idahoans struggle to get help with unemployment claims Coronavirus
223	1250635908841259008	I sold a business last year I m not in this fight to keep a business afloat but I feel sorry for those who ARE in
224	1250635908845416448	Thanks to our and all the people
225	1250635910905036800	I like to think of GW looking out on this fabulous view of the mile wide Potomac and saying No estate in United A
226	1250635911370440704	I recommend Aarogya Setu app to fight against COVID19 Please download and share it using this link Android
227	1250635911546548224	The Feds printer will be running hot
228	1250635911781474305	JCU s Nursing and Midwifery school responded to a call from and hospitals for extra medic
229	1250635911785660416	As he should
230	1250635912482115584	Coronavirus or COVID19 Accuracy matters
231	1250635912737959936	she Is safe to go out in Japan right now even with the coronavirus
232	1250635915741052929	Meanwhile there were white nationalists protesting in Lansing over the perceived violation of their right t
233	1250635915783012352	So I guess he is saying U S citizens who need a Covid 19 test should fly Emirates Airline
234	1250635915791200258	So if you had a pants optional Zoom Meeting tomorrow from the waist up would you be shaving your legs tonight
235	1250635915883679745	Lier this dumbass doesnt even know how to read a sentence properly much less a paragraph amp he wants to claim he kn
236	1250635916047077376	Video uncovers lung harm in US coronavirus understanding People got to take this seriously
237	1250635916063825922	Coronavirus Testing Falls Woefully Short as Trump Seeks to Reopen U S
238	1250635916311330821	It Really Is the Perfect Storm Coronavirus Comes for Rural America
239	1250635916399595520	Exactly And look I m dirt broke
240	1250635916533624832	American patriots protest Trump s handling of the COVID 19 pandemic at Trump Tower
241	1250635916835565568	Navy may reinstate fired captain who asked for help with coronavirus outbreak report TheHill SmartNews
242	1250635916873433088	Two friends both were on a jobhunt spree till this covid19 shook the market Both were dejected disappointed
243	1250635917267623937	She is serious about the Coronavirus
244	1250635920635813888	Wait ooo You mean this facility no dey oga Presido office before Thank God for covid 19
245	1250635921394819073	My grandma tested positive for COVID 19 and was hospitalized A few weeks later she s being taking off her ventilat
246	1250635922313445378	Chaotic search for coronavirus treatments undermines efforts experts say
247	1250635922321936386	WHO regrets Trump funding halt as global coronavirus cases top 2 million visit to read more
248	1250635925228486657	Latest USA uscoronavirus COVID19 cases gt Confirmed 644089 Recovered 48708 Deaths 28529 Criticals 1348
249	1250635930089795590	Coronavirus Commission roadmap shows path towards
250	1250635932862222343	It would be great if this happened
251	1250635933675749376	Crown Resorts has announced it is standing down 11 500 workers about 95 per cent of its workforce amid the coro
