	tweet_id	tweet_text
1485	1250642396255326209	A very smart person I know who teaches epidemiology amp infectious disease for a living and has friends who
1486	1250642396469252098	WE build teach buy consume drive fly heal entertain We are the economy So by all means lets protect the
1487	1250642396997705728	What did you expect This is disgraceful I ll never wrap my mind around how releasing prisoners seemed like the be
1488	1250642400583856128	Kyrgyzstan uses its Soviet legacy to form response against Covid 19
1489	1250642400709672961	If these facts don t deeply piss you off then you re one of THEM EndThisDempanic
1490	1250642400898318337	Side effect of the pandemic for sure But the volatility that Covid 19 has brought is a once in a li
1491	1250642401187725313	Texas Governor To allow salons in Texas the ability to go back to work rules to abide by during covid19 Sign th
1492	1250642401636560900	15 times Trump praised China as coronavirus was spreading across the globe via
1493	1250642401959575552	But when he gets off message or brings up issues that have nothing to do with the coronavirus it is not reassurin
1494	1250642402303410177	I don t care who funded them Look at that picture though and then enjoy the irony of this quote Citizens are fra
1495	1250642404689842178	955 Serving poor amp underprivileged is a service to God C
1496	1250642404765548544	Yes Laura please goes first
1497	1250642405092712448	I m gonna need to hear from LeBron first
1498	1250642405625339904	I also saved with NSSF for about 7 months before I became self employed I need my ka money in this crisis
1499	1250642405990203392	Official Alleges The U S Has Deported Many COVID 19 Positive Migrants To Guatemala Coronavirus Live Updates NP
1500	1250642405994516483	Egotistical Unethical Absolutely hypocritical
1501	1250642408544632832	So what do we think is the reason for them designating them as COVID19 why do we care
1502	1250642408628531200	In other countries leaders of the Executive Judiciary and Legislature are forfeiting or accepting pay cuts to sup
1503	1250642408863346688	Big tech taking a leaf out of pharmas book of tricks in taking advantage of a crisis
1504	1250642409207164928	on sale of Marcos ill gotten assets to fund fight vs COVID 19 Even before the COVID 19 pandemic
1505	1250642409228103680	I RecallGavinNewsom being the first to act decisively against the spread of COVID 19 and shut down the state so mo
1506	1250642409546854400	Coronavirus Are there two strains and is one more deadly coronavirus covid19 Scientists
1507	1250642410096308226	I recommend Aarogya Setu app to fight against COVID19 Please download and share it using this link Android
1508	1250642410595479552	The purpose of this is that it needs to be quick Data are needed as fast as possible BMY s Rupert Vessey tell
1509	1250642411522588674	READ THIS THREAD as if your life depends on it Because it does I m NOT Fu King around either
1510	1250642412671729665	and this from the most dishonest administration in US history what a joke
1511	1250642412965294080	forgot to post link There s some juicy tweets that aged super well in the comments
1512	1250642413598601217	FINALLY
1513	1250642414211137537	They re coming for the First Amendment The target is Fox News and its coronavirus coverage
1514	1250642414391291904	interim guidance on sterilisation of N95 masks for COVID19 Vaporised Hydrogen peroxide is the best method fo
1515	1250642414517186561	Realign Cayetano boys P10B midnight insertions for COVID 19 response
1516	1250642414672449536	So let s make Nancy go crazy and retweet the f ck out of this
1517	1250642415255420928	Jah know smh
1518	1250642415502757889	Wash your hands 20 seconds with ARTs art COVID19 fun lol healthylifestyle music
1519	1250642417289695232	There s a cure for COVID Why don t Democrat s and media want us to take it Population control Money Po
1520	1250642418300604421	the internet never forgets
1521	1250642418468257792	CoronaVirusUpdates 7960 new deaths reported last day worldwide CoronavirusPandemic coronavirus COVID 19 CoronaOutbreak
1522	1250642418866589696	Let s see how much time u continue to lick Only for few days more Next time people ll not vote shivsena It is
1523	1250642419634311168	Oprah stresses seriousness of coronavirus on black community It s taking us out NewsGrit
1524	1250642421207183361	Sad Day
1525	1250642422092034048	rao COVID19 and aftermath will increase invisible scourge of undernutrition anemia low birth weight Its e
1526	1250642422482305027	I d love to see some if these ones here telling us to stay indoors while they visit each other
1527	1250642422893289485	Whitmer Loved the mobile protest in Michigan today agains her COVID 19 policies She is a nutcase
1528	1250642423006593024	China has just shot itself on the foot Now most countries are finding alternatives to manufacture their products
1529	1250642425221021696	Giving people free money isn t virtuous and it s not compassionate either It s so easy to say Cancel their debt
1530	1250642425330036737	Study finds startling number of asymptomatic pregnant women test positive for coronavirus via
1531	1250642426026328064	Super classy
1532	1250642426433286144	Exlente presidente
1533	1250642426533994496	Worldwide Confirmed Coronavirus Cases Top 2 Million by Unknown Author via NYT
1534	1250642426785488896	Kalburgi Declared As Covid 19 Red Zone By The Centre But People Were Seen Defying Lockdown Order Video Link
1535	1250642427259437057	Celebrate the Season With These Social Distancing Friendly Spring Activ is Ayer
1536	1250642427284615169	Why can t I go fishing in my boat Me the boat and the river Oh yeah the fish I catch
1537	1250642427351875584	Your tweets are confusing Sometimes you blame China for concealing covid 19 figures and sometimes yo
1538	1250642429583208448	You can lie to Chinese they are used to it but not the world You lied and allowed COVID19 to spread unabated and y
1539	1250642429633531904	YIAYtext SICK Super Into Coronavirus Knowledge
1540	1250642429813747712	In the wake of the novel coronavirus pandemic chemists have focused on searching for drugs to treat COVID 19 One
1541	1250642430157746176	Your side effects may vary but it is being given to a lot of people with Covid19
1542	1250642430543749120	Kane Bless your ignorant heart Trump was too stupid to multitask while refusing to
1543	1250642430715518978	Well to be fair 65K go to CCP and 65K to W H O chinaliedpeopledied
1544	1250642430900273155	Journalists should ensure factual reporting of coronavirus says IPC
1545	1250642433693618177	WHO Official Immediately Suspected COVID 19 Spread Human To Human But Spread Chinese Propaganda For WEEKS After
1546	1250642433991294978	Can you ask him if teachers will have the same shields around them that check out chicks have please
1547	1250642434125705219	Germany to begin easing coronavirus shutdown says Chancellor Angela Merkel
1548	1250642434674966528	Summary Youngsters posing risk to elderly by unnecessarily roaming on streets during lo
1549	1250642435442642944	Fact check Trump denies saying another thing he said and makes more false claims at coronavirus briefing CNN
1550	1250642437992824832	Why re there conflicting numbers on the covid 19 reported cases and fatalities between and
1551	1250642438294773762	2 Relatives Of Tablighi Jamaat Chief Test Positive For Coronavirus In UP
1552	1250642438424875014	Bill Gates must test his Coronavirus vaccine on himself and his family members first and if
1553	1250642438680526848	Face mask during Corona amp that Penguin dress 24 7 is same Why don t such people move to Syria or Iran if they love
1554	1250642438898749441	Rams Brian Allen tests positive for coronavirus first NFL player reported infected
1555	1250642439603396609	Coronavirus being of course God s punishment for Justin Bieber It s like science
1556	1250642440069013509	Europe Coronavirus Updates Death toll hits 21 645 in Italy hospitalized patients drop France s COVID 19
1557	1250642442287644673	oh DeVos because of course The protest dubbed Operation Gridlock was organized by the Michigan Conservat
1558	1250642442295992320	Same and I ve found I have less free time as I ve found my workload has actually
1559	1250642442807734273	Be safe from covid19
1560	1250642442921132033	Sick and tired of you and your colleagues on both sides of the aisle playing politics with COVID 19
1561	1250642443151777794	You have got to be f ing kidding me For those earning 1 million annually a tax break buried in the recent co
1562	1250642443437031424	Matt Hancock s record on NHS coronavirus provision
1563	1250642443613220864	If you re gonna grab a pic from the show this isn t the one Just saying
1564	1250642444288503808	Coronavirus Michigan protesters defy stay at home order
1565	1250642444665970695	Coronavirus stimulus checks Trump signature scramble could delay first batch
1566	1250642444770848768	All the prayers for Dr Hamayda and other braves souls like him who are risking their lives to save ours
1567	1250642446570020864	What He can get a haircut First he has none Second he is closer than 6 Fauci police where are you
1568	1250642447463522306	Huckleberry shit head WOW THIS IDIOT WAS ELECTED THE OTHER IDIOT I DON T KNO
1569	1250642448021368832	South Korea election Ruling party wins amid coronavirus outbreak
1570	1250642448243662848	in plaids Beyond pathetic indeed
1571	1250642448490967042	Covid 19 In 10 districts around Agra massive search on for hospital contacts Cities News The Indian Express
1572	1250642448595943426	Who is this Government trying to kid They can repeat the lie as many times as they l
1573	1250642449166331906	My neighbour is singing ABCD to her children I am singing along in my room alone D Now I know my ABC D Covid19
1574	1250642449183019008	Drinking alcohol can increase the risk of catching Covid 19 and governments around the world should limit access du
1575	1250642450919518209	Check out my latest video NFL BRIAN ALLEN Had Coronavirus For 3 Weeks Before Going To Doctor NFL Watch Now
1576	1250642452374892544	Jake Tapper rolls the tape on what Trump does not want you to remember
1577	1250642454744727552	Trump lice resort in Doral lays off or furloughs 560 workers during coronavirus shutdown
1578	1250642455067856896	Journalists should ensure factual reporting of coronavirus says IPC
1579	1250642455206268931	Schumer Pelosi staff to discuss next coronavirus relief bill with Treasury on Wednesday
1580	1250642455248199681	That would be bad cuz we have been waiting to go back outside FOREVER
1581	1250642455617134592	How many new gardens have sprung up in the past month Students are learning by doing when building and planting
1582	1250642455940272128	Laura Ingraham Says Many People are Willing to Get Coronavirus in Order to Open the Economy via
1583	1250642456602951680	Africa Is Relying on its Own Forces in Fight Against Covid 19 via
1584	1250642457089511424	And the number of deaths from the common flu chronic smoking vaping cancer amp diabetes old age alc
1585	1250642457261412353	New post Sushmita Sen s workout video will motivate you during the Coronavirus lockdown Times of India has been
1586	1250642458532347904	The Tell The next 45 days are the most critical period in U S financial history says stock market expert who p
1587	1250642459740127232	I wonder how the COVID19 testing kits will fare
1588	1250642459983568896	Well isnt that strange What changed
1589	1250642460340113408	Parliament has asked the Minister for health to explain why the Medical workers tasked with screening testing and
1590	1250642460759470081	Will it all ever end will we have our normal life amp feel safe again Will we b able 2c amp hug loved ones
1591	1250642460776292352	Apple unveils a new cheaper iPhone into a market vastly changed by coronavirus
1592	1250642460797104128	Love wins wedding preparations resume in Wuhan as coronavirus lockdown lifts
1593	1250642460835024897	AI based edge computing camera for covid 19 FeverDetectionCamera
1594	1250642460910301184	Coronavirus Here s what you need to know about Covid 19 in New Zealand
1595	1250642460927295490	god dammit
1596	1250642460948062212	Nurses suspended for refusing COVID 19 care without N95 mask
1597	1250642462743330816	Bestday So inspiring Our local hospital in Mobile Discharged a patient After Beating
1598	1250642465037537281	Prayforworld
1599	1250642465326985216	Read more on the global masks N95 Respirators SurgicalMasks Market covid19
1600	1250642466803335168	Cellphone tracking shows coronavirus damage to US economy
1601	1250642467344375808	I will admit that Trump could have been made aware of the virus as far as back as December amp the outbreak in the US
1602	1250642467533107202	Nature reveals itself during COVID19 lockdown Lovely
1603	1250642467629588481	Coronavirus Dubai extends shutdown of hotels restaurants until further notice
1604	1250642467633999872	Sushmita Sen s workout video will motivate you during the Coronavirus lockdown Times of India
1605	1250642468678373376	WHO regrets Trump s decision to withhold funding says focus is on saving lives in coronavirus pandemic
1606	1250642468741304321	The Mark of The Beast is Here ID2020 QUANTUM DOT TATTOO With COVID 19 V via
1607	1250642469273792514	I can understand the frustrations from many of you who lost their jobs due to this virus amp those who can t watch sp
1608	1250642472738476033	Dr Vernon Coleman explains the hidden agenda behind the coronavirus media driven hysteria
1609	1250642472973275141	Here s the tricky part When an epidemiological model is believed and acted on it can look like it was false
1610	1250642475825455106	Merced County s coronavirus cases are slowly climbing
1611	1250642476014219264	Kenney took it from future food bank money and Covid 19 testing so more people
1612	1250642476072927234	Shauna all across the country The plants are shutting down due to the number of COVID 19 CASES
1613	1250642476127465472	COVID 19 update U S 29 653 new cases in last 24 hours 639 055 cases in total 52 640 recovered 30 925 dea
1614	1250642479277158400	Everybody needs to tag He needs to talk about it tomorrow Tag and the with
1615	1250642480057528321	Malin Akerman goes bra less while walking her dog in Griffith Park which closed due to COVID 19
1616	1250642480464302080	Oracle s Larry Ellison calls Zoom an essential service as coronavirus forces remote work
1617	1250642480644513802	Told you hatesAmerican citizens amp helps theillegals every turn Newsom Announces 125 Million In
1618	1250642480896323584	OR ANYONE pushing mail in voting is advocating for VOTER FRAUD DEMOCRATS CANT WIN UNLESS THEY CHEAT this i
1619	1250642480942518274	You ve overhyped d impact of Covid19 Pandemics have occurred before and mankind didn t become ins
1620	1250642480980209665	So now we lock up the sick and let criminals run free This is ASS BACKWARDS
1621	1250642481391132672	Aggressive contact tracing enhanced testing GPS tracking How Srinagar is fighting to keep COVID 19 at bay
1622	1250642482293026821	Indictment of Trump and a Warning 90 of US Coronavirus Deaths Could Have Been Prevented With Swifter Action
1623	1250642484490833921	No our regulations didn t allow it Obama would have done th
1624	1250642484884996096	Defective goods
1625	1250642485019201536	Ask Bill to pay the bill WHOLiedPeopleDied CCPLiedPeopleDied CCPVirus CCP is terrorist
1626	1250642485803487237	Coping with Uncertainty During Covid 19
1627	1250642486311235584	Germany to begin easing coronavirus shutdown Merkel
1628	1250642486407557121	Hmmm India has had circa 11 933 confirmed cases of COVID 19 infecti
1629	1250642486562676738	Thus I hope corruption stops I hope the blaming game stops I hope that each one of us government and it s citiz
1630	1250642488206831616	ABOUT TIME
1631	1250642489293312000	Nervous Nancy Pelosi Deletes Video of Herself in Chinatown on February 24 Downplaying Coronavirus But the Inter
1632	1250642489817681923	Behind on child support If so you won t get a stimulus check via
1633	1250642490291601408	Kentucky Republicans Celebrate After Making It More Difficult for People to Vote During Coronavirus Crisis
1634	1250642490388070400	From Trump vs WHO to countries battling coronavirus as global cases cross 2 million Top developments
1635	1250642491038031872	BBC News Coronavirus What is the risk to men over 50
1636	1250642492061605888	Just finished my third live streamed painting on facebook It took two painting sessions About 6 hours total 5 or
1637	1250642492392976384	Taiwan releases December email to WHO showing unheeded warning about coronavirus
1638	1250642492426313728	The JobKeeper payment is for businesses significantly impacted by the Coronavirus pandemic and the measures in pla
1639	1250642492690763778	It was about the economic conditions and in relation to his earlier comments The man just speaks horribl
1640	1250642493470801920	Data by CoronaVirus COVID19 for Louisiana Tested 99 977 negative 82 0 21 951 positive 1
1641	1250642494213156864	You pig
1642	1250642494267822081	Fyre Festival conman Billy McFarland wants early prison release because of coronavirus cases at jail
1643	1250642494460755968	THE ANGRY ARAB Coronavirus Fallout for the Middle East This virus as any pandemic will alter public defense and
1644	1250642495169540096	It is only delayed and they carry on paying interest It s not enough
1645	1250642496876449792	Hate Ignorance An area in South Delhi is protesting as govt is asking suspected Covid patients to come there for
1646	1250642497207848966	Go figure
1647	1250642497811951616	You do know she just backed Cook County States Attorney Kim Foxx of Jussie Smollett fa
1648	1250642498394812416	Let me enjoy the things I still enjoy doing WHO
1649	1250642499070316545	from WHO China told the world on December 31l If you wish
1650	1250642499330363394	Franklin Graham I m Being Harassed For Requiring COVID 19 Hospital Staff To Disavow Gay Marriage Topbuzz
1651	1250642500399673344	The fact is yes the does interact w Taiwan but on a case by case basis And this is wrong needs
1652	1250642503214280704	Israel shuts Palestinian coronavirus testing clinic in East Jerusalem ApartheidIsrael IraelsNewGenocide
1653	1250642503222452224	Pelosi amp her dems have made them homeless so I recommend Nancy pay for them out of her pocket as well as pass them
1654	1250642503843315712	Check out a short report from octagon to help brands fans and venues navigate a return to sport in the wake of
1655	1250642504489168896	Support Erin by signing Support the USPS and I ll deliver a copy to your officials too
1656	1250642505110097920	Navy may reinstate fired captain who asked for help with coronavirus outbreak report
1657	1250642505302978560	Hmmmm I heard those taking adrenochrome may not be candidates for the cure
1658	1250642505797902337	17 new coronavirus cases in Delhi death toll stands at 32 Full List of Hotspots
1659	1250642506070601729	Google prepared this report to help us and public health officials understand responses to social distancing gui
1660	1250642510101143552	Nervous Nancy Deletes Video of Herself in Chinatown on February 24 Downplaying Coronavirus But the Internet is Fo
1661	1250642511254769665	Lmao I m still not going to rush into a relationship after this lol If I m alone that s fine almost everyone is
1662	1250642513892913159	Do you think figured out why it s called COVID 19 yet
1663	1250642514878451712	There it is
1664	1250642515306246146	I can do that
1665	1250642515532804097	Wachter Ladies and gentlemen This is the kind of uniformed dotard that Donald Trump is picking to b
1666	1250642515545513985	I hope the north and it s leaders gets to pay the price for keeping the large population uneducated and poor I unde
1667	1250642515549515777	There s really good reasons to follow what NZ has done amp fund Councils to make it ea
1668	1250642515717509120	Do your homework instead of threatening TrumpSupporters STOPtheHATE BTW elites you
1669	1250642515801358336	Coronavirus Social care concerns revealed in leaked letter shambolic coronavirus SocialCare Shambolic
1670	1250642516010872833	Pacific community
1671	1250642516128534528	Reckoning with climate change will support a strongest possible recovery The threat of climate change that is dri
1672	1250642517898362880	Thought for a while that fear of COVID 19 has brought some sense Wrong profiteering from arms sale continues
1673	1250642518053707776	Protesters gather outside Kentucky Capitol over coronavirus closures
1674	1250642519139868673	You can t fish if your dead You can t farm if your dead Not all Americans want to die from COVID19
1675	1250642519270068224	Ummm the seasons not going on He s not infecting other players Why is this such an important sto
1676	1250642519718797313	Nein
1677	1250642522298290176	Digital trafficking based on genocide databases is the common name for approaches like China and India Lots of th
1678	1250642522314928128	free article nibbas
1679	1250642522524782592	NY gov Cuomo mandates masks after offering New Yorkers as GUINEA PIGS for coronavirus vaccine RT USA News
1680	1250642522688221185	fraaaaaack
1681	1250642523632087041	My schedule hasn t changed one bit from before the covid 19 and during the covid 19
1682	1250642524705865731	Steve Mnuchin is a deadlier plague than the coronavirus by far
1683	1250642525985136641	i d rather be nauseous than dead count your blessings sis
1684	1250642526207463424	ITV News Funds pour in for family of pregnant nurse who died of Covid 19 via
1685	1250642526387699714	Do you have a DEATH WISH Citizens are DYING
1686	1250642527469867009	Absolutely right Photojournalists like and so many others are putting their own safety
1687	1250642528149348353	While the coronavirus raged across the planet in the 1st quarter of 2020 Trump tweeted golf
1688	1250642532477927424	Officials order Novaya Gazeta to delete article on COVID 19 in Chechnya following Kadyrov s threats to have the a
1689	1250642532561596416	Huawei doesn t produce Covid 19 test components UK not pulling out of 5G contract Africa Check
1690	1250642532612145152	What if COVID 19 is the Earth s way of lashing out because of the damage we have been doing to the
1691	1250642534541537282	Sick and tired of you and your colleagues on both sides of the aisle playing politics with COVID 19
1692	1250642535699165184	This is actually scary w out cooperation from everyone this virus will continue to spread especially since there s
1693	1250642536412205057	Social distancing may need to continue to 2022 Harvard study finds via
1694	1250642538454831105	Omg the end of the video
1695	1250642539557687297	LyinWitchSanFranNana2020 Admitting BLOCKING FUNDS During COVID19 War Pandemic 2020
1696	1250642540430274560	Partial mall reopening may be allowed as Philippines lockdown eases Pernia via
1697	1250642540727922689	inb4 America tries to invade China
1698	1250642540816195586	Asking for your help if you are able no amount is too small Many of our members have lost all work due to this Co
1699	1250642543626289152	Kano calm down abeg
1700	1250642543815151616	Little Boy Has An Uplifting Message For The World During The Coronavirus Pandemic via
1701	1250642544184057856	goes BRUTAL with his words to make people take the CoronavirusLockdown seriously says In logo
1702	1250642544473456640	WE THE PEOPLE will come out crawl wheel chairs rain or shine to stop KILLER GOP members
1703	1250642544989331457	Watch this clip from Republicans
1704	1250642547162185728	Israel and Trump s War on the Coronavirus
1705	1250642548927934464	BREAKING NSW extends and extends various requirements relating to mandatory participation club returns etc under
1706	1250642551276572673	Beijing saw three new local cases for the first time since March 23 China WorldFightsCorona
1707	1250642552329506821	Is Protocol Driven COVID 19 Ventilation Doing More Harm Than Good
1708	1250642552346288128	Putting duty before herself IAS officer n Visakhapatnam Municipal Corporation Commissioner GVMC G Srijana returne
1709	1250642552908283906	Read ambrosiadionna
1710	1250642555416399873	COVID19 is still a big thing Watch PBS news people Times are not back to normal Stay home pay attention
1711	1250642555592749056	Only God can stand upon this nothing more dearest let us pray To God to clear this kind of covid19
1712	1250642555693264897	You MAGA people are so ridiculous This coronavirus is all your fault
1713	1250642556481761280	We alerted the world to coronavirus on Jan 5 WHO says in response to U S NPR
1714	1250642556720828416	Pompeo Takes China to Task Over New Reports About How the Wuhan Coronavirus Began
1715	1250642557039783937	In the US it is still not possible to control the number of infections coronavirus and there is already talk of re
1716	1250642557823889410	Advocates wonder why long term care COVID warnings were ignored bcpoli yvr yyj Deadly crisis foreseen in pat
1717	1250642559602511873	This is Uganda picture
1718	1250642560084819968	Just a reminder that Michael spicer is a comedic genius
1719	1250642561791864832	Sounds like logic to me I hope the President listens to this advice Thoughts Report Business Lea
1720	1250642561833680896	Kerala has been such an amazing model in handling this situation I understand all the hate this state s government
1721	1250642563985559553	Sweden new cases 482 mortality rate 10 1 and deaths per 100K 11 8 for 4 15 Mortality rate shoots up with
1722	1250642566082514944	THANK YOU to Watsonville artist amp educator RosaHernandez for using her talents to educate amp message key points to
1723	1250642566418173954	Feel free to participate in this online survey research study about Coronavirus and get yourself airtime to take y
1724	1250642566648860675	To see more of my work visit my Instagram page alirezapakdel cartoons coronavirus COVID19
1725	1250642567072489472	Fuck COVID19
1726	1250642568502804480	Please verify your stories before retweeting DA bots are now trying to turn this into a partisan showdown amp I near
