	tweet_id	tweet_text
1506	1246651079938408448	He is on drugs there s no way in God s Earth that people are going to take some vaccinations and he will not decide
1507	1246651080999612416	Rishi Sunak at war with Matt Hancock over best way out of coronavirus lockdown Daily Mail Online
1508	1246651083620933633	We r sheltering home but SW AIR pummels SF Valley out of Burbank Airport 1 plane every 5 mi
1509	1246651084506087425	Gov Gavin Newsom owns coronavirus California testing lapses
1510	1246651084661194752	Coral Princess docks in Miami with 2 dead and several ill of coronavirus after ports shunned it for days
1511	1246651084661305344	Trump Urges Coronavirus Patients to Take Unproven Drug
1512	1246651084686442498	Trump warns of a lot of death from coronavirus in week ahead
1513	1246651084728340481	DO YOU SEE THE WORLD POSITIVELY CHANGING I DO I AM SEEING SO MANY COMMERCIALS ABOUT UNITY CALLS FOR HUMANITY TO
1514	1246651085701263360	Darool uloom deoband issued fatwa for muslims to come forward for testing Why s
1515	1246651085906829312	Just so every knows My auntie is one of the death numbers for the COVID 19 I never thought I d say it
1516	1246651088280997889	I hope it remains mild It does sound like coronavirus though Keep
1517	1246651088394162176	We re still waiting for the coronavirus cure you ve promised us How about that
1518	1246651088440299523	Captain Crozier Is a Hero
1519	1246651089035956225	Why do I have a feeling a number of people don t have a plan Longer a virtual lockdown goes on the more likely su
1520	1246651089090310145	Coronavirus New Zealand Family Lockdown Boogie music video passes 200 000 views
1521	1246651092051484678	Then order the mobile networks to increase the fuckin data caps
1522	1246651093674799105	It shall surely come to pass very soon that whole world will be free from covid19
1523	1246651096149430272	has been saying this for two weeks Fauci hasn t been listening reading or worse ignoring world
1524	1246651096509997057	Typical rubbish from our news media This still needs to go through human testing They don t tell you hydroxychlor
1525	1246651097680195586	Crime Under which law We knew you have not requested tabliqui not to commit crime
1526	1246651097684439040	Denial and dysfunction plagued US government as coronavirus raged The Washington Post The Washington Post Deni
1527	1246651097785253888	trends IT IS CALLED CORONAVIRUS FUCK U
1528	1246651101258166272	A Washing hands frequently AGL BeAware Quiz Contest CoronaVirus AGLTiles ig Instagood
1529	1246651102193283076	Sideshow Don Trump pursues a non virus agenda via
1530	1246651102382231552	Two workers at London s PentonvillePrison die from Covid 19
1531	1246651102419775489	These people are Ill I ve no words anymore for them
1532	1246651104508751880	What pandemic WWE and Wrestlemania roll on despite the coronavirus via
1533	1246651104517128192	Looking for an eLearning project for Art class Problem solved creativityunlocked hewenttoJared priceless
1534	1246651104554881024	Jeezy Thinks President Trump s Response to Coronavirus Is Driven by His Ego news
1535	1246651104634351616	How is everyone going with their Covid 19 goals
1536	1246651104848498688	Trump s advisers have had to expend precious time and energy to change his mind and soothe his ego rather than foc
1537	1246651105184014336	Quarantine on both sides of the border a reporter s account of life at home in Shenzhen and Hong Kong amid the cor
1538	1246651105678774272	Feds swooped in on Colorado s ventilator order Polis says
1539	1246651106135928833	New stimulus bill unlocks IRA amp 401K without penalty COVID19 financialhelp
1540	1246651106169675778	
1541	1246651106245185536	The Todd County Health Department announced Saturday evening two new positive COVID 19 cases have been confirmed in
1542	1246651109046915073	he s a beast
1543	1246651109340561408	Oh cmon We can make it a thing the Covid19 Cut Not as cute as the Rachel but everybody s got one
1544	1246651109550276609	Happy to sign this Let me know what I can do
1545	1246651110074482690	God bless her and take care of her and all the personal
1546	1246651110200414211	I love that the top trending topics are T Pain amp Lil Jon songs instead of Trump amp COVID 19
1547	1246651110263308288	COVID 19
1548	1246651110393180160	They re literally the conservative definition of small government
1549	1246651112905740288	Who needs sports during Coronavirus
1550	1246651113123676160	Respiratory failure lung heart failure shallow and die
1551	1246651113316761600	Always amazed at the creativity from Houstonians COVID19
1552	1246651114025451521	This is turning out to be a huge conspiracy Perhaps The Rand Corporation in conjunction with the saucer people un
1553	1246651114381922304	Coronavirus More than 19 000 hospital beds available to treat COVID 19 patients in Texas ABC13 Houston
1554	1246651117376688128	Correct COVID2019 CoronavirusPandemic lockdownindia CoronaOutbreak
1555	1246651117464936449	Trump says thousands of military to be sent to help states battle coronavirus Topbuzz
1556	1246651117557231618	The technical term for it is ground glass opacity CT scan if anyone wants
1557	1246651118194774017	This guy is an ER doctor in New York City urgently sharing what he is learning about how t
1558	1246651119079587840	SWIMMING We were supposed to be at TYRProSeries MissionViejo the week after next
1559	1246651121663442952	Best summation so far on this lunacy
1560	1246651122778955776	COVID 19 lockdown makes Ganga water cleaner
1561	1246651122925711362	How about an excellent piece on lessons learnt from Markaz Spread the wealth oops virus If you die you will me
1562	1246651123156451329	How about you guys pull your fucking heads in and stop giving the rest of us that surf a bad name I would love to
1563	1246651125798858752	Sorry you will have to take that up with WHO its their chart I didn t make it they did gt
1564	1246651127321460741	Coronavirus cases in the US total more than 300 000
1565	1246651129728913412	I m not a doctor but seeing a few doctors saying the same thing This is acting like high altitude sickness but y
1566	1246651130463084545	great going Thanks a lot amazing fight against Corona Kudos
1567	1246651130500636672	Interesting strategy for regions whose hospitals are overwhelmed France has evacuated 550 patients to hospitals in
1568	1246651130999758848	Surgical face masks significantly reduced detection of influenza virus RNA in respiratory droplets amp coronavirus R
1569	1246651131146563587	Request To PM Some preventive measures to overcome from t
1570	1246651131868127232	The people who think Covid 19 is all a conspiracy really concern me
1571	1246651132308381696	Oh and BruceAylward famously said if he gets coronavirus he would want to get treated in China
1572	1246651133998686209	The Coronabunny Easter April 2020 and Coronavirus Covid 19 coronavirus coronavirusaustralia
1573	1246651134019866624	Immigrants are at the heart of the healthcare system They deserve to be paid well and offered full benefits Never
1574	1246651135584161798	that should get attention away from his resignation
1575	1246651135592665089	Alabama projected to have highest death rate fourth most coronavirus deaths in nation
1576	1246651137702400002	Wisconsin s primary to go forward Tuesday even as coronavirus all but shutters the U S POLITICO Wisconsin s pri
1577	1246651140948799490	The FBI told FL lawmakers that they couldn t say with certainty the hackers did not manipulate voter registrat
1578	1246651141183725568	I m glad but I wish they d speed up the last one I know no one who has actually gotten anything yet Pelosi
1579	1246651142530052098	Two months ago
1580	1246651142840475649	THIS I ve seen reports that they are stamping CV on anything they can because money and politics Surely no one w
1581	1246651143075164162	It s time to lay down our weapons and join together to overcome coronavirus I m proud to join the move
1582	1246651143326961672	Chelsea Clinton expects Trump to put her in charge of the global COVID 19 fight
1583	1246651143406616576	The new coronavirus can last on some surfaces for up to three days study says
1584	1246651143431716864	when bad bunny said maldito a o nuevo he was trying to warn us of the oncoming coronavirus pandemic and we all failed to recognize it
1585	1246651147219329026	Fact VS Hoax
1586	1246651147915374594	More facts maybe you should learning You know Chin
1587	1246651148087549952	You should be fired for discounting the virus early on and now you want to th
1588	1246651148146270208	Trump seems to realize that this hysterical nonsense needs to end sooner than later Let s hope he does not change
1589	1246651151577161729	Why has the coronavirus hit Iran so hard
1590	1246651151581425666	You guys jump in this These guys are one of my favorite brands get behind them and order some masks I recommend
1591	1246651151610773505	Bill Gates is spending billions to produce 7 potential coronavirus vaccines
1592	1246651151950303233	Indian Railways ensures supply chain fully functional for power transport and key infrastructure sectors during
1593	1246651152395091969	We ve gone full dystopia in less than a month
1594	1246651152520732673	These are purchased comments otherwise no knowledgeable person should have made this statement after knowing that M
1595	1246651154768908290	This joke gift my dad got a while ago will come in handy in quarantine COVID19 Obama
1596	1246651155133784072	This is a big disaster for TRUMP ADMINISTRATION
1597	1246651155142168576	Could Sweden s Laissez Faire Approach to the Coronavirus Actually Work Jon Miltimore via
1598	1246651156111200257	merri Your points are well taken We can t make public policy based on an untested
1599	1246651156157231104	We Lost 5 Weeks Due to Delayed Govt Response PPE Manufacturers
1600	1246651156316610561	Incompetent De Blasio says we ve only known for 2 days that asymptomatic carriers could spread coronavirus
1601	1246651156962725888	If be really interested in seeing the scope of the decline of religious donations Does it correspond to reduced in
1602	1246651157038104577	Thank you Covid 19 support God bless you
1603	1246651157046390786	Please get this info out there France and Egypt using 2 drugs to cure COVID19 America wake up and use
1604	1246651159068082176	Coronavirus Live Updates Cases in India reach 3374 death toll 77 Maharashtra leads with 490 cases but
1605	1246651159311458305	justintrudeu Canada Thank you Not all Americans are happy wit the way trump is managing Covid19
1606	1246651159357554688	Pretty sure someone might find this interesting Merv Ratings for A C filters COVID19 filter SARSCoV2
1607	1246651159923785728	My heart goes out to all those people who have lost loved ones due to covid19
1608	1246651161031081989	24 COVID 19 Dashboard Saudi Arabia
1609	1246651163363012609	A Union health ministry plan has outlined how regions with large Covid 19 outbreaks or multiple clusters of the dis
1610	1246651163728121856	Coronavirus Case Counts Are Meaningless
1611	1246651163950362630	The Pentagon is pleased to report that in a recent raid they managed to kill the coronavirus right hand man
1612	1246651164147367937	155 sailors on USS Theodore Roosevelt test positive for coronavirus 42 percent of all Navy infections FoxNews
1613	1246651164478672896	texan Covid 19 of course
1614	1246651167817359360	State Health Department CDC recommend wearing simple cloth masks Sent from my Samsung SM G975F
1615	1246651168174022657	Denial and dysfunction plagued US government as coronavirus raged The Washington Post The Washington Post
1616	1246651168178094081	Who is 46 tho
1617	1246651168652230656	Stretching the International Order to Its Breaking Point CoronavirusPandemic Covid 19
1618	1246651169302294528	Congress How many Congress members are still getting their fat paychecks during this CoronavirusPandemic Mos
1619	1246651169579114496	call a spade a spade how tf is hiv meds treating covid 19 patients this shit is not normal
1620	1246651171831533574	Historic Injustices Against Native People Put Them at Greater Risk of COVID 19
1621	1246651172045258752	Rona Lung Check rona coronavirus COVID 19 washyourhands stayhome lungcheck funny
1622	1246651173504815104	i personally think the extension is for our Safety
1623	1246651176126484482	Just stay in people it s not that hard
1624	1246651177023856640	A Crisis Is a Terrible Thing to Manufacture
1625	1246651177426657282	55 Maybe they can handle it though US Military Rocks
1626	1246651179989262337	Graphing the increase in COVID 19 deaths in Australia it s no longer linear auspol covid19australia
1627	1246651180165394432	Trump Knew About The Coronavirus For 70 Days And Did Nothing
1628	1246651180211507201	My heart
1629	1246651180404465665	What s batshit crazy about this is that drumpf is saying it s better to be dead than to have the country stock mar
1630	1246651180622712832	Now that TV news and the media has us scared to death finish telling them that covid 19 is man made and it s a weap
1631	1246651184334557184	States with the most tests per capita 4 4 20 9 08 PM PT Coronavirustruth covid19 coronavirus
1632	1246651185102282752	This
1633	1246651185534246913	LETS FREAKING GO elswick
1634	1246651188013129736	DearMrPresident You lied to the American people You told them the coronavirus was a hoax that would all be gone
1635	1246651189107683328	Globally people were told by experts that the coronavirus spared the young it s not true and never was Anyo
1636	1246651189342724100	Life update one of my best friends got engaged and thanks to covid19 I couldn t be there and celebrate her and he
1637	1246651189871153155	In all that you do always remember that owonikoko Moneytalk trending like coronavirus Citya
1638	1246651190261297153	If these stats don t scare you i don t know what will
1639	1246651190303002624	Thanks for sharing the story of first coronavirus positive person s treatment Really very optimisti
1640	1246651192580517889	It s time to lay down our weapons and join together to overcome coronavirus I m prou
1641	1246651194002616321	Naw Trump is the perfect person for leadership to bring on the retributions that white supremacists and their coll
1642	1246651194522480640	This is the covid registry of individuals with rheumatic disease
1643	1246651194522710016	if you re actually blaming people losing their jobs on please voluntarily check in at
1644	1246651198112845824	42 covid19 positive cases in india are aged between 21 and 40 years 83 are aged below 60 years COVID2019
1645	1246651198326726657	At least they are Covid19 free
1646	1246651198368821248	fietzke 10 dead after coronavirus quarantine hotel collapses in China
1647	1246651198616322049	The best way to receive orders
1648	1246651198637322241	The vaccne tests should start here
1649	1246651198746300417	This guy is an ER doctor in New York City urgently sharing what he is learning about how to
1650	1246651198935089152	CoronaVirusUpdates 1166 new cases and 82 new deaths in Brazil CoronavirusPandemic coronavirus COVID 19
1651	1246651201266913281	ABSOLUTELY NOT
1652	1246651202445676554	Do you really think BIG PHARMA wants a drug already out used for covid19 Hell no Then they can t charge 1000 a pill for a new one
1653	1246651202588246018	Come for It is the flu It is going to be just like the flu almost identical Stay for seeming
1654	1246651203146186753	It s true that we don t quite know the radiation effects on our society due to 5G But these 5G towers are not the
1655	1246651203238252545	Coronavirus does not originate in China let s wait for Scientific conc
1656	1246651206446931971	So they closed the wet markets because of Covid 19 and they wer
1657	1246651206585335808	MORONA MAFIOSO s incompetence negligence amp callousness get a damning verdict in MFF s newly updated post We offer
1658	1246651206656720896	430 000 people have travelled from China to U S since coronavirus surfaced Toronto Star via
1659	1246651206660841472	Trump is dispensing unfounded medical advice and recklessly suggesting Easter services The WORST leader possible i
1660	1246651210440019968	Cellphone Mapping Tech Shows How Fort Lauderdale Spring Breakers Could Have Spread Coronavirus
1661	1246651210792198152	This Coronavirus has exposed the US for what they are no matter how much they point the finger at othe
1662	1246651211341639681	Barbarians THey think the CoronavirusPandemic is a gift from Allah because it struck the Chinese first they wh
1663	1246651211429711872	Breaking President Trump is considering a second coronavirus task force focused on reopening the US e
1664	1246651214122627072	Protect yourself and your loved ones from the coronavirus
1665	1246651214273687554	COVID 19 deaths worldwide ITA 15 362 ESP 11 744 USA 8 306 FRA 7 560 GBR 4 313 IRI 3 452 CHN
1666	1246651214348996608	In case if you don t know there is a CoronaVirus Pandemic around the
1667	1246651214390915072	Coronavirus update US beats its own grim record Covid 19 death toll touches 1 480 in 24 hours
1668	1246651214499966976	And math and spreadsheets
1669	1246651215074607105	rj31 Btw this one was v interesting Economics is not about money it s about people
1670	1246651215078764544	Disgraceful Trump calls Coronavirus Democrats new hoax
1671	1246651215523524610	Covid 19 is ALL your fault
1672	1246651215628337154	CNN A pandemic thriller once rejected by publishers for being unrealistic is now getting a wide release
1673	1246651219533344769	Give Wings to Your Career We have started Online Classes for school college entrances and skill development
1674	1246651219692662790	He s a jackass
1675	1246651219931582464	Please join me in asking Gov Parson to put the Hydroxychloroquine and Azithromycin treatment for COVID19 into the
1676	1246651222003560448	Unbelievable
1677	1246651222565605377	Digital Trends IBM turned its Jeopardy winning A I into the world s smartest COVID 19 chatbot
1678	1246651222745944065	great nothing like a fresh swab of COVID19 down your throat
1679	1246651223001858050	keep holding on we will get through this Stayhomestaysafe calmyourself lockdown coronavirus
1680	1246651223463194624	Also Bergen and Passaic Counties in NJ where the religious Jews live
1681	1246651226894340097	Go BC
1682	1246651227628359682	Melania and Donald Trump clash over coronavirus masks as crisis intensifies
1683	1246651227783348225	thinking about life before coronavirus
1684	1246651228630679552	Maybe our biggest strength in Germany said Professor Kr usslich is the rational decision making at the highest
1685	1246651228840493057	Getting my family their COVID 19 vaccines
1686	1246651230987800576	As long as there is mass testing Yes go But Makes me Sad sadder sadddest
1687	1246651231050883072	Whoa Yeah makes sense
1688	1246651231323353088	Very interesting article Bill Gates Just Shared a Brutal Truth Very Few People Are Willing to Admit cc
1689	1246651231663206402	Vaccination Great Is the vaccine going to work against all future forms of Coronavirus Are we going to need mo
1690	1246651232212488197	Makes sense Other countries are successfully implementing this
1691	1246651235056226305	With its online jobless application process in shambles Florida releases paper form Miami Herald via
1692	1246651235186421765	I just witnessed greatness from and tonight on All the talent the hits and the brother
1693	1246651235622514688	unconfirmed rumor Daniel Ortega died Sunday March 29th 2020 from COVID 19
1694	1246651235769278464	Shame on the US Navy for relieving Captain Brett Crozier of his command after raising concerns for his crew with th
1695	1246651236373237761	Remember when Trump asked for 2 billion dollars to deal with Covid 19 and the Democrats insisted on giving much mor
1696	1246651239086977024	How to respond to COVID 19 via
1697	1246651239116374017	Shout out to scientists for working so damn hard
1698	1246651243914657792	That s the overwhelming feeling at the moment guilt Guilt that you re not doing enough for your children and gu
1699	1246651243960901633	terrence Fyi Before the media said he got coronavirus and now they
1700	1246651244485189633	America s emergency medical stockpile is almost empty Nobody knows what happens next via
1701	1246651244590104577	How many church goers haven t been able to eat Pizza Hut or mazzios after church on sundays COVID19
1702	1246651247903596545	I had thought this footage was faked in that it was from 2019 I am shocked that it s not Utterly irresponsibl
1703	1246651248071315458	Please do not take trump s word seriously Is this what she try to tell y all
1704	1246651248213807104	It s time to lay down our weapons and join together to overcome coronavirus I m proud to join the mo
1705	1246651248280915969	The other issue with allowing to let the virus ride with younger peop
1706	1246651248452857856	389 Name the 1st country shuts financial markets due to covid19 outbreak A USA B UK C Phillipines D Switzerla
1707	1246651248469635072	The number of people dying of COVID 19 who AREN T being listed as COVID 19 deaths is large Doctor h
1708	1246651248788439040	Coronavirus Update Ayurvedic Cure of Virus Bacteria
1709	1246651248960405505	Trump doing infomercials
1710	1246651249371553792	What do you think this engineered Coronavirus is SARS MERS Those were dry runs pilot programs for the big one
1711	1246651249518432257	This
1712	1246651251506503682	Dumbfuck working for company being sued because he lied to his viewers about Covid 19 risks interviews cunt that vo
1713	1246651252303224833	Day 9 10 Day Activity Of Lockdown Countdown Begins Follow lockdownindia
1714	1246651252810887168	How does the COVID 19 pandemic compare to the last pandemic
1715	1246651253272305665	Uttar Pradesh COVID 19 cases at 227 check district wise list
1716	1246651253981093888	Calling on my friends connections and twitter leaders Please join in this mission to support COVID 19 victims and
1717	1246651256388509699	11 more COVID 19 positive cases in WB tally now at 49
1718	1246651256581455877	Thousand cases in 2 days Quantum jump
1719	1246651256963084297	Vitamin D could benefit vulnerable adults during COVID 19 outbreak Irish research finds via
1720	1246651257097355266	Since doesn t have any of the diseases that the drug actually works on maybe we ll get lucky and i
1721	1246651257734844416	Please help to sign this petition
1722	1246651260872220674	This is really important Check it out and draw your own conclusions For myself it makes complete sense that pneu
1723	1246651261371527168	Watch HOW COVID 19 KILLS I m a Surgeon And Why We Can t Save You on YouTube
1724	1246651264190029830	They can t even determine how many people in Chicago have been infected with coronavirus
1725	1246651264957435911	Nope Not for a second
1726	1246651265313935360	Shut the fuck up already Yeah we get it Bad mouthing the government s response is unnecessary Good bad or indiff
1727	1246651265666277377	Check out Dr Vladimir Zelenko a Jewish board certified family practitioner in NY who successfully t
1728	1246651268195442688	This is precisely why this term we need everyone to go to P NP grading Letter grades will reflect learning cond
1729	1246651268543795202	A friend sends to me what he calls Good news amid chaos He refuses to follow the news including informative repor
1730	1246651268669595649	Wuhan is about to lift lockdown and we can go out now but if someone wants to
1731	1246651268954615809	How we dealt IndiaFightsCorona Jr doctor assigned with treatment of COVID19 positive patients in MadhyaPradesh
1732	1246651269264986113	New Zealand passes 1 000 coronavirus cases as PM chastises idiots ignoring lockdown
1733	1246651272415100929	Indeed
1734	1246651273165692928	StayHomeSaveLives COVID19 COVID2019 everyone that isn t an essential worker need to stay home
1735	1246651274159890432	There have been 3 confirmed cases of COVID19 in Botswana up to this moment of which 0 people died 0 today The
1736	1246651276806496263	ft idgaf Remix Prod by RT RT CoronaVirusPandemic Pittsburgh Pennsylvania
1737	1246651278010322944	Data from Covid19Global Rheumatology Alliance an important observation regarding Lupus n HCQS
1738	1246651278253608960	Just drop the a bomb and get it over with
1739	1246651278383595520	Mac contacted me at 1400 on 04 03 2020 and stated that the VA legal team was going to draft a new order and there
1740	1246651278501036033	Kasich The coronavirus made me doubt my faith until I realized it was there all along via
1741	1246651278643679232	Le he fallado Dr Gatell
1742	1246651278786088961	Breaking news Could this be true And why haven t we heard about this
1743	1246651281491537920	CoVid19 is the funniest irony ever
1744	1246651282502365185	MASS CONTINUES DRUG TESTING PROBATIONERS DURING CORONAVIRUS CRISIS covid dearreader
1745	1246651282514939910	2 bros chillin in a hot tub 5 feet apart because they are social distancing you should do it as well we can slo
1746	1246651282921631745	Stupidity or is it sabotage
1747	1246651284947533824	Sino File There s a time bomb in China s economy Coronavirus has lit the fuse
1748	1246651285157396481	Apple s choice to keep stores closed is a smart call during stupid times CoronaVirus
1749	1246651285169819648	India US partnership to effectively combat the COVID 19 pandemic Coronavirus CoronavirusOutbreak
1750	1246651285333516288	Burgers in bed
1751	1246651285614538752	YNW MELLY TESTS POSITIVE FOR COVID 19 WHILE IN JAIL
1752	1246651285870387203	1 202 433 Coronavirus cases as of 2020 04 05 00 10 02
1753	1246651286100959233	Madsen crew got into onward today good stuff We loved it DisneyPlus
1754	1246651286541479936	Dr Gita Ramjee 63 died of Coronavirus An early pioneer of Aids rese
1755	1246651286608580608	Love in the time of coronavirus Less swiping more chatting and no meet ups The Straits Times
1756	1246651288235851777	Exserviceman of Garhwal Rifles donates two months pension for PMCaresFunds amp urges all countrymen to help country
1757	1246651288676372480	Trump says toughest weeks ahead as coronavirus spreads Stories from 4 sources Photo via The West Australian
