	tweet_id	tweet_text
1002	1258971927449931777	Keep being amazing Ontario educators We friggin ROCK Your students may not always say it but they apprecia
1003	1258971927546343424	Oh My God The Coronavirus The murder hornets Now aliens in suits have invaded the earth
1004	1258971927957274625	I get the numbers from Johns Hopkins I watch them daily It s been 2k a day for a while
1005	1258971928015933441	If 80 of Americans Wore Masks COVID 19 Infections Would Plummet New Study Says via
1006	1258971928624324608	Prayers for the residents and staff
1007	1258971929018421248	After losing your business and livelihood due to faulty models and predictions why would you trust the government w
1008	1258971931845500928	Salut PartisipasiCegahCovid19
1009	1258971932587773953	spalding Wuhan was preventing new coronavirus last September The group of doctors reported that SARS is
1010	1258971933317586944	134 welfare works have been initiated by Saint Dr Singh Ji insan One of them a Blood donation
1011	1258971933841829889	I wonder if this is a shared experience with those in similar generational settings Has your living history made
1012	1258971938308812800	Wat Pha Sorn Kaew in Phetchabun province will re open to the public from Sunday 10th May onwards Please wear a mas
1013	1258971939168817157	Literally hardcore VIDEO evidence and people STILL stand by him giveitupalready
1014	1258971941341286401	Vietnam to transfer Covid 19 test kit technology to Cuba VnExpress International
1015	1258971941433556992	COVID19 requesting help for sweeper flight from Hong Kong Some Filipinos which includes those with permanent resi
1016	1258971941567897610	is really touching more lives
1017	1258971943560261635	Aw man
1018	1258971944411529216	boling1 Remember to practice social distancing
1019	1258971944797470720	drkemiolunloyo forget about covid19 talk Buhari is killing Nigerians
1020	1258971945397338118	Just when we were looking forward to UFC 249 as an escape from Coronavirus there s this Supposedly the show will
1021	1258971945527316480	If there is any justice that baby talking twat will catch it she will be fine thought cause its a hoax according
1022	1258971945837694978	think too many people know just what the reality is Perhaps if they do that the Emperor really will have no clo
1023	1258971946760495104	Definition of dictatorship We ve taken every single precaution TO PROTECT THE PRESIDENT Ms McEnany said as U
1024	1258971948219949056	At least 78 000 Americans are dead from Covid 19 and there is no end in sight Many who have recovered will have ch
1025	1258971950782676992	Shows how critical medical research breakthroughs and publichealth interventions are if we are to eliminate the
1026	1258971952724623366	Ivanka Trump s Personal Assistant Tests Positive For Coronavirus After Donald Trump s Valet
1027	1258971953643130887	Hi the JobKeeper Scheme is subject to ATO compliance amp audit activities For info abou
1028	1258971953819312130	Ayurveda herbs for immunity boosting against covid 19 AbhiNhiToKabhiNahi ayurved
1029	1258971955257958400	Coronavirus statistics from NY
1030	1258971955664830464	Good morning Nepal If rihanna was Nepali we wouldn t have to suffer like this COVID19 Corruption WomenRights
1031	1258971958617800705	Himachal Pradesh has total 50 cases with 3 deaths while 34 patients have recovered so far More on
1032	1258971959431499777	A new payday loan just opened in town They appear to be open 24 hours COVID19 predators
1033	1258971959775264768	Dr on Coronavirus stabilization in Gujarat
1034	1258971960618504194	THANK U TO THE AMAZING DESIGNER polatteu for my incredible mask to keep myself and others safe during t
1035	1258971962900176896	Normally I d say that if the fighters are willing to risk it and there aren t any fans let them fight However
1036	1258971962962923520	Judy made several valid points but I am skeptical that make wearing is as detrimental as she says Plandemic Docume
1037	1258971963017646081	Here s where employees in Beaufort Jasper counties have been laid off due to coronavirus The Island Packet Hilto
1038	1258971963449577475	High time TV channels start non coronavirus deaths monitor It shd record all deaths that happen due to Lockdown
1039	1258971964422701057	WOMP WOMP
1040	1258971964632371203	Personnes sauv es 9 4 8 8 1 toutes les 8 minutes Temps pass en confinement 5 4 Jours 1 2 6
1041	1258971965584363520	Great article about what has been happening in F1 on the financial side I just hope that all the parties take the
1042	1258971967140610048	Grubhub is nothing but a bunch of profiteers amp grifters
1043	1258971967312457729	Ronaldo Jacare Souza has tested positive for COVID 19 ahead of his middleweight bout against Uriah Hall at UFC 24
1044	1258971967316787202	Coronavirus Global economic fallout continues from the pandemic Coronavirus
1045	1258971969329872896	trackwork means no access into stration for provisioned hand sanitiser nswpol COVID19
1046	1258971969619464192	Amen
1047	1258971969858371584	This stuff has got to stop November people Four Die Hard Loyalists Are Enabling Trump s Apocalyptic Coronaviru
1048	1258971970714165248	If anyone asks just tell them the alcohol is to kill any COVID 19 to keep it from spreading The Presi
1049	1258971970886078470	Damn You COVID19 I can t believe RoyHorn died RIPRoyHorn AnnusHorribilis 2020sucks
1050	1258971971796316161	Another astute report from Derfel Why is the COVID 19 death rate soaring in Hochelaga Maisonneu
1051	1258971971842277378	In the news Taking on Covid 19 South Africa Goes After Cigarettes and Booze Too coronavirus COVID19 2019ncov
1052	1258971972748402689	I would love it if Ivanka Trump was positive covid19 and get sick and die That alone will be me im
1053	1258971973499195399	isn t on TV every day but she is constantly addressing the economy and the Covid 19 lacking res
1054	1258971973893255168	In the news Wisconsin s coronavirus cases increase by 375 the second highest total since testing began
1055	1258971974182883328	anha this COVID19 has brought issues
1056	1258971974627442689	covid 19Ke cases has rapidly increased as testing increases and within a very short period Some Counties
1057	1258971974639861761	Apple to reopen stores in four states with COVID 19 face masks temperature checks and social distancing
1058	1258971974908313600	In the news Online coronavirus mutation visualizer gives clues to how coronavirus spread across the world
1059	1258971975512276993	Now this is another one
1060	1258971975969460226	via Tijuana coronavirus death rate soars after hospital outbreaks The number of deaths from the cor
1061	1258971975994630144	In the news Haphazard Rollout of Coronavirus Drug Frustrates Doctors coronavirus COVID19 2019ncov
1062	1258971977798352897	What else didn t you write that we Tanzanians we are practising in fighting coronavirus And wh
1063	1258971977831919617	Coronavirus is real Protect yourself Wear a mask Stay home
1064	1258971978037223424	In the news Confirmed coronavirus cases in Washington state peaked in March UW says
1065	1258971978423136258	Steven Miller s wife Wow via
1066	1258971978431492096	TrueBloodPump Covid 19 With pious grace of St Dr Singh Ji Insan conducts month
1067	1258971978712547329	China coronavirus cover up Scientists think pandemic started as early as OCTOBER
1068	1258971979048075265	In the news The coronavirus pandemic is hitting black and brown Americans especially hard on all fronts
1069	1258971980063076352	In the news Coronavirus Briefing What Happened Today coronavirus COVID19 2019ncov
1070	1258971982340796416	Civilian Coronavirus Corps State sponsored Antifa trained gangs of Karens and Kevins marching through neigh
1071	1258971982718214144	Just a couple more transmissions lol
1072	1258971982978146304	Coronavirus relief from community banks saving small businesses FoxNews
1073	1258971983083159552	Coronavirus Top economist says central banks should give away free money Business News Sky News
1074	1258971983364214785	Second Pence staffer tests positive for coronavirus
1075	1258971984647651328	Fuck sake
1076	1258971984786055168	When this bummer coronavirus is gone lets throw the biggest most Funkalicious Disco party to celebrate WHOS IN
1077	1258971985171922944	COVID 19
1078	1258971985893179393	Coronavirus Briefing What Happened Today
1079	1258971986228846592	You mean the same govt that had the food pyramid upside down for 30 years now wants to inject me under questionabl
1080	1258971987046776833	Contact Tracking Slows COVID 19 Spread Instant News
1081	1258971988028035072	Inter Milan players all test negative for coronavirus
1082	1258971990972485632	wahine Important discussion to have Maddi Hypothetically speaking here i
1083	1258971991509479424	China reports one new coronavirus case 15 asymptomatic cases
1084	1258971994969661440	i hate this place
1085	1258971995066306560	Finally I been telling y all to stop giving head well there you go
1086	1258971995431219200	Meanwhile CuomoPrimeTime CoronavirusPandemic
1087	1258971996114817026	Study COVID19 virus found in men s semen
1088	1258971996290940928	That s nice but there s no timeline for any phases yet and neighboring states are extending stay at home the
1089	1258971996320419850	amp Sam Empowerment Foundation SEF Pad Up Africa embarked on an outreach to Ruga village Giri FCT Ab
1090	1258971997968580608	Ya ll still think COVID19 is a hoax Roy of Sigfried amp Roy a gay man who performed magic in a cage with Tigers
1091	1258971998803419138	Not much has been done by the government to address artists hardship
1092	1258972022564061185	Of course not And he would lie about that too
1093	1258972022790664192	Coronavirus Pandemic Shows Moral Chaos at Heart of American Conservatism
1094	1258972023956660227	Direct deposit Jared the Vlad
1095	1258972026024361986	Family Alliance Ontario is advocating for changes so families caregivers are NotJustAVisitor They
1096	1258972026037035008	Something is not true in this story
1097	1258972026666192896	So Trump made his decision to downplay the virus because he was watching MSNBC
1098	1258972027261607942	Uh oh
1099	1258972027425357824	Coronavirus Belarus WW2 parade defies pandemic and upstages Putin BBC News
1100	1258972028100587521	FUCK
1101	1258972029170126849	This reminds me of that one Doom Patrol episode
1102	1258972030877134850	From today onwards we will start trying to tie up with the WHO and many others in order to get the required testi
1103	1258972031564955652	AarogyaSetu A Surveillance app at a time where I am spend most of d time home GPS A Surveillance
1104	1258972032064241672	Dr Deborah Birx Where Can the Coronavirus Live
1105	1258972032596881411	This was the April 24 Wisconsin rally not to be confused with the April 7 SCOTUS forced Wisconsin special el
1106	1258972033276395520	Is Trump s behavior endangering those around him Is his dis ease at what is happening to America so based on his
1107	1258972033309831168	Exclusive Ken Cuccinelli 8 in 10 Border Crossers Deported in 2 Hours During Coronavirus
1108	1258972033645305857	72 got COVID 19 after being at large event
1109	1258972033825869824	AND eleven members of the Secret Service
1110	1258972033955672066	I never said that My original statement was how he maneuvers through the world of hip hop full of gangsta
1111	1258972034010279943	446 cases disposed of by Madras High Court during COVID 19 Lockdown 10 206 cases disposed of by subordinate courts
1112	1258972036438700034	73 children infected with Kawaski disease in New York 5 year old dies via
1113	1258972036585517056	Shens really
1114	1258972036912775172	A spike in reported cases of a rare illness in children has health officials investigating coronavirus links lt br gt
1115	1258972038535892994	THIS CAN HELP AMERICAN LIFE WHO ASSISTANCE ON FEEDING THEY FAMILY BECAUSE OF LAY OFF FRO JOBS This Can Come In Hand
1116	1258972038619967491	The in person ACRM Conference ACRM2020 is ON as planned in Atlanta with social distancing and safety measures AND
1117	1258972040779960321	how s your mum doing with all this coronavirus stuff going on
1118	1258972041807491079	Reflect on this flies to Iowa to praise it on it s reopening while the state s caseload is rapidly acceler
1119	1258972042080268289	They way I just busted out laughing
1120	1258972042231234566	look like population control to me cleaning the house
1121	1258972042520559617	Gov Wolf signs order granting civil immunity to health care providers during covid 19 pandemic READ MORE
1122	1258972043162398720	Symposium on Wikipedia and COVID 19 May 9th 6pm
1123	1258972043468513281	Welp looks like I m still safe
1124	1258972045142044672	leadership DigitalTransformation COVID19 coronavirus MeaningfulGrowth GeniouxMG Extracted from
1125	1258972046253531137	de Blasio will have a lot to answer for when this is over his mismanagement amp incompetence cost many lives And i
1126	1258972048291819525	Twitter reacts to Jacare Souza s positive coronavirus test before UFC 249 via
1127	1258972048552087552	Trump is upset about the covid 19 virus in the white house How the fuck do we feel not being tested at all LavaLevelMad
1128	1258972048866652161	Health Workers held hostage by Coronavirus Patients in Kano
1129	1258972049361506304	I said it
1130	1258972053119500288	It beggars belief that some Americans can still support this pompous idiot
1131	1258972053279039489	Leading health experts from China and the UnitedStates have agreed during a webinar to act together and follow sc
1132	1258972054860304387	Far exceeded it
1133	1258972055128682497	Let s see Trump s valet tests COVID19 amp starts testing staff every day after being livid it got so close t
1134	1258972055204245504	Trump Offers Biden Coronavirus Tests I d Love to See Him Get Out of the Basement
1135	1258972055460085760	Uh it will still be an issue then
1136	1258972055577464833	Fourth Covid 19 related death reported in Lamar County 4 more cases found Free
1137	1258972055652962309	The US has slammed Iran s Mahan Air for its role in spreading coronavirus calling it a deeply tr
1138	1258972055699103744	A 107 year old artist who caught the 1918 influenza just survived an attack of the Covid 19 virus while a 60 year o
1139	1258972055808151552	More blacks are killed by other blacks and abortion than coronavirus
1140	1258972058274295809	Just feel the pain covid19 covid19india india indian coronavirus maharashtra bjp rssterrorist
1141	1258972059725631488	Smh at the ufc potentially exposing numerous people to the virus because of their rush to put on a show
1142	1258972059859730433	you wanna field this one
1143	1258972060749049864	Welp the show apparently must go on Here s the latest from espnmma s bokamotoespn MMAPOVPodcast UFC249
1144	1258972060790870016	SCSU creates COVID 19 Student Relief Fund The Times and Democrat Orangeburg S C
1145	1258972061474512896	Why waste tax payer time and money throw them in jail for 30 days and life time no fly ban Edmonton man challeng
1146	1258972063429058561	Judge Saheb passing same judgement for every case without reading a page Covid 19 COVID19
1147	1258972065383821313	Approximately 74 000 have died from Coronavirus in America Approximately 130 000 babies have been aborted since
1148	1258972066574983169	If 80 of Americans Wore Masks COVID 19 Infections Would Plummet New Study Says via
1149	1258972066830856193	Just for a moment Think about the kind of gal who would willingly date and then marry Stephen Miller And now yo
1150	1258972067581456384	CoronaVirusUpdates 57 new COVID19 positive cases have been reported today taking the total number of positive c
1151	1258972068357369856	It adds up perfectly You failed to take into account that Donald Trump is in charge of the U S response Just
1152	1258972068961349632	Yes I applied at the end of March but now I didn t have it and please help us to pay the rent while we
1153	1258972068982386688	Where Did the Coronavirus Come From Frontpagemag
1154	1258972072190984192	1 Mexico is the only OECD country with a straight ascending log log graph of new COVID19 deaths vs total
1155	1258972074531409921	Nice try It might impress people who don t know how to parse but no
1156	1258972075886174209	Melinda Gates says US coronavirus response is chaos gives Trump administration a D minus grade SmartNews
1157	1258972077144502272	theres not enough testing right now but there can be its political speak when they say testing
1158	1258972077224341504	COVID 19 Impact on Global IoT Based Smart Greenhouse Industry 2020 Market Size Growth
1159	1258972078184763397	Coronavirus Cases In India Inch Towards 60 000 Mark 1 981 Deaths
1160	1258972078218244098	Coundown has begun don t miss out the chance to unlock the offer 9 days left Presenting 10 90 payment plan on a
1161	1258972078218362881	Are you going to have a National COVID19 Death day soon
1162	1258972078298062848	Unfortunately ClownPresident is in son in law s pocket amp willing to sacrifice eve
1163	1258972080013488128	For every down there s an up A great future still lies ahead just delayed a bit Disappointing but recoverable
1164	1258972080353280000	Thoughts and prayers
1165	1258972083150708736	Trump says he s sending ventilators to Russia for Putin s coronavirus response but he previously pushed back on re
1166	1258972084543401985	Document reveals Secret Service has 11 current virus cases as concerns about Trump s staff grow
1167	1258972084774096896	You no dey ever post news
1168	1258972087315836929	trump dying of coronavirus would be poetic justice
1169	1258972087538122753	T cell subset counts in peripheral blood can be used as discriminatory biomarkers for diagnosis and severity predic
1170	1258972089928699905	I would go to battle with y all any place any time any day
1171	1258972090012708865	so there s enough tests for the government to test EVERYDAY which sucks btw but not enough for states to test eve
1172	1258972090159398912	Obama on Trump Administration s coronavirus response It has been an absolute chaotic disaster when that mindset
1173	1258972090381725696	I m glad a major news net is talking about this finally Death from virus is important amp scary and so is this
1174	1258972091321327616	After coronavirus are you gonna be passing joints and pipes around in a circle with god know who sitting with you
1175	1258972091614760961	A foreign nation is doing more than our own government despite treaties stating that the government must provide as
1176	1258972092269297671	Japan approves Gilead s Remdesivir for Covid 19 patients covid2019 covid19prevention
1177	1258972092692865024	He s not wrong
1178	1258972092906778625	Something something twin towers but yeah OK
1179	1258972093233926145	It s not just the pandemic it s his response or lack thereof that made this all the wors
1180	1258972095041556480	North Shore Health Department Sees More Coronavirus Test Results
1181	1258972096106885120	Please turn this around Look how many would immediately take a vaccine I feel horrified it s so high
1182	1258972097113718785	I ve been told the ice cream machine was broken at McDonald s before but I just got told by t
1183	1258972097839165441	Harris Sanders Markey Propose 2 000 Monthly Payments Amid Coronavirus Pandemic
1184	1258972098304884736	Yet another reason why I haven t had a flu shot in 20 years Coronavirustruth
1185	1258972099500298241	i m sorry but i am WHEEZING at absolute rotund sheep
1186	1258972100804689927	dumbledore would ve died of coronavirus
1187	1258972102612471810	Or tries to
1188	1258972103400882176	UK economy heading for worst crash in 300 years due to coronavirus
1189	1258972103543578624	Who s thinking ohhh just over 77 000 americans dead and counting THATS NOT BAD I GUESS JARED AND DJT THINK THEYR
1190	1258972104323674112	Nair We have to take care of the cure That will make the problem worse no
1191	1258972104428404738	All 11 COVID19 positive persons identified yesterday confirmed to be Navy personnel 404 of the 835 COVID 19 cases
1192	1258972104726372355	Globally classified drug but recognized and protected by Kenyan laws you can yap for all we care
1193	1258972107263754240	How to make face mask at home COVID 19 via
1194	1258972107427414022	Review Netflix s Trial by Media interrogates the relationship of the February conference eventually tested posit
1195	1258972107490250752	After video of unattended bodies dean replaced Lack of Logistics co
1196	1258972107549138945	Sports Breaking Ronaldo J acare Souza who was scheduled to fight Uriah Hall at UFC 249 on Saturday has te
1197	1258972108757053441	Damn the coronavirus is the first thing made in China to last this long
1198	1258972109818085376	COVID 19 Financial Assistance for the Self Employed
1199	1258972110871027712	Coronavirus Roundtable With Dr Buttar amp Dr Mikovits altCensored
1200	1258972111688871938	What did Trump say about those hot spots or those burning embers you stop them you gotta stomp them out Maybe
1201	1258972111957135360	Coronavirus 40 000 daily tests have to be done in strategic coordinated way says Lawrence Wong
1202	1258972112347451393	COVID 19 may infect 44m Africans WHO
1203	1258972113228177408	Again No underlying health issues here put it down as CoVID 19 Seriously
1204	1258972114192936961	People just don t get how hard it is and so much tougher for all iTU staff than the rest of us I applaud you Jenny
1205	1258972116864528384	REALLY Thats where your going with this is it Remember the Nursing Homes
1206	1258972117514645505	The number of Filipinos abroad who have contracted Covid 19 has reached 2 140 with 218 new confirmed cases on Frida
1207	1258972117699354624	Coronavirus Lockdown Kabul residents concerned about rising crime They say walking on streets and roads is di
1208	1258972118470909954	Good message from Hazzard Almost skipped it I thought it was a property auction
1209	1258972118722596864	COVID 19 is over when no one dies from it from a total of 15 days in a row
1210	1258972120358416384	Cristiano Natural Juice Maker Christine Fung Stepped In COVID 19 Zone And Delivered Her Detoxifying Juice Made From
1211	1258972120756838401	looks like covid 19
1212	1258972121012658178	Exclusive Toomey Calls for Reopening America Faster Virus Danger to Most Overstated
1213	1258972121079955456	He was mauled by Mantecore RIP Roy Horn of Siegfried and Roy Dead at 75
1214	1258972121906192384	New online tool allows Edmontonians to access more COVID 19 statistics yeg COVID19alberta
1215	1258972122518441985	gtfo covid19 i want a cuddle so bad
1216	1258972123101646853	FUCK SO CLOSE
1217	1258972123181322242	IF YOU RE FINANCIALLY STRUGGLING PLEASE READ Just had the create a NEW twitter account because twitter was hatin
1218	1258972123730599936	We were doing really well here in Vegas for a while but apparently that s out the window smh COVID19
1219	1258972125131673601	Hong Kong study finds drug combination nearly twice as fast at suppressing virus
1220	1258972125727162368	Love it
1221	1258972130672168966	Spoiled American what else is new Poor you At least you still have your life America has 28 4 of
1222	1258972131058204679	So far my favorite headline is VP Pence staffer amp wife of close Trump aide Stephen M
1223	1258972131251101696	WHY may I ask does the daughter wife need an assistant What does she actually do
1224	1258972132127711234	A 75 year old dies of old age The man has had failing health since he was mauled while playing Vegas years ago
1225	1258972132387819522	Qui bono Who benefits
1226	1258972133218308099	In higher doses which you would need to treat COVID 19 with this stuff it often causes a fata
1227	1258972134329769985	Nigeria Women
1228	1258972134543523841	The way that coronavirus infected so many pople on US and the genetic mutation rates escalates very quickly is scar
1229	1258972134925201408	Are Pakistanis infiltrating Gujarat and Maharashtra with CoVid19 Just asking
1230	1258972135080378369	11 Secret Service employees infected with coronavirus 60 in self quarantine via
1231	1258972135273488384	Beating coronavirus needs return to healthsurveillance says
1232	1258972135881453569	ph Hello hope you can donate to our drive so we can help the less fortunate and continue to support our fr
1233	1258972135898284032	Social Dialogue is needed to address the COVID19 crisis says protecting the needs of the most vulnerable wo
1234	1258972137756360705	The coronavirus crisis is reaping big political benefits for Democrats President Trump s signature achievement a b
1235	1258972138368831488	Tory I don t consider what is happening to us as a defence mechanism rather it s what nyu has zero
1236	1258972138746372096	The Virus Is Constantly Mutating What That Means for Treating Covid 19 Is Up for Debate
1237	1258972140289822722	Roy Horn of Siegfried and Roy fame dies from COVID 19 complications ABC News via
1238	1258972140453482496	I sincerely hope every one of them coughed on Emperor Cheetolini
1239	1258972142001025025	Coronavirus Global economic fallout continues from the pandemic Coronavirus
1240	1258972143749984261	Coronavirus live news global cases approach 4 million as US unemployment hits 14 7
1241	1258972143985086465	Jacare Souza positive for coronavirus scratched from UFC 249 via
1242	1258972145150881792	DOES POTUS KNOW Bill Gates created computer viruses to sell anti virus software Now he is threatening the life o
1243	1258972145184460801	Penis covid 19 Jen Mote
1244	1258972145394171906	The COVID19 Pandemic finally issues statement President Trump will vanish without a trace after Nov 3 with
1245	1258972146547605505	My views on what the government must look at before reopening schools in India COVID19INDIA schoolsreopening
1246	1258972147009179648	Whew I passed thank the Lord I m done I was so worried and on top of that I was praying I do good Now it s
1247	1258972148514918400	Worsted leadership
1248	1258972151400595457	Trump says he couldn t have exposed WWII vets to COVID 19 because the wind was blowing the wrong way
1249	1258972151693991936	Triple drug therapy helps coronavirus patients recover more quickly study finds
