	tweet_id	tweet_text
987	1262233340251238400	If does have the CoVid19 there is no way in hell he will be able to hide it He is either under Mother s lockdown or he is ill
988	1262233342851899393	I rather tax free pay check during covid19 20 21
989	1262233343049023489	need to know basis
990	1262233343405457408	Creepy Joe Creep Creepy Joe obamagate Qanon ObamaKnewEverything COVID19 OBAMATRAITOR
991	1262233344714117121	Stupidity at its best
992	1262233346530295809	Trending downward
993	1262233347205586944	Facts
994	1262233347767570432	Covid 19
995	1262233348442853376	Except America is doing far better than Italy but hey you know what defend shina I m sure they ll take care of the
996	1262233348992368640	European Union should impose a temporary ban on Chinese takeovers of companies
997	1262233350238060550	Now when ever I see a nurse in a porn scene I stand up and clap before I masturbate April 7
998	1262233351043375105	How wife helped save life of retired Welsh cop after he contracted Covid 19
999	1262233352142233608	Then prove it with names and travel details of all such people with media
1000	1262233353010511874	The science of why people like round numbers means 100 000 Covid 19 deaths in US should resonate
1001	1262233353631215617	It s too early to look at Georgia s coronavirus cases and declare that reopening works
1002	1262233358739763200	World Health Assembly what is it and what is the coronavirus inquiry proposal
1003	1262233359171719168	SavePrisoners GrantParole Death of Agra Central jail s inmate due to Covid 19 is an al
1004	1262233360165826560	And THIS is a perfect example of why we had to get the hell out of Orange Co Calif WAAAAY too many rightwingn
1005	1262233360601976834	THE MOST IMPORTANT QUESTION
1006	1262233360979709957	Somehow Dr Bright said he knew COVID 19 was being transmitted human to
1007	1262233361021571079	even 6ix9ine calls it the coronavirus bro no reason for u to call it the kung flu
1008	1262233362166677506	Considering Jaipur s recent case of covid 19 in jail Prisoners must be released as social distancing is not possi
1009	1262233362493698053	I hope Sheriff is keeping an accurate count of COVID19 positive people amp those dying from COVID19 Continue testin
1010	1262233362657234944	Help me out what has Drumpf been right on NO The tax cuts DIDN T pay for themselves added 4T debt
1011	1262233362904702976	on he is a proven liar
1012	1262233364272001026	Governor Your public health orders conflict with child sharing arrangements between co parents who
1013	1262233368332087296	It s not an error or mistake if it s happened three times coincidentally in the weeks since the state reopen
1014	1262233370047787008	Can t help but wonder if the washboard craze isn t due to boredom but being scared to go out of apartment to use th
1015	1262233370190385152	ah fuck
1016	1262233370613952512	coronavirus Highest ever spike of 5242 COVID19 cases in last 24 hrs 157 death reported in last 24 hrs Total n
1017	1262233373222801409	The country will be his guinea pig Each state will get a different vaccine on Jan 1st Being in a blue state I l
1018	1262233373877166080	see there are props to having a stoner as a gf
1019	1262233374225129472	It shows what a fake news fraud you are Nearly 90k dead and she s just wearing the mask for show cnnfakenews
1020	1262233376242597889	What the hell once again you just suck at your job WorstPresidentEver
1021	1262233379124031488	COVID19 With Nine Fresh Deaths Thane s Death Tally Reaches To 114 Read Here
1022	1262233379631771648	Forget work life balance it s all about integration in the age of COVID 19
1023	1262233379745026048	We didn t infect enough people BBC News Dame Donna Kinnair Slips u via
1024	1262233380088958982	HemantSoren jharkhandcm DCpalamu please apply the same guidelines in Jharkhand as centre has approved
1025	1262233381192044544	In the Shadows of Smokestacks Virus Is One More Deadly Risk Poor communities near industrial areas face heavy poll
1026	1262233381569540096	All I m saying is don t get ya ass in social media talking about some pray for me or my family member cause they g
1027	1262233383419047939	Why Are Women Led Nations Doing Better With Covid 19 The New York Times
1028	1262233384614613002	So far no spike in coronavirus in places reopening U S health secretary says Article AMP Reuters
1029	1262233384899624960	Approximately 11000 people died in 2016 from alcohol related car accidents That is approximately 30 people every
1030	1262233387013754881	A few early thoughts on the analysis of the COVID19 responses In short it s something that is going to need to be
1031	1262233387517054977	Coronavirus COVID 19 Tracker
1032	1262233388989235203	So with the highest death in the world what does that make the USA then CNN CNN claims Covid 19 devastated Mosco
1033	1262233389102481408	Sir Actually mera ye message h ki jammu university k jo prvt exams pending hai jinka abi tk resul
1034	1262233389559619584	A person ran into two E R nurses amp asked them point blank is the coronavirus as bad as they say Without hesi
1035	1262233393636487168	Because it can take two weeks for symptoms to appear after a person is infected there is no way to know if you re
1036	1262233393808506882	So far no spike in coronavirus in places reopening U S Health Secreta via
1037	1262233394345324546	HHS Chief Azar says States That Reopened Have Not Had Spike in New COVID 19 Cases I guess that s because Texas i
1038	1262233394429038593	It s clear this government is still NOT ready despite placing our country under ECQ for months Everything is real
1039	1262233399588032512	East African dairy under COVID19 How is this vibrant sub sector faring Join for a webinar 28 May from 5
1040	1262233400112373760	They Already started these IGLive Concerts LMFAOO
1041	1262233400921821186	The term Covid19 is used to cover up 5G inflammation reaction on human cell it undermines immune s
1042	1262233401819639809	US sanctions make it harder to fight COVID 19
1043	1262233401836204032	In Philly alone
1044	1262233402368913410	Stories of Hope via
1045	1262233403476389890	Thank God it is my prayer that we don t loose any colleague to SARSCov2 COVID19
1046	1262233404126437376	Living blue in SC is well different Sumter County is 15th in population but 7th in number of ca
1047	1262233405602754560	17 mes2 Yes Coz covid 19 symptoms may appear after that
1048	1262233405632192515	2 died 1 seriously injured Some had recently spoken out publicly against govt for their handling of pandemic which
1049	1262233407209250817	Ambikapur Coronavirus Update First case of corona in Surguja shows no symptoms in women
1050	1262233407473487873	THE GREATWAKING IS TRENDY
1051	1262233407876034560	Covid 19 Donation Buying gt gt gt gt gt gt gt gt gt gt gt gt gt gt gt gt gt gt gt mere Covid Buying
1052	1262233410598088704	They don t want you cured They want you broke injected chipped and tracked
1053	1262233411713990657	All They Need to Do is Go On youtube it s enuff info on there about COVID19 they can save their budget
1054	1262233412120776704	As States Reopen Governors Balance Existing Risks With New Ones
1055	1262233415656419328	The term Covid19 is used to cover up 5G inflammation reaction on human cell it underm
1056	1262233416503705601	Is Fox News staff still filming from their homes
1057	1262233416709398528	The latest The Alternative investing Daily Thanks to investing coronavirus
1058	1262233416986251269	Trump is DESPERATE and truly losing his mind amp supporters Trump is blaming President Obama for the coronavirus WT
1059	1262233417044770817	Oooh juicy I ve worked from home for years but I do miss visiting my clients in person
1060	1262233418491822080	Is there still a pandemic Yes Stay home Has the curve dropped No Stay home Does the internet telepho
1061	1262233418521337857	ReaalAmerican Check back in a month Trump is hiding the fact that case rates are
1062	1262233419062312960	UK coronavirus death toll rises by 170 lowest increase since March UK coronavirus death to
1063	1262233419146133505	India should focus on Make in India 2 0 targeting global investments beacuse COVID 19 crisis is likely to push 120
1064	1262233420320501761	BELIEVE IT OR NOT TAURUS is emerging as the No 1 Choice for safe holidays post Corona COVID 19
1065	1262233420538826755	Dying with something is not the same as dying from something The young and he
1066	1262233420928651264	Calls for Australian Defence Force chloroquine COVID 19 drug trial to be halted
1067	1262233421335506945	Exactly that s how the no of deaths due to COVID 19 are fudged in India Cause of death is being manipulated
1068	1262233421721464833	Rate of Active COVID 19 cases in Rajasthan have increased by 20 in last 24 hours compared to previous reporting p
1069	1262233423739043846	Qusay Biden campaign calls Eric Trump s coronavirus comments unbelievably reckless
1070	1262233424804413441	Pop Smoke s Murder Investigation Held Up by CORONAVIRUS Report
1071	1262233428331655176	Navajo Nation is at 4 002 positive COVID 19 cases The number of deaths is at 140 and approximately 544 recoveries
1072	1262233429732712450	This is what Obama tells young graduates a really disgusting good wishes as you complete this huge stage in
1073	1262233430768660481	Can Teledentistry Improve the Monitoring of Patients During the Covid 19 Dissemination A Descriptive Pilot Study
1074	1262233430848241664	Our Agriculture sector has played a pioneer role during the Covid19 calamity though itself to have been unplanne
1075	1262233432324575234	this reads like fic description on asianfanfics
1076	1262233432358338560	Have you noticed all of the bad things that have stopped as a result of Covid19 No more homeless No more overdose
1077	1262233433427726336	twt they are young let them live the life of adolescents help them be aware of this without depriving them
1078	1262233434253975553	Wow they really had to make mino went through unnecessary shits
1079	1262233434778292226	I don t know how many more times I can facepalm in 2020 Raging house party amid coronavirus ends when man shoots
1080	1262233435223085057	Russian State Television Pushes Conspiracy Theory Bill Gates Is Behind Coronavirus Pandemic
1081	1262233435357229056	Some Companies Seeking Bailouts Had Piles of Cash Then Spent It corporate oligarchy greed inequality
1082	1262233436489576448	In coronavirus years that s like 246 you old bitch HBD
1083	1262233437064347650	Covid19 I don t think so
1084	1262233437622030338	The term Covid19 is used to cover up 5G inflammation reaction on human cell it undermines immune s
1085	1262233437684895744	90 000 Americans If Covid 19 is truly that deadly then
1086	1262233439450787842	this would be a huge step in the correct direction
1087	1262233440818208768	Don t Miss COVID 19 Updates everyday at 10 am on DD Bharati
1088	1262233440952426497	WA coronavirus LIVE Pubs and restaurants set for limited reopening as some intrastate borders come down
1089	1262233440956678144	Coronavirus updates LIVE Premier announces 2 7 billion construction package McDonald s shuts a dozen Victorian r
1090	1262233441535434752	When Will Everything Open Polis Lays Out Timeline In A Coronavirus Update To Coloradans READ MORE
1091	1262233441829105665	Covid19 How to offer Eid prayers in UAE as you StayHome
1092	1262233442378375168	How many people have to come into his circle and then get screwed before the dumb ass s figure out it s a bad mo
1093	1262233443934646275	Coronavirus updates LIVE COVID 19 inquiry gets international backing at World Health Assembly as Daniel Andrews sp
1094	1262233444588810241	How grim More than 150 Australian newsrooms shut since January 2019 as Covid 19 deepens media crisis
1095	1262233444853178368	It eats him alive inside Trump s latest attack shows endless obsession with Obama
1096	1262233445499092992	Top scientist who battled COVID 19 says we will never live normally without vaccine READ MORE
1097	1262233446178369538	HPGovt attributed the cause of a surge in COVID19 positive cases to the return of over 1 5 lakh people stranded i
1098	1262233446761496578	According to a report at least 100K cruise ship crew members are still stuck at sea amid the coronavirus amp that
1099	1262233448258953218	Raging house party amid coronavirus ends when man shoots himself in the groin police say
1100	1262233448279937024	The Government has played a big role in ensuring that it has provided the necessary resources required
1101	1262233449630519297	Hiring in crisis How startup are onboarding new recruits during the COVID 19 pandemic via
1102	1262233449693196295	The term Covid19 is used to cover up 5G inflammation reaction on human cell it undermines immune s
1103	1262233450326700034	The world is watching you and America that once greatest nation is now an object of pity and
1104	1262233452637589505	World s quest for Covid 19 vaccine is in danger of becoming a free for all
1105	1262233452843335682	Are you kidding me
1106	1262233453954846720	ASKING THE REAL FUCKING QUESTIONS LIKE CANCEL THEM
1107	1262233456106299394	Listening to BBC World Service overnight it s a European Community initiative with other countries including Au
1108	1262233456261529600	NSW coronavirus social distancing rules introduced on public transport as authorities confirm one new death
1109	1262233456622346240	Guten tag please find the unroll here BREAKING Huge surge in COVID 19 cases in Texas
1110	1262233456701870080	COVID 19 early release of super is not considered income for income support payments Keep in mind
1111	1262233457616392193	I take all the data about COVID19 with a grain of salt Red state governors cannot be trusted to provide honest tab
1112	1262233457813528579	What an irony this guy s record prior to Covid 19 should have been enough to defeat him at the polls G
1113	1262233457821773824	90K Covid19 deaths and counting you incompetent orange rapey imbecile WTF is wrong with you
1114	1262233461487738888	Just observing the Covid19 with a eagle s eyes
1115	1262233461554843650	Plandemic Documentary The Hidden Agenda Behind Covid 19 BitChute
1116	1262233462565634053	A CARER who died from coronavirus was holding a picture of her daughter and granddaughter in her final moments
1117	1262233462884483072	NowPlaying Dadju Jaloux COVID19 STAY home as much as you can KEEP a safe distance WASH hands often
1118	1262233464235003904	Best way to clear the clouds of unverified conspiracy theories and stop Trumpean politics India Joins 61 Nation
1119	1262233464612495360	Black market booming in legal pot California Catch and release Arrests made for illegal marijuana grow in Covelo
1120	1262233465153560577	Fargo area accounts for 70 of active COVID 19 cases as illness claims another victim May 18 12 06 AM ET
1121	1262233466994921474	COVID 19
1122	1262233467032670208	Coronavirus death toll in Mexico a mystery Los Angeles Times
1123	1262233469259636741	Coronavirus live news record daily cases in South Africa as India extends lockdown
1124	1262233471113736197	brockmann This is not a we should keep quarantining no more quarantine argument an
1125	1262233472002711554	WHO s exclusion of Taiwan from coronavirus assembly leads more nations to sound the alarm FoxNews
1126	1262233473500184576	A fast track vaccine to fight prevent COVID19 is the need of the hour Entire world is looking forward to Top Medi
1127	1262233473894539268	Huge day as Detroit Three restart at least 52 plants shuttered since March by coronavirus
1128	1262233475018559493	Coronavirus Live Updates in the last 24 hours five thousand more than the patient continue the death figure of 3
1129	1262233475177787393	stfu
1130	1262233476226584585	waiting for governormurphy pleaseopenjersey openjersey covid19 wearewaiting Brio Beauty Lounge
1131	1262233476440490000	until there is proof by dispatch but you don t
1132	1262233477501669376	180 in quarantine after person with coronavirus attends Mother s Day church service in California
1133	1262233477761531904	Ah Okay
1134	1262233478487330816	When Pennsylvanians know that they have safe and secure housing they can focus on doing their part to fight the C
1135	1262233481913958401	Dairy Cows Are Becoming Meat Amid COVID19 Meat Shortage via
1136	1262233482224336897	Indore jail holds 2220 inmates against the sanctioned capacity of 1230 Hence it was expected that a few of them wo
1137	1262233483134464000	Drove back with fiancee maneck to our home in Goa He s goan My home car amp business are all goa registered Th
1138	1262233483558047749	The Japanese shall get their revenge
1139	1262233483767840768	The idea of Stacey Abrams as VP is more frightening then COVID19 It would be Biden s first big amp possibly last m
1140	1262233486771060739	Here s another friendly reminder that when Covid 19 first hit Canada immediately agreed to give each citiz
1141	1262233486980603906	Funny But Effective
1142	1262233488561827842	Pharma Bro Martin Shkreli Denied Release From Prison To Research Coronavirus Cure yet Paul Manafort walks free
1143	1262233489333608449	Brazil Coronavirus Map and Case Count
1144	1262233490461884417	90k deaths Covid 19 deaths and Trump is tweeting about Hunter Biden So I guess you ar
1145	1262233490608668672	Tokyo tested an average of 165 people per day May 1 May 14 That s not correct Will That s on
1146	1262233491036467200	I m gonna keep retweeting this Jerome Powell quote each time there s an new wave of COVID 19 here in the US and it
1147	1262233491971825664	TrumpProjection Trump is the most incompetent President of US Deaths during Ebola Virus with Pre
1148	1262233493955805185	LockDownDay50 As we Maskup it is important we use it correctly We shouldn t hang it on our neck or ears We sh
1149	1262233495105085443	Covid19 have no vaccines bcoz every country have different shape of that s virus
1150	1262233495339962368	Spot on as always
1151	1262233495490961408	JFC Another CORRUPT Republican
1152	1262233495495012352	Insightful op ed from Co Founder Gregory Satur and long standing innovAGEING supporter on improving
1153	1262233495868407808	Dizzy With COVID 19 Data
1154	1262233496229154816	This is damning on what appears to have passed for evidence among some in Washington who were pushing the lab lea
1155	1262233496572968960	Worrying signs but time to be resolute
1156	1262233496686190593	Newsom Under Fire for Secretly Making 1B Mask Deal With Chinese Company
1157	1262233496929677314	Retweets do not imply
1158	1262233498137526272	13 residents 5 employees positive for COVID 19 at Springfield assisted living facility WZTV
1159	1262233498263465984	In as so much as we seek ways for stopping covid19 we have also to remember to seek God s intervention He has solution
1160	1262233498972233730	Virginia is just ignoring Northam and it s utterly delicious
1161	1262233499064578051	Frustration is building among scientists over the government s apparent lack of willingness to make key detailed C
1162	1262233499676766208	2 more passengers on Mumbai Goa train test positive Tally of active cases 31 IndiaFightsCorona COVID19
1163	1262233499680923648	rame ni gc
1164	1262233500154949634	shade
1165	1262233501853642752	Trump s New COVID 19 Czar Holds 10 Million In Vaccine Company Stock Options via G
1166	1262233501962768385	NOW Nigerian Coronavirus Outbreak Highlights Emerging Threat in Africa Live Coverage
1167	1262233502998761472	Not going to read this article but I hope his comments are a joke
1168	1262233503720079360	YES IMPEACHED is doing a GREAT JOB UNEMPLOYMENT RATE 15 36 MILLION JOBS L
1169	1262233503791484928	I live in this county
1170	1262233505519394819	racket 85 MILLION Even 85 THOUSAND is trusting skewered statistics because of deaths WIT
1171	1262233505980964864	When COVID 19 exposes your kinks in public
1172	1262233506228236288	This is what we get with Texas juking their numbers with positive antibody testing yeah
1173	1262233506400227328	Queensland border closure could remain in place until September Premier warns
1174	1262233506694025216	Belgium
1175	1262233506907918336	Greece heads presidency of the Council of Europe and selects COVID 19 theme to head agenda
1176	1262233507922771968	Must read
1177	1262233508707217410	jitin serv er o l i e perla
1178	1262233510556778496	Still waiting for you to apologize to Mino and all the damage you ve done to him
1179	1262233510976221184	The term Covid19 is used to cover up 5G inflammation reaction on human cell it undermines immune system a
1180	1262233511685173248	Considerations for the Management and Triage of Ocular Oncology Cases during the COVID 19 Pandemic
1181	1262233512578596864	Why is the coronavirus lasting longer then most relationships
1182	1262233512817471490	Overcrowded jails are emerging as Corona hotspots Arthur Road prison authority has informed that
1183	1262233513048158210	The aviation experts have shared this white paper looking at the likely timeline for recovery of air passenger
1184	1262233515904700423	Mayor Lori Lightfoot says city will take action if defiant churches hold in person services despite stay at home
1185	1262233516219260928	Trump could start by being less of an asshole He could also for once show some sympathy for the t
1186	1262233518014205952	Punjab recovery spike explained here
1187	1262233518287081477	Brazil overtakes Spain Italy in COVID 19 confirmed cases Brazil overtakes Spain Italy in
1188	1262233519012458496	Spreading misinformation also doesn t help
1189	1262233519796994048	uttar pradesh lockdown 4 0 guidelines containment hotspots red orange green buffer zones coronavirus
1190	1262233520434319360	deepak Coronavirus spreads quickly in closed spaces like cruise ships
1191	1262233520669253632	Why this computer man calling world leaders Did President Trump authorize him Bill Gates calls on G20 countries
1192	1262233520799277056	The corruption in the US is blatant They don t care who notices
1193	1262233521063510016	Kids are having pandemic dreams too via
1194	1262233523970281472	Check out the part 2 of the live episode by Simblified Absurd predictions for a post coronavirus world Episode
1195	1262233525790654464	Coronavirus Calls to investigate global response BBC News
1196	1262233525844996096	I can see how you d think that But successful viral
1197	1262233526256242688	Video India Joins 61 Nations To Seek Impartial Probe Into Coronavirus Crisis
1198	1262233526335930369	Sure how convenient that would be for Cuomo
1199	1262233527288049664	Oppo suspends production at Greater Noida factory after workers test Covid 19 positive
1200	1262233527812272128	They are all INSANE EACH AND EVERY LAST ONE trumpfamily
1201	1262233528353382401	I take Hydroxychloroquine It is
1202	1262233529099841537	AWD Disposable For Civilian Use Covid19 Corona Quarantine Lockdown Facemasks Protection CoronaVirus CDC
1203	1262233529116745729	The Missing Deaths
1204	1262233529699704838	What a stupid ignorant bitch Just wear the fucking mask
1205	1262233530114826240	No to the uncertain vaccine We don t need a vaccine We only need hydroxychloroquine z pack combo
1206	1262233530408501249	Coronavirus may have spread at a church service Now the pastor is speaking out Los Angeles Times
1207	1262233530744045568	Atl fags out here partying fuckin n suckin without restraint Like Coronavirus ain t real
1208	1262233531972870147	Help me out what has Drumpf been right on NO The tax cuts DIDN T pay for themselves added 4T
1209	1262233532774133760	so my cousin is convinced that covid 19 is a hoax and that the tests are just to get your dna so i reminded her th
1210	1262233535273820160	Phuket No new coronavirus cases Thailand
1211	1262233537333342208	Coronavirus Man s ingenious solution to cuddle his grandma again goes viral
1212	1262233537874280448	what r u doing dispatch hhhh
1213	1262233537878675461	Florida gotta go
1214	1262233537928761346	Rajasthan COVID19 COVIDUpdates Today s total positive till 9 am is 140 Today s death reported till 9 am is 2
1215	1262233538440527874	The term Covid19 is used to cover up 5G inflammation reaction on human cell it undermines immune sy
1216	1262233539669450755	Why these bureaucrats are so jealous when the poor chaiwala build a hovel for him
1217	1262233540382658560	As mosques reopen in West Africa COVID 19 fears grow
1218	1262233540395057152	Here s GOOD NEWS Only 5 7 of the number of COVID19 tests in the US are confirmed POSITIVE for coronavirus toda
1219	1262233542781591553	Join me in helping CoronaVirus victims with Ecoin and earn 600 Ecoins worth 3 free Ecoin the world s fa
1220	1262233543071023106	Coronavirus in the UK Boris Johnson s promised workplace safety inspections don t exist inews SmartNews
1221	1262233545143128064	The pain of a parent suffering with her children with nowhere to take them for refuge Nairobi is on a sessation so
1222	1262233545914933258	Dem imposed coronavirus orders face lawsuits across the nation SmartNews
1223	1262233546300616704	Elizabeth Warren Says Her Brother s Coronavirus Death Didn t Have to Happen
1224	1262233548087537664	COVID ALERT Sen Ben Sasse blames thugs in China for coronavirus in graduation speech Global Pandemic News
1225	1262233548204974080	Coronavirus South Africa to repatriate 200 stranded Indian citizens on Friday Business Today
1226	1262233549450534912	India covid19 Updates Region East Bihar State Bihar Confirmed 1262 Cured 475 Deaths 8 Updated on 2020 05 18 09 39 10
1227	1262233550054584323	This is stupid you re You just praised the guy who bashed your own administration The CDC is you
1228	1262233550809632770	The latest the daily eSocial 2 0 feed programming coronavirus
1229	1262233551266816001	Join me in helping CoronaVirus victims with Ecoin and earn 600 Ecoins worth 3 free Ecoin the world s fa
1230	1262233551564451840	Most of europe China Some of africa Australia Canada southeast Asia India Turkey most 3rd world countries
1231	1262233551912632321	Trump s enemies Barack Obama Whistleblowers Coronavirus Media CNN MSNBC NYT WaPo Windmills Gre
1232	1262233552063795200	Jaipur jail has become the 3rd biggest Corona Hotspot Govt must grant parole to prisoners for their safety
