	tweet_id	tweet_text
0	1258971017730498561	Coronavirus Trudeau finally thanks Taiwan directly for generous mask donation cdnpoli
1	1258971019160633344	Coronavirus found in men s semen
2	1258971021388009472	Wonder how this news brief is going to go when it s an NFL player
3	1258971022424002568	This is very sad RIPRoyHorn
4	1258971023573213185	And now you re killing them coronavirus
5	1258971023761829889	Donald Trump not worried about coronavirus spread in White House after Mike Pence s press secretary tests positive
6	1258971024009265153	We will never know that they have it Oh boy here we go
7	1258971027108794368	Heart wrenching
8	1258971027318718465	The Role of Digital Tools in Taiwan s Response to Covid 19
9	1258971027708751874	I hate tosay it but maybe the next peak in 3 weeks will bring on police patrols and the national guard to enforce l
10	1258971028413222924	Plandemic Documentary The Hidden Agenda Behind Covid 19 BitChute
11	1258971028434440194	Latest Update 386 New COVID 19 Cases And 10 New Deaths COVID19 Covid 19 kanovskaduna
12	1258971029503803393	So gross realDonaldTrump Donald TrumpIsALaughingStock WorstPresidentEver TrumpIsALoser
13	1258971033681498113	Im so sorry because even if he was a MAGA he is still a human being we have to unite and get our country back to
14	1258971033735884801	We are fortunate in Australia that the states have ignored the demands of ScottyFromMarketing to do little
15	1258971033962532864	If this was admitted by gov 7week earlier than you and your team would have put headline like go
16	1258971035174658048	Coping with coronavirus Platform on running an esports venue in lockdown
17	1258971035656957958	Damn I m The Number One Vector For Coronavirus Spread Then
18	1258971036554366976	Un appy Scott flaws and inconsistencies start to mount for troubled surveillance app in Australia
19	1258971037708046337	Debunking Plandemic The Coronavirus Conspiracy Video
20	1258971039213723648	I am raising application on since days and
21	1258971039616217090	More cost cutting no pay leave for BreadTalk Group employees as Covid 19 crisis and control measures cripple compa
22	1258971039830355973	Sad May his soul find peace
23	1258971039918424064	Knowledge is a Segway to strength and exploit It s the greatest threat to sickness ignorance and mediocrity
24	1258971040967020545	The White House is a hot spot for COVID19 all of a sudden
25	1258971041747005440	Roy Horn of Siegfried and Roy Dead at 75 After Catching COVID 19 via
26	1258971042032185344	There have been reports of coagulation issues associated with COVID19 infection Good thin
27	1258971042795663361	Listen live to Cristo Foufas Who s to blame for confused coronavirus messaging this week The media or govt T
28	1258971043026341888	We were even ready to face coronavirus to make a living Dhobiwalas via
29	1258971043688927234	Latest data from the 5 worst hit countries by COVID19 on Sat US 1 283 908 confirmed 77 180 deaths Spain
30	1258971044670590976	excellent ways suggest to give a direction to economic revival package
31	1258971044779442176	Go listen my new freestyle Emotionally Scarred lilbaby 1 youtube coronavirus covid19
32	1258971044972544014	do you know any chef that would teach me how to cook a meal and pair it with a nice wine COVID 19 has
33	1258971046830465024	To FlattenTheCurve workers need H E L P Health Emergency Labour Protections Sign the petition to your provincia
34	1258971047321382916	And the truth shall set us free np MarilynManson AmericaStrong coronavirus Covid 19 MothersDay
35	1258971047870656513	Worse Every Damn Day kakistocracy
36	1258971048357183488	PM Modi Italy PM discuss health economic impact of COVID 19 COVID19 EconomicImpact Trending
37	1258971049263235072	F1 News No financial candy to be handed out to teams says F1 boss Carey Formula 1 boss Chase Carey says it won
38	1258971049875705856	unroll
39	1258971050777477122	China Reports One New Coronavirus Case 15 Asymptomatic Cases
40	1258971050873892864	Triple antiviral drug shows early promise in COVID 19 trial
41	1258971051050119169	A CORRUPT SOCIAL NETWORK IMAGINE THAT Twitter Defends China After State Department Identifies Coronavirus P
42	1258971051112853504	Before COVID19 tweeters use to party act silly have fun Toast each other It wasnt that long ago I miss those times Do you remember
43	1258971051448467457	Add the new COVID19 symptoms from children smh Now some WH staff are infected good karma that karma still has a job
44	1258971051716902914	Questions Before Returning To Work After COVID 19 Above the Law
45	1258971052845273088	Lets just admit that we don t know the IFR is while the CFR circles around 5 and we
46	1258971056552816641	And morning news didn t cover it this morning Nor the markets going up
47	1258971057005817857	AlohaFriday Please come to Hawaii AFTER quarantine is over Covid19
48	1258971057211441154	Jacare Souza tests positive for coronavirus his UFC 249 bout vs Uriah Hall off SportsCenter
49	1258971057542709250	Malaysia s response deserves greater recognition as a meaningful example for countries that have insecure borders
50	1258971058310270978	Finance Assistant Secretary emphasizes priorities of the government in COVID 19 fight protect lives and protect c
51	1258971058369187842	Another weapon that some white skinheads will badly and frequently manhandle
52	1258971058389934080	The original Tiger King May he rest in power
53	1258971059027693571	And what do you tell the thousands of New Yorkers who are starving and loosing their homes You re ho
54	1258971059304398850	Tennessee officials to focus COVID 19 testing on urban housing prisons nursing homes WZTV
55	1258971059375620096	COVID19 Cases in India Predictions and Observations
56	1258971060277403649	dADDY WITH THE little d said it is a Hoax so ALL OF U S are safe now go play like a good little girl
57	1258971060277522435	amp COVID19 is just the flu amp is a great leader
58	1258971062404091906	COVID19 deaths 9 May USA 77 180 UK 31 316 IT 30 201 ES 26 299 FR 26 233 BR 10 017 BE 8 521 DE 7 5
59	1258971063817588738	Exactly Coronavirus created fear in our nation Our body builds immunity through being out and about Face masks a
60	1258971064803221507	Breaking The novel coronavirus can persist in men s semen even after they have begun to recover
61	1258971065381879808	5 year veteran in Novel York dies from extreme illness linked to coronavirus Check it out
62	1258971065587396609	This is what I want to hear about Not ridiculous fly overs from Jet Blue or the Air Force
63	1258971066132643840	Here you go So sad Why this isn t newsworthy
64	1258971066547892224	Trump and McConnell s COVID 19 Liability Protections Are Completely Unnecessary SmartNews
65	1258971068359835649	Can someone explain the difference being the Hong Kong Flu and COVID19
66	1258971069953658880	One is a Leader One is a Narcissist
67	1258971070188720128	Bus riders used to die of heatstroke because the bus stops didn t have a tree shade Now they die of coronavirus
68	1258971072608833539	It s funny how people can find numbers from
69	1258971077096755200	Roy Horn of Siegfried and Roy Dead at 75 After Catching COVID 19 v a
70	1258971078489235457	It s good to make plans It does not mean you can say right now what the world will look like in 4 months So you b
71	1258971079055421440	Experts call for providing COVID 19 patients at home with tele consultation
72	1258971079470702592	Oh COVID 19 plus that rancid gene pool mutation
73	1258971081215406085	1 in 4 Americans have worms for brains xx
74	1258971081794301952	Me directing Coronavirus to attack rampant white fragility next
75	1258971082909863936	Stems from Australia s choice to deny these people asylum Refugees don t HAVE TO be locked up in detent
76	1258971084898123776	Revealed major anti lockdown group s links to America s far right
77	1258971084906532864	Heartache vs Infecting parishioners Most in US back curbing in person worship amid coronavirus yet Vice Preside
78	1258971085594341381	Prioritise play when schools reopen say mental health experts Primary schools The Guardian News from the UK
79	1258971086416297986	Coronavirus Tourism minister warns high prices could dampen domestic travel projecthopetravel travel news
80	1258971087129522179	After GoAir and SpiceJet IndiGo cuts salaries for employees Airline Aviation Coronavirus COVID19India
81	1258971087401963522	Trump Offers Biden Rapid COVID 19 Test To Resume Campaign Travel projecthopetravel travel news
82	1258971088278614017	1600 Pennsylvania Ave is starting to become a Covid19 Hotspot Maybe they ought a start wearing masks
83	1258971090510131201	When there s nothing to do BlackWoman COVID19 Melanin
84	1258971090753216512	Northern Sask COVID 19 travel ban put summer camps at risk manager says
85	1258971090912772096	Are we gonna take this seriously yet Science matters
86	1258971091650990080	No big deal it will go away
87	1258971092288507905	What rules have these lot been following Thread showcasing just a snippet of
88	1258971092460474368	Triple combination of interferon beta 1b lopinavir ritonavir and ribavirin
89	1258971093445955584	Looks like a new guest has just arrived at the Masque
90	1258971094880448512	Carol Baskin cooking up some ideas for Siegfried
91	1258971097451696132	Trump has blood on his hands over coronavirus says Nobel prize winning economist politicsNews
92	1258971099704025093	COVID 19 may infect 44m Africans WHO
93	1258971099980804101	I think everyone needs not to be in a hurry Souza tests positive for virus out of UFC 249
94	1258971101264113665	Armed activists escort black lawmaker to Michigan s Capitol after coronavirus protest attended by white supremacist
95	1258971102065258497	When is it going to end Is there an end insight
96	1258971102325493761	Is it essential to come from Northumberland for a walk camp at Thirlmere No Instructed to return home COVID19
97	1258971103818637312	lnrdtrza When they drop a joint album like Kehlani was supposed to with that Kamolerat rapp
98	1258971104829267968	Afghan Farmers Coronavirus Means No Choice but to Grow Opium via
99	1258971105110286341	White House Rejects C D C s Coronavirus Reopening Plan
100	1258971105236332544	There s a UFC card tomorrow
101	1258971105760509952	This is going to go away without a vaccine President Donald Trump
102	1258971105865412609	Coronavirus is real coro is deadly
103	1258971106641412096	evans If they cancel the flight or
104	1258971106964377600	Coronavirus in Dharavi When a virus finds space in India s largest slum
105	1258971110101696512	New post Numerous Kane and Kendall nursing homes that failed to follow infection control rules now have COVID 19 c
106	1258971110944595969	China Talk The US keeps calling for transparency amp investigation Why not open up Fort Detrick amp other bio la
107	1258971111078785026	I thought a lion ate him years ago omg
108	1258971111276130305	Donald Trump says coronavirus will go away without a vaccine via
109	1258971114262261761	The dead numbered 207 suggesting a per capita mortality rate lower than that of any other European country and far
110	1258971115554308096	Crazy
111	1258971119341703169	Coronavirus Opticians advise screen breaks for children in lockdown NEWPAPER24
112	1258971119786352640	How coronavirus will change Paris forever
113	1258971120222511105	AmbVarricchio conversation w GEI relationship is essential to recover from the crisis caus
114	1258971120528756736	Wait What I wonder Will other Counties States follow Will US media cover Cook County to Review Deaths Dat
115	1258971121178644480	Tiger King Roy Horn of Siegfried amp Roy dies from COVID 19 complications publicist says
116	1258971121254191104	Unprecedented crisis deserves unprecedented action not half measures amp exclusion People struggling with healthcar
117	1258971121312911360	Now 1 Editor for Masala ITP Media Group Lekha Menon wishes HM Amit Shah dies of COVID 19 or cancer 2 Bureau
118	1258971121820598273	Take your VitaminD Study shows it may help against COVID19 coronavirus
119	1258971121837203457	White House staff test positive for COVID 19
120	1258971121879310337	California Gov Gavin Newsom on Friday made California the first state to call an all mail
121	1258971125134036993	Three Democratic senators have proposed a bill that would pay most Americans each month until the coronavirus econ
122	1258971125398138882	Government dumps thousands of official Covid 19 papers
123	1258971126245609474	If that s the case there won t be a need to arrest people who break the Covid 19 regulations mos
124	1258971127390572544	She also got a podcast y all thanks doc
125	1258971128787136513	Better to err on the side of caution Mathematician refutes DOH claim of flattening coronavirus curve
126	1258971129084915712	CORONA AWARENESS SONG BY A 100 LOCK DOWN FAMILY by GC Folk Gcfolk Covid 19 COVID19 Trending
127	1258971130301493248	Jesus
128	1258971130624434176	15599 tests in the last 24 hours Tanzania around 600 tests only to date you re a joke It doesn t mat
129	1258971132855648256	Door to door tests help track COVID 19 s spread in one Oregon town
130	1258971132893560833	I hope Pence catches it from her if for no other reason than the thought of him explaining to Mother why he was s
131	1258971133128306690	Thank you too How is COVID 19 in your country My town is still being declared an emergency and w
132	1258971133170405376	The former NYC was a great place After BloomTurd amp the current communist mayor it is now a sh Don t get
133	1258971134432813060	Workers feared exposure to coronavirus in treatment facility for teens
134	1258971134604660736	Covid19 looks a little different when it s on your doorstep
135	1258971135175266305	Government says it will keep all options under review amid rumours about NHS coronavirus app
136	1258971135682592769	Thanks for stressing Mentalhealth during COVID19 Mental health is health
137	1258971135737241600	Ex San Francisco supervisor rips immoral handouts of drugs to homeless Should be feeding their stomachs
138	1258971139352653824	Ivanka Trump s personal assistant has tested positive for coronavirus source tells CNN SmartNews
139	1258971139671539714	Publicist Roy Horn of Siegfried
140	1258971140858368001	A cure for Covid 19 is available and we need to get back to work befo
141	1258971140904513536	In 26th March you said We had to act one or two month ago but couldn t do But now you say From the
142	1258971141215059971	People are speaking out in support of Costco after customers threatened to boycott the warehouse chain for requirin
143	1258971141282111488	Some Nigerians are angry that people predicted high African death caused by COVID 19 without knowing t
144	1258971141332439041	Well well well isn t this interesting
145	1258971141512687616	One rule for pollies and paedopfile supporters another for the plebs
146	1258971142980689920	The procedure to bring back Indians stranded abroad because of the Coronavirus pandemic has been initiated meti
147	1258971143450570753	House Democrats ask 5 companies to return coronavirus aid
148	1258971145363230721	US falls short in coronavirus testing in some areas of the country LatestComments
149	1258971145707106304	Who do you think
150	1258971146197667840	Now for sure it s 1984
151	1258971148341047296	Jacare Souza has been tested positive for Corona Virus This is really sad news Hope for a speedy recovery
152	1258971148752224256	Germany s confirmed coronavirus cases rise by 1 251 to 168 551 RKI
153	1258971149037428737	Don t waste your time on Twitter then you should be a reproduction machine
154	1258971149322485761	Our understanding of this virus is changing
155	1258971149595103233	Flat out Launched my Coping in Lockdown survey in USA Would love your help to encourage ppl who smoke
156	1258971151222616064	COVID 19 Impact and Recovery Analysis E textile Market 2020 2024 High Demand for Health Monitoring Wearables
157	1258971152220925952	I believe gave a generous grade Abject failure F minus
158	1258971185309724673	Dear Endeavor WTF are you doing having an event during a raging pandemic get a fuckin clue thx in advance
159	1258971186056200192	Forget the experts a convicted felon who stole over 6M from his shareholders and is banned from entering the UK h
160	1258971186115022848	defender If you consider America being second to china in COVID 19 cases as keeping America gre
161	1258971187037773824	What was his comorbidity His age group is at high risk just in general He was attacked by his tiger bck in 2
162	1258971187041820675	dADDY WITH THE little d said it is a Hoax so ALL OF U S are safe now go play like a good little girl
163	1258971189566828544	But Pete Davidson has already led me to believe otherwise right
164	1258971190019883010	COVID 19 and Vitamin D Important via
165	1258971191475404801	A Drug Cocktail Hastens Recovery in Some Coronavirus Patients
166	1258971191601176577	No comparison group and no definitive link to severity of Covid 19
167	1258971192251351046	Parents should also seek care immediately if their child has difficulty breathing or getting out of bed is confus
168	1258971192284725248	The total number of confirmed COVID19 cases in India rose to nearly 60 000
169	1258971192289099781	Exclusive Toomey Calls for Reopening America Faster Virus Danger to Most Overstated
170	1258971193140527105	The Gateses are in it to prove that the affordable already available treatment is dangerous so they can push vac
171	1258971197179650048	Dana White Says President Trump Watching UFC 249 As Blueprint For Opening Up U S
172	1258971197317906435	R I P Roy
173	1258971198010122240	There are days when I feel like our country is a real life episode of Scandal coronavirus COVID19
174	1258971199167582208	Magician Roy Horn of Siegfried amp Roy dead at 75 from COVID 19 complications News
175	1258971199692066818	COVID19 has officially invaded the White House
176	1258971199855562752	How many nursing homes have COVID 19 problems Don t ask the government coronavirus CoronaOutbreak Wuhan
177	1258971199909949440	Misery compounding every day Where is conscience They weren t killed by Covid 19 but by state apathy and misman
178	1258971200920920071	Chhattisgarh Chief Minister Bhupesh Baghel wrote to Prime Minister Narendra Modi demanding Rs 30 000 crore package
179	1258971202716123136	The actual unemployment rate for last month is buried where no one would likely ever find it
180	1258971203311632384	There have been 1 414 confirmed cases of COVID19 in Indonesia up to this moment of which 122 people died 0 toda
181	1258971203924103169	Saturday s front page will lay off most of its workers coronavirus
182	1258971203999608833	The paid leave program passed by Congress in March was supposed to help workers cope with the fallout of the corona
183	1258971204012183552	ICYMI The world feels too much like Black Mirror so season 6 is on hold
184	1258971204016373762	Good morning lovely friends Wishing you a lovely day
185	1258971204192370688	President Donald Trump s intensifying showdown with China over its handling of the coronavirus pandemic is expandin
186	1258971204473499648	COVID19 India Number of Samples Tested in May 1 May 72 453 2 May 73 709 3 May 70 087 4 May 59 783 5 May 84 71
187	1258971204821626880	COVID 19 and the Vital Role of Organization Development Very good article
188	1258971205589258243	Joe Biden coronavirus an opportunity to transform the economy with socialist Green New Deal
189	1258971205861732352	Hydroxychloroquine is proven to treat coronavirus so why all the resistance No money to be made for the pharmaceu
190	1258971205878427649	What is worse than COVID19 It is the spreading of hatred and division among the populace It affects not only our
191	1258971209489940480	Coronavirus outbreak COVID 19 causes historic job losses in Canada U S Global News
192	1258971210030837762	Remission Do people with Covid 19 go into remission
193	1258971210798555142	Test positive for COVID 19 in Tennessee Law enforcement and first responders know your name and where you live
194	1258971211368927232	Latest worldwide COVID 19 data 4 013 896 cases 276 235 deaths A 6 88 fatality rate
195	1258971212081967107	Coronavirus Outbreak LIVE Updates Karnataka permits liquor sale bars and hotels can sell stock at MRP till 17 May
196	1258971212908081162	There are 2 special issues of mycology journals focused on Covid19 associated fungal infections MDPI guest e
197	1258971214166593536	Join Quarantini as dive into just how scary our reality is Ordering groceries YEP It s horrifying
198	1258971214195892227	Join Quarantini as dive into just how scary our reality is Ordering groceries YEP It s horrifying
199	1258971214434856960	It s like hiding from cancer we re all going to die If the Corona Virus is going to get
200	1258971214741229575	Covid 19 Velocity Update May 8
201	1258971215496204289	Slack owns the verb to slack someone whereas this will not be the case for Microsoft Teams To own the verb is to
202	1258971216301289473	La Scala opera house in Milan opens virtual tour during coronavirus lockdown
203	1258971216796237825	Ronaldo Jacare Souza pulled from UFC 249 fight card after testing positive for coronavirus
204	1258971218071470080	NEW Trump Admin Awarding Covid 19 Contracts to Friends amp Donors LINK SmartDissent
205	1258971218318745600	Moderna Gets OK to Start Larger Trial for a Coronavirus Vaccine
206	1258971218646110208	Shore Breeze Farms had just started a new hydroponic lettuce venture when the COVID 19 pandemic hit and suddenly
207	1258971219522551809	Season shouldn t resume says ex NHL player who had COVID 19
208	1258971220504174593	Tell thy spouse that Season 2 is postponed by COVID19 Using only the ancient texts of the author
209	1258971220537757696	On Feb 29 Dr Fauci told us Right now there is no need to change anything you re doing on a day by day basis Bu
210	1258971222576168960	Local Government Laws Updated to Deal with COVID 19 and States of Emergency JD Supra
211	1258971222718607361	COVID 19 outbreak linked to Canada Post main plant in Calgary health officials say CBC News
212	1258971223532335104	Ministry of Health amp Family Welfare MoHFW issues revised discharge policy for COVID19 patients
213	1258971223884730370	Great to see the promising results from this funded project for a bedside diagnostic tool in rapid re
214	1258971224438386688	Couple married for 43 years beats coronavirus together
215	1258971225277128708	Indonesia Corona virus Cases 13 112 Deaths 943 Recovered 2 494 covid19 covid19update corona
216	1258971226820751361	This movie Cabin Fever movie reminds me of this Coronavirus Crazy shit
217	1258971227416387591	Covid 19 frontline workers worthy of praise salute says PM Modi via NaMo App
218	1258971227525390336	Couple married for 43 years beats coronavirus together
219	1258971227600887808	Cuomo warns of different chapter as 5 year old dies from COVID related complications
220	1258971228259352576	Just like the media lied here too
221	1258971228640915456	HPE Deploys Four Cloud Enabled COVID 19 Test Labs And OPD Centers In India
222	1258971229257687040	Watched Carryminati s latest cringy YouTube video and now I m tested positive for both COVID 19 and Cancer
223	1258971230129930241	A slickly produced 26 minute video called Plandemic has exploded on social media in recent days claiming to prese
224	1258971231790997504	For those who live by the motto that a bad day fishing is better than a good day at work the first six weeks of th
225	1258971231916896262	TrueBloodPump Covid 19 Grand Salute to the warriors who help the Punjab Government by providing the blood during l
226	1258971232428425217	Mexican clowns give their best face by raising awareness about a pandemic in the subway Europe Market News How
227	1258971235112771584	Russia Brazil struggle with coronavirus response
228	1258971235800813569	50 something thousand
229	1258971235905679365	What comfort food Gabrielle Union eats amid Covid 19 pandemic
230	1258971235939041280	Kim Jong un sends Putin letter in outreach amid coronavirus crisis
231	1258971236295749632	there are too many curves to flatten covid 19 curve unemployment curve beer belly curve
232	1258971238250184704	It s midnight Go to bed You cannot solve the world s problems or yours if you aren t properly rested sleep COVID19 coronavirus
233	1258971239034609664	Roy Horn of Siegfried and Roy Dead at 75 After Catching COVID 19
234	1258971239562919936	And her sidekick said this week that COVID 19 was being led by
235	1258971240473202688	And we have another one Please tell me someone close to AG Barr is next
236	1258971241098207232	Coronavirus found in semen of COVID 19 survivors sexual transmission unclear CBS News
237	1258971241311920128	Is this Vaccine part2 of the Coronavirus hoax that took so many innocent lives COVID 19 vaccine test on animals
238	1258971244088586240	Coronavirus Legislation In US Congress Over Green Cards To Foreign Doctors Nurses
239	1258971244109664256	A spike in reported cases of a rare illness in children has health officials investigating coronavirus links
240	1258971245007138819	I said it before I ll say it again Dana White has actual fans and it never ceases to blow my mind
241	1258971246525587456	Australia s biggest states hold off relaxing COVID 19 lockdowns Source Reuters
242	1258971248220086272	Who you crappin Put on some Score Classics showcasing Boers and Berstein
243	1258971248924778498	stay safe you have to deal with those nasty things and have to watch out for the virus
244	1258971249042239489	if it were almost anyone else this would be horrific but it is genuinely hilarious
245	1258971249205788673	like hell The State has NO authority to remove people from their homes NONE not against their will
246	1258971249381765121	Pelosi to lay down multitrillion dollar marker with new coronavirus package
247	1258971250019401728	The land of small government and local control being the order of the day
248	1258971250774474752	Behold the real game changers are here hopefully Inna nasrullah qareeb
