	tweet_id	tweet_text
0	1262232269885829121	how about a new idea democratic alliance All medical and defense products must be produced in a democratic societ
1	1262232270074638336	This clearly means that will have to provide proper care to Migrant coming back to villages proper Quarantine m
2	1262232271278477313	Thank you for writing As a precaution against spread of coronavirus our Voice support is current
3	1262232271559561218	Let s bury this treasure of a POS
4	1262232271752269825	Inadvertently
5	1262232271932715008	indonesia are fighting 2 pandemics COVID 19 amp STUPIDITY TerserahIndonesia
6	1262232272511668224	That evil Nazi skank needs deporting Go fuck up hee own country
7	1262232272922533889	yes he does he has died of coronavirus
8	1262232273686007808	like i m not gonna say if this true or not but I m A Jaehyun hangs out with people B the armchairs will be hav
9	1262232273992273920	Coronavirus UK London records just 24 new cases a day
10	1262232274302636035	I don t trust Carol Fucking Baskin I definitely don t trust her Corona Mask
11	1262232274860306432	Hair Oiling Benefits Applying oil to the hair has amazing benefits but first learn how to apply it Visit
12	1262232274910806016	New York Extends Stay At Home Order Allows Some Areas To Begin Reopening MEGA D
13	1262232275590225921	IL Gov Pritzker making off COVID19 and LOCKDOWN IL Chicago ILLINOIS COVID19
14	1262232277964095490	The Centre for Disease Control in the United States knows that wearing a mask can be a useful tool in helping to ma
15	1262232277972647937	With Crispr a Possible Quick Test for the Coronavirus UI via
16	1262232280044466176	Yes I am with you there I m very frustrated with our BC government and how slow they are in opening up this healt
17	1262232280535379969	Madagascar records first COVID 19 death Official
18	1262232280539463680	I wonder what the ratio is in New York
19	1262232281328033793	The easiest comparison I can make is a working class family that lives paycheck to paycheck JCP was do
20	1262232282145882117	shk MLA
21	1262232282170941446	Sad part is that World health organization failed to notice it
22	1262232282531655681	Many are not looking forward to this guy s patented CoronaVirus Vaccine find out why natu
23	1262232283643285505	COVID 19 fight Bayport donates PPE worth GHC100k to hospitals
24	1262232285392154624	Are you sure about that John Cena
25	1262232286067597312	Ask Dr Fauci he knows The US was doing risky research on Coronavirus at For
26	1262232286172454915	Indonesia Flogging Of Unmarried Couples Tipplers For Islamic Law Violation Continues Despite Covid 19 Swarajya
27	1262232286608658437	Do you believe a Chicago restaurant surtax for COVID19 Hoping J ag B ag Governor Lightfoot and Preckwinkle don
28	1262232287254474752	What does this mean You are ok with contacting covid 19 You don t believe covid 19 is
29	1262232287468572672	COVID 19 fight Bayport donates PPE worth GHC100k to hospitals
30	1262232287581700097	I think this would interest you mondaythoughts ChinaIsNotOurProblem
31	1262232290580738049	So yes I do blame the Chinese for coronavirus pandemic Peter Navarro ABC News ABC News via
32	1262232291733958656	THATS BECAUSE WE DONT HAVE ADEQUATE TESTING CAPABILITIES YOU F MORON impotus impotent FailureInChief
33	1262232293231468545	Timeline of WHO s role in the coronavirus pandemic
34	1262232293365743616	People like her don t know real hardship
35	1262232293860691968	Ex Mets manager Art Howe released from hospital amid coronavirus battle
36	1262232295282487296	B R E A K I N G N E W S TOTAL COVID19 DEATHS CROSS 3000 MARK GOD SAVE MY NATION
37	1262232297987641345	Maxine Waters Sister Who Died Of Coronavirus Was Not Tested Before Surgery via
38	1262232299283738627	How many of you recollect skypeforbusiness almost 2 to 3 years back never heard of zoom But now is now
39	1262232299975868417	Either Pence has the coronavirus or he s a carrier of the virus At least Pence h
40	1262232300772827141	China I would rather say Smart Entrepreneurs won t jus giveup but also mot
41	1262232300823216129	Barr tells prosecutors to look for coronavirus orders that violate Constitution via qanon
42	1262232300969959427	Last I heard he wants to stop the Covid 19 outbreak
43	1262232301204762625	With emphasis on the word CORRECTLY Cutting a hole in it to sip drinks ain t it and stupid AF COVID19
44	1262232303960567809	And that s exactly why the numbers continuing to go up
45	1262232304950206464	Like the bogus report that Pentagon has been busted for Coalition of 62 countries backs Scott Morrison s call for
46	1262232305445351428	I still have random moments of disbelief about this whole COVID19 crisis like dang we really going through this
47	1262232305583763462	Do you have anything nice to say to College Grads and High School Grads like Obamagate had Who missed a on
48	1262232305696862208	Coronavirus Cases 4 804 294 Deaths 316 703 Recovered 1 858 754
49	1262232306636320774	Trump s Vaccine Czar Holds Millions in Stock Options at Company That Got Federal Funding for COVID 19 Work
50	1262232306770604033	COVID 19 Study Shows American Men Don t Wear Face Masks Men Think Masks Show Weakness
51	1262232307466936320	President Trump called Barack Obama a grossly incompetent president after Obama criticized U S officials handli
52	1262232309471772672	Corona is pushing the US back into the Jahilliyyah period
53	1262232310851780608	Coronavirus They grabbed my breasts and said You re not a woman
54	1262232311338110976	thinking
55	1262232311665434624	East Lyme Ct local wild bird food store has curbside service during COVID 19 crisis FYI
56	1262232311728189447	Concern about Covid 19 patient flying back to HK
57	1262232314110754822	Aatm Nirbhar Bharat Be Vocal about Local newachivement mediacoverage newgoal indiaTV sure safety india
58	1262232314165129216	Do your research before making claims Note that the article is da
59	1262232315758931968	Top 10 countries affected by Covid 19 top10 covid19 coronavirus coronaupdates
60	1262232317621223424	Shelley Lewis shame on you Where the hell have you been for the past 3 months Why would you ever ask a man who s
61	1262232318451896323	Going to Palm Beach Nope
62	1262232318506422272	We will won from Covid 19
63	1262232319479316481	LIVE The number of coronavirus cases in India rose to 96 169 according to the Health Ministry There are now 53
64	1262232321282969600	If 80 of Americans Wore Masks COVID 19 Infections Would Plummet New Study Says Vanity Fair
65	1262232321396260870	What happened to We re all in this together What was the point of the tribute shows Where s the sacrifice that
66	1262232323044503554	That woman wants to manipulate the coronavirus death count for political purposes What you call masterful politi
67	1262232323077992449	labourtaxtaxtax abusing parliament again
68	1262232323237478400	The Real Cost Of Coronavirus And Forever Lockdown Leftists Who Want A Life Without Risk
69	1262232324730691584	This feels great
70	1262232324822966272	Tanzania Africa Coronavirus News Health Official Fired Bloomberg
71	1262232324982345730	diddier For those worshipping NEJM Endorsed by Fauci one worlwi
72	1262232325833674758	BS from a dunce who said coronavirus will go away without a vaccine Every Vaccine and Treatment in Development f
73	1262232326160998401	Will you need a coronavirus test to fly Everything we know right now
74	1262232327842922497	Okay We can officially say that our lockdown efforts have been a bloody disaster Lockdown4
75	1262232328429957121	Trump s SCAPEGOATING IGNORING DOWNPLAYING LYING ABOUT COVID 19 THREAT DESTROYED OUR COUNTRY Tru
76	1262232328635588609	Statewide death toll from coronavirus climbs to 1 005 KOMO News
77	1262232329373782016	Straight Up Fire in His Veins Teen Battles New Coronavirus Syndrome The New York Times
78	1262232329822576645	Register to vote in Texas online
79	1262232330183176193	Random tip if you have a hand sewn mask of any kind it offers you ZERO protection from Covid 19
80	1262232330757947392	The oposite now is the similar Trump bleach and pay every american 1k m to keep calm he
81	1262232330845982721	We have been fighting pandemics since before time This is a divided America
82	1262232331437453312	Statewide death toll from coronavirus climbs to 1 005 KOMO News
83	1262232331697389570	Mysterious Illness Linked to COVID 19 in Children Confirmed in Eastern Iowa WHO TV Des Moines
84	1262232332121055232	Straight Up Fire in His Veins Teen Battles New Coronavirus Syndrome The New York Times
85	1262232332339236864	This is awesome How exactly does one go to the bathroom Infectioncontrol covid19
86	1262232332351594497	Its becoz of this And this is becoz of ummmm we all know
87	1262232333291315200	This video has a lot to unpack First Karen must need tampons and she ain t letting no one else shop for that shit
88	1262232333974814721	China s levels of some air pollutants have risen back to above last year s levels after dropping during the corona
89	1262232333983219714	3 important reminders to help keep COVID 19 from spreading during Alert Level 2 Keep a 2 metre distance from peop
90	1262232334444769281	Mysterious Illness Linked to COVID 19 in Children Confirmed in Eastern Iowa WHO TV Des Moines
91	1262232336537698306	Yes no updates on Saturday amp Sunday only the laboratory update was on Saturday
92	1262232337494028288	ComeAndListen to the and help musicians during the COVID19 QuarantineLife BuyIndie
93	1262232337527554049	Great news Thank you Australia for getting the ball rolling
94	1262232337615597569	Apparently this Karen in the wild is also a flat earther Which is absolutely the icing on the cake
95	1262232338831937538	Mortality rates for select countries as of 5 17 DataViz DataAnalytics Covid19 Covid 19 Covid 19
96	1262232339972681728	Not surprised
97	1262232342002720768	BS from a dunce who said coronavirus will go away without a vaccine Every Vaccine and Treatment in Develo
98	1262232343290564610	Interesting read on acceptance of new realities campus changes and increasing self sufficiency in students
99	1262232345819652096	Nigeria Reports Highest Covid 19 New Cases In A Day FlashInfoNg Dibango E
100	1262232345924505601	COVID19 COVID 19 FirstResponders NursesDay2020 anyone know what hospital is goes on at i m shocked
101	1262232346540953602	We did see low transmission we didn t see no transmission I think children can sti
102	1262232348298371073	India s unemployment rate may rise to 35 due to Coronavirus leading data firm
103	1262232349317771268	WHAT IN THE FUCK IS WRONG WITH THIS GOVERNMENT
104	1262232350659940355	tik toc dances caused the coronavirus more at 1
105	1262232350970114054	Perplexing that the coronavirus hoax to stop Trump rallies also exists in other countries
106	1262232351905587201	Ya Allah please forgive us in this Lagos especially We will not do it again kini por ju por lo
107	1262232352270491648	Timeline of WHO s role in the coronavirus pandemic
108	1262232352320655367	China officials ordered coronavirus cover up report says
109	1262232352354271233	Is it new crisis post covid 19 or is it the old one that started in 2014 Pls clarify You spot so
110	1262232352526405634	Enough Twitter for today gonna do History of Art homework v HistoryOfArt Homework COVID19 FinalExams SeasonEnding
111	1262232354946338817	Albanese has to go He has been MIA all through this crisis amp now this Bring back Shorten Coronavirus live update A
112	1262232355332337665	Shut Down Pornhub and Hold Its Executives Accountable for Aiding Trafficking Sign the Petition
113	1262232355659489280	YOU ARE WATCHING A MOVIE 17 years ago Dead Zone 2003 Episode Plague Predicts Coronavirus Outbreak and Chlo
114	1262232356691181568	designed CERB to prevent the privileged amp able bodied from TEMPORARILY experiencing the poverty Ca
115	1262232357534302208	Like that s possible
116	1262232358171734016	The Trumpian Skool of Lojik states without Coronavirus Testing the US Would Have Very Few Cases Covid 19
117	1262232359916539905	I m always surprised that the most popular conspiracy theories have pretty racist consequences Like why can t the
118	1262232361963487232	He s like the son I might have known If God had granted me a son The summers die one by one How soon they fly on
119	1262232362169118721	Would ya look at that
120	1262232362852790274	Madagascar sees a huge spike in Deaths Per Capita compared to yesterday Madagascar just jumped 16 places to 158 i
121	1262232363112656900	Almost like Oops My bad SMH seriously
122	1262232364094238721	Man this funny
123	1262232364371107845	Medical Journal Urges American Voters to Not Re Elect Trump Slams Him for Coronavirus Response
124	1262232364941488129	COVID 19 More than 60 nations back Australia s call for an independent inquiry into the virus origins Coronavirus
125	1262232365109305346	By the way I got bored and just wanted to point out that this claim is com
126	1262232365730082817	How is it that the US with less than 4 of the world population and with the most advanced medical
127	1262232366476677120	Ep 094 has us talking Clay Travis and the coronavirus COVID19 PodernFamily podcasts SundayFunday Click the l
128	1262232366782824449	Trump accuses Obama of being grossly incompetent after his coronavirus criticism via PdP
129	1262232367847993345	Trump s SCAPEGOATING IGNORING DOWNPLAYING LYING ABOUT COVID 19 THREAT DESTROYED OUR COUNTRY Trump MANIPULATES Pe
130	1262232368451973121	UPDATE Brazil tops 240 000 confirmed Covid 19 cases Coronavirus Source The Brazilian Report
131	1262232369718845440	Lifting lock down requirements is all about money He and others are saying the virus will magically disappear afte
132	1262232370327040002	Narrator you re doing terrible
133	1262232370490552320	my demography professor is so hot and i hate that i can t be at the same room with him because coronavirus
134	1262232370834538496	Entitled white bitch came to pick a fight shes testing her privilege
135	1262232370897391616	The novel coronavirus can infect organs throughout the body including lungs throat heart liver brain kidneys
136	1262232371379798016	Heh Tell granny to stay home then Because I ain t changing my life for her
137	1262232371857952768	Fuck that Open up Wyoming Wearing a mask on a continuous basis is harmful to the respiratory system I should kn
138	1262232372466126848	CORONAVIRUS How Costa Rica is Successfully Fighting COVID 19 via
139	1262232373271293956	Rowan Dean is a threat to public health and should be removed from his role as a disseminator of misinformation
140	1262232375058214913	Social distancing Proper Hygiene protocol Complete isolation of prisoners All these safety measures to prevent
141	1262232376748519425	Amazing management of the COVID19India crisis
142	1262232376802832384	Some parents dream of watching their children walk the stage and receive that diploma COVID 19 says otherwise b
143	1262232376828063746	Coronavirus cuts transportation funding puts major road and bridge projects on hold via
144	1262232376912097280	ACTUALIZACI N GLOBAL Top 5 1 527 664 281 752 277 719 243 695 241 080 COVID19 COVID 19
145	1262232377071292418	Coalition of the Willing
146	1262232377079640065	Disgraceful biassed reporting
147	1262232377847242752	I pray there is no sharp increase in the next few days as this is not caused by easing ECQ The easing result will
148	1262232378191147008	People living in the Local Government Areas LGA of The Hills and Penrith are urged to come forward for COVID19 t
149	1262232380510744576	Covid 19 Keep the dangerous pubs and bars shut say the majority of Thais in poll
150	1262232381022298113	At the beginning of the pandemic it was thought that children are not getting infec
151	1262232381811015685	The Bronx has seen more than 10 000 hospitalizations due to COVID19 compared to only about 6 000 in Manhattan
152	1262232383442448384	Of us in Deprived UK areas four occasions likelier to accumulate COVID 19 Check it out
153	1262232383442481152	I just read the latest issue of The NY Times I was impressed by the clarity of the informative h
154	1262232384256249856	carbon Why do you think violence against Black people is going to increase during this coronavirus pandemic
155	1262232384671371264	Job agents tell of pressure to turn heat up on JobSeeker clients
156	1262232387213197312	Note It Down coronavirus CoronaInPakistan
157	1262232387423023104	wait jaehyun actually go outside
158	1262232388060545030	And while we re at it TAKE OFF THAT UNIVERSITY of NORTH CAROLINA Mask YOU are Not an alumni and
159	1262232388119277568	Colorado s coronavirus cases near 22 000 as hospitalizations reach lowest point since late March The Denver Post
160	1262232388341428227	Coronavirus Feeling overwhelmed by the pandemic Here s what you can do via
161	1262232388500893696	17 years ago Dead Zone 2003 Episode Plague Predicts Coronavirus Outbreak and Chloroquine Cure
162	1262232390853971969	Colorado s coronavirus cases near 22 000 as hospitalizations reach lowest point since late March The Denver Post
163	1262232391235624963	What We Know About Your Chances of Catching the Virus Outdoors
164	1262232391743135744	Taiwan Likely To Remain Off WHO s Invite List Despite COVID 19 Successes
165	1262232392594599939	LAST week Chief Minister Sindh Murad Ali Shah announced the launch of a mental health helpline in the province in
166	1262232394955927554	Sanders Bill Would Expand Medicare During Covid 19 Crisis Instead of of Costlier Plan to Prop Up Private Insurers
167	1262232395303972867	America mostly moved on Only M GA and Bern e tw
168	1262232396218466304	We have high chronic disease rates People taking medicines that make us succumb more quickly to coronavirus Accor
169	1262232398885879812	Areas hardest hit with coronavirus have much higher rate
170	1262232399905161216	Coronavirus is also known as Chicken Pox Herpes Consumption Spontaneous Human Combustion Mononucle
171	1262232400467124227	Under the cover of darkness Pataal Lok Bengal Whistleblowers allege massive Covid 19 cover up in Bengal
172	1262232400689422336	In light of this we need to change the moniker for entitled narcissists from Karen to Shelly
173	1262232403290005505	BBC News Coronavirus Belgian hospital staff turn backs on PM Sophie Wilm s coronavirus
174	1262232403658997760	RACE AROUND THE WORLD As of yesterday day 13 PLCSydney students staff amp parents had walked 7026 km 1 Each ti
175	1262232403927371776	COVID 19 in France has changed the way people use public transport due to the need for distancing More people ha
176	1262232403990331395	The pollies are promising high speed rail again and Joe is excited
177	1262232404539904006	The picture showing a migrant worker sitting on the roadside and crying on his phone Identified as Bihar s Ram Puk
178	1262232404707569664	Care My flight is scheduled to departure from Bangalore but due to COVID 19 th
179	1262232404741296128	While pretending to suck his pacifier
180	1262232405718548484	Honestly Resign So corrupted the IG we all heard your Wuhan lab story your wife being given gover
181	1262232405764694021	I m actually shocked Halbritter hasn t re opened Turning Stone
182	1262232405819240449	Thanks for telling your story COVID19 HealthcareHeroes
183	1262232406020354049	KN95 with Respirator Wholesale Facemasks Protection CoronaVirus CDC News Wholesale Sale Facemask Covid19
184	1262232406033076224	Probably a COVID19 rash
185	1262232407622610944	Thank Mister Bloomberg I believe in you and I know you will make a great President in the future Please help u
186	1262232407823900673	Trump is mentally unstable so thank goodness only 6 more months of hell to go when Biden wins in Nov
187	1262232407857664001	Thousands of pubs and restaurants may NEVER reopen after the coronavirus pandemic as beloved
188	1262232409254309889	WarNews News Conflict Sailors Aboard The Aircraft Carrier USS Theodore Roosevelt Have Tested Positive For Corona
189	1262232409262690304	WarNews News Conflict President Trump Fires Back At Former President Obama Over Coronavirus Criticism
190	1262232409501839362	Straight Up Fire in His Veins Teen Battles New Coronavirus Syndrome
191	1262232411464744962	listen you douche
192	1262232412098043916	First read this
193	1262232412274094081	There is not enough safety in prisons to give protection to prisoners from the coronavirus so it s requested to au
194	1262232412890607616	and her reasoning makes no sense private things I want to get the cashier sees them and self checkout isn t so
195	1262232412924379137	Then read this
196	1262232414992162817	Not them
197	1262232415189245952	The misleading graph is just one of Georgia s data failures as it reopens businesses during its coronavirus outb
198	1262232417814757378	Things you need to know about COVID19 What is it It s a virus What is it not It is not a reason to hate attac
199	1262232418884489218	lola Wish we lived there My lovely mum was just killed
200	1262232419031105536	Abusers using Covid 19 as excuse to further torment domestic violence victims readOnTNP via
201	1262232419320516610	Shameful not cool a sign of weakness Men are less likely to wear face masks to protect against coronavirus
202	1262232419492651009	One of the hardest things about COVID19 is dealing with stress resulting from all the ambiguity and uncertainty A
203	1262232419769282560	sir kindly help I have loaded my parcel on
204	1262232421463777281	America nations wake up before getting too late Coronavirus is only one of Chinese chaos around our worl China is
205	1262232422051131392	Survey on Coping during Coronavirus School of Healthcare Sciences We would
206	1262232422491525120	Some day I ll go there It s beautiful what they re doing
207	1262232426001993729	GoI How can I complete my travel by Sept since COVID 19 situation in USA is so da
208	1262232429084979200	Where you need to focus is exposing Bill Gates Fauci WHO and all the media which have supported
209	1262232429634318336	PM s approach towards Covid19 economic policy is pushing India towards New Imperialismwill to Annihilation soppin
210	1262232432771649537	Keep America Great Navarro China Deliberately Allowed Coronavirus to Spread Outside
211	1262232433119973376	You would be forgiven for thinking that this image was from the JHU COVID 19 dashboard It is in fact FAO s locust
212	1262232433203671041	covid19 mixed feeling but the remix
213	1262232434289963008	Fiji s High Court overturns penalties for COVID19 offenders as cruel inhuman and contrary to the country s B
214	1262232434378072066	Hot guys gathering woohoo
215	1262232435066011650	Yes and it started with bio warfare of covid 19 and operation mockingbird with fictitious narratives and fake media
216	1262232435170910213	SARS experts reveal how the real origin of coronavirus can be traced
217	1262232435405750273	At this hour 9 pm PT CORONAVIRUS 309
218	1262232435984601090	Forty Years Later Lessons for the Pandemic From Mount St Helens
219	1262232437377175553	I got into N64 Goldeneye Speedrunning due to the Coronavirus I bought a console for it I now have a fun little pr
220	1262232438438154240	India covid19 Updates Maharashtra State Maharashtra Confirmed 33053 Cured 7688 Deaths 1198 updated on 2020 05 18 09 34 27
221	1262232440334020609	Draino People that are blaming Trump for this covid 19 mess really don t h
222	1262232441873285127	mondaythoughts As India witnessed highest 5242 single day spikes in Covid19 cases ModiGovt losen it s control
223	1262232442070609920	1021 Covid 19 cases in Aurangabad district Any bold steps to be taken
224	1262232442611605510	wants you to know they have launched a NYC COVID 19 Pet Hotline to provide NYC residents with emergency reso
225	1262232443102388224	NOTE For all services except for the ones on ZOOM you can dial 1 205 825 9984 to listen Please continue to
226	1262232443148476416	Anybody else concerned about this Asking for a friend
227	1262232443639132160	Coronavirus spreads quickly in closed spaces like cruise ships nursing homes and prisons Hence
228	1262232444327137280	Me at raves
229	1262232444423385089	Anti Asian racism has been emerging very subtly amp blatant My 4 yr old niece and my sister in law felt uncomfortab
230	1262232444998041601	Coalition of 116 countries back Australia s push for independent coronavirus inquiry via
231	1262232449360297984	i thought nicotine actually protects smokers from covid19
232	1262232449544859648	BEST employees go on strike in Mumbai after 8 staffers die of COVID 19
233	1262232449628676097	Now on Naija Reports Coronavirus Three Nigerians evacuated from Dubai test positive Official
234	1262232449787981824	Returning from Camp David with and a few of my colleagues The man never slows down or
235	1262232450278633472	Man I remember this day and it was prob way tougher than what they go through now lol Minus the quarantine stu
236	1262232450446524416	In contrast this man has moved heaven and earth to save every life possible and set us up for success going into th
237	1262232450719199232	Dr Jay Bhattacharya His new MLB COVID 19 Study and the Dilemma of the Lockdown
238	1262232451612471296	Leave it to a dumbass Karen to say Where does it say that and then she turns around and points the camera at the
239	1262232451876708352	this
240	1262232452640063488	Censor contain disarm when do I go to jail for Hate speech speaking out against the
241	1262232452832980992	The new chic COVID19 health tech
242	1262232453378453506	Thanks for your support during the COVID 19 scenario We regret to inform you that the resolution o
243	1262232457597857792	Trump on Covid 19 coffin meme via
244	1262232458558406656	COVID 19 in Alabama summary for May 17 Almost 4000 new cases within the last 14 days
245	1262232459137163267	Day 62 virtual graduation My daughter decided it was time to watch animals walking on stage or not I m
246	1262232459766202368	now is the time for malls to add toilets for women
247	1262232460026355725	Selling central planning and FDR s version of fascism
248	1262232462027042816	COPD and smoking associated with higher COVID 19 mortality COVID19SmokingCOPD
