	tweet_id	tweet_text
1441	1265433970780573697	Italian Government ends making autopsy on a Covid 19 deadbody which had directed not to do They did the Autop
1442	1265433972953276418	25 of Breitbart goobers believe that Bill Gates invented the coronavirus in a Chinese bio weapons lab and released
1443	1265433973062348802	Amen
1444	1265433974253518851	Let s all StandUptoSuperbugs The COVID 19 pandemic shows the need for public health preparedness I m calling on
1445	1265433974903619584	Desks 6 feet apart Elementary only Temperatures taken at the door Maryland schools plan for coronavirus continge
1446	1265433975595708425	It is a simple notion children should be fed no conditions no caveats
1447	1265433977118048257	2 30 p m tomorrow 5 27 Gov Jay Inslee will address media tomorrow via streaming video and telephone to give an
1448	1265433977428553735	The only way to solve the problem with our economy and this coronavirus is to give every
1449	1265433978238009345	The media has done many reports on long term care and nothing has been done If you don t visit your loved ones dai
1450	1265433978342801408	POOR RUMPY THE PANDEMIC WAS OUT TO GET HIM Trump on coronavirus This is so unfair to me Everything was going
1451	1265433978405892096	Washington news
1452	1265433978942615552	Fujifilm COVID 19 drug research spills into June dashing hopes of quick approval
1453	1265433979018194947	Hello you can read it here Covid 19 impacted the travel sector like nothing has in recen
1454	1265433979655684097	Facebook Fact Checkers Admit Trump Never Said Coronavirus Was a Hoax
1455	1265433980259766273	Coronavirus Short lived rebound in house hunter demand
1456	1265433980272283648	Coronavirus lockdown could deal fatal blow to HIV in the UK
1457	1265433980331003906	Kind of like Tom Hanx
1458	1265433981190836224	Why doesn t he just stop talking COVID19 Trump
1459	1265433982285385729	Kerala Karnataka Uttarakhand HimachalPradesh Chhattisgarh and Assam experiencing a deadly 2nd wave of the
1460	1265433982549635072	There s Utah right on the cusp utpol
1461	1265433982721650688	STOP with the Coronavirus mess People HAS to go back to work to live pay bills mortgage rent We starvin
1462	1265433984437112833	Coping with Coronavirus 22 Rainbow Roast Vegetables
1463	1265433986542624768	100 000 COVID19 DEATHS 1 U S Civil war 750 000 Deaths 2 1918 Flu Pandemic 675 000 Deaths 3 WWII 418 500 D
1464	1265433986546888704	National coronavirus updates US infection rate rising outside New York as states reopen
1465	1265433987436228608	That s what this is all about Revenge because of Brexit
1466	1265433987826278400	medical experts said that
1467	1265433989881516033	Blue states
1468	1265433989977784320	Coronavirus claims life of Sweden s leading terror recruiter via
1469	1265433990137331713	let s see what happens to the significant cuts proposed in the statewide tax credit relief program a
1470	1265433990678413314	May 27th 00 00am Coronavirus Worldwide A total of 2899963 active coronavirus cases 351627 deaths amp 2425759 r
1471	1265433992888713227	AmericaFirst MAGA
1472	1265433993698312192	Twitter labels Trump tweets as potentially misleading for the first time The Verge
1473	1265433994071597056	The government in MN responded to COVID 19 in an extreme way destroying the economy with many forc
1474	1265433995556290565	MyZA Here are SA s 12 coronavirus hotspots and they may move back to Level 5 Cape Town in the news Here ar
1475	1265433996420210688	Yo what happens when a tourist test positive upon landing Island of Madeira will pay for coronavi
1476	1265433996562853888	Kelly Dodd took to Instagram to clarify comments she made about the coronavirus pandemic again The RHOOC sta
1477	1265433997695311874	PAYCUTMPS Time for MPs LORDS Do right thing Min 20 PayCut RT c4news NHS bbcnews DailyMail
1478	1265433997884129282	Will SARSCOVID2 COVID19 cause workplaceprejudice
1479	1265433998450294784	Famed Chinese Bat Woman Claims Coronavirus Is Just the Tip of the Iceberg
1480	1265433999914213376	How do several local news stations air virtually identical Amazon COVID 19 segments TechCrunch See on What
1481	1265434004972601351	Hunger Program s Slow Start Leaves Millions of Children Waiting
1482	1265434005119340550	The government in MN responded to COVID 19 in an extreme way destroying the economy with many for
1483	1265434005358489600	Countering COVID 19 impacts on children from low income households covid19 kids childern
1484	1265434005404561408	art by EP10 recipe Mike Vegetable Shoyu Ramen from Gaku Ramen EP10 beneficiar
1485	1265434005735866370	Joe Biden Forgets the Word Coronavirus In Yet Another DISASTROUS Interview Freedom Journal
1486	1265434006696325120	Homelessness and Coronavirus in NYC Capitalism is Killing Us
1487	1265434007656783872	Americans Need To Ask Themselves What was Trump doing while experts and advisors were warning about the looming
1488	1265434008583901192	Save your breath team He s Canadian
1489	1265434008927850496	This too shall pass
1490	1265434009305137152	7 reopen everything Could he be gambling all lives hoping the survivors are disproportionately white If there s
1491	1265434009443561480	except it s not fake this time
1492	1265434009997369349	Countering COVID 19 impacts on children from low income households covid19 kids childern
1493	1265434011561799680	Thank you for planning a visit to Veiled by ChaCha We value our clients and want to maintain a safe environment
1494	1265434012178436096	It s happened again
1495	1265434013541466113	THE INTERNET OF MEDICAL THINGS The coronavirus is catalyzing a need for healthcare IoT in the US here s how con
1496	1265434014069993474	J K Rowling Begins Publishing The Ickabog for Children in Lockdown
1497	1265434014787276800	Christ how unlucky to get covid 19 amp get fucked by Miller
1498	1265434015554830336	Probably because he thinks everybody over 65
1499	1265434015756148738	Yet you re the only one bragging about it We lead the world in coronavirus deaths including cou
1500	1265434017488396295	Good commentary from various sources Instant Opinion Dominic Cummings contempt makes the public feel like fool
1501	1265434019589525505	CDN Why don t you try testing some of them afraid your
1502	1265434019862245376	30 yr old Qld man dies from Covid 19
1503	1265434021615599616	Keep Trump polling numbers going down Vote him out on Nov 3rd to prove these polling numbers or correct
1504	1265434021636407296	Coronavirus Tracking Bracelets Flooding Market Ready To Snitch on Peo via
1505	1265434021686849538	Active COVID 19 cases remain constant in Mississippi Reeves says May 26 8 04 PM ET
1506	1265434023142309888	Serum Institute of India right there at the top Jai Hind
1507	1265434023389728773	Goid job Brazil
1508	1265434023746134016	Let s pray
1509	1265434024014569472	Although the coronavirus recession shares traits with the 2008 financial crisis and other recessions the rate and
1510	1265434025226878980	Covid 19 has put entertainers out of work but it hasn t stop racism
1511	1265434026195779593	Washington news
1512	1265434026829062145	Read this Share this VoteBlue Trump Team Killed Rule Designed To Protect Health Workers From Pandemic Like COVID
1513	1265434028821360640	I mean
1514	1265434029802885120	Fact Check Trump s coronavirus response plagued with misstatements
1515	1265434030452822016	Chinese lawmakers propose foreign states immunities law to counter Covid 19 lawsuit in the US Hindustan Times
1516	1265434030981464071	The amount of lives lost during this pandemic tragically chilling
1517	1265434032189440000	Brazil reports 1 138 new cases and 37 new deaths bringing total confirmed cases there to 392 360 and 24 549 total d
1518	1265434032948547584	100 Voices Strong Osteopathic physician Dr Rashid Buttar hosts a doctor s Covid 19 roundtable 5 26 20
1519	1265434034697625600	House Republicans plan to sue Pelosi in bid to stop proxy voting amid coronavirus concerns NewsVerses
1520	1265434035007913990	this has killed me off
1521	1265434035322449921	Incidentally waded into the swampy mess of arguments over mail voting just the other day It s not gu
1522	1265434035376930816	All I ve been doing during the LALockdown is Eating Shopping Rehearsing amp Sleeping Covid19
1523	1265434038468296704	I wear a mask to respect the people around me I cough and sneeze from my allergies and I don t wa
1524	1265434038963224576	So excited to join the first class tonight 205 ppl on tonight 1st course of the week Field Organizing during Covid19
1525	1265434039042953217	Gee all these random pneumonia deaths
1526	1265434039240003585	Re Up Odisha s COVID19 Testing Strategy Broader amp Quarantine Norms Tougher Chief Secretary
1527	1265434039260864513	Local media in a southwestern city in Iran reported that 38 medical staff members were laid off after demanding thr
1528	1265434039437029376	Banks may not be profitable until 2025 even as major economies recover new IMF report says covid19
1529	1265434039529336832	Four ways to combat Malaria in the time of COVID 19 All Africa
1530	1265434040108277762	Extremely fishy
1531	1265434041970458624	There are 100K dead and rising from COVID19 and he s taking swims in the sewer There is no bottom
1532	1265434042004094976	If you take CiCis from me I will lose my shit
1533	1265434042335465472	10 womeninSTEM share how they are balancing life and work during covid19
1534	1265434042608111616	Latest coronavirus updates
1535	1265434042968784896	The COVID19 crisis is extracting a heavy social and economic toll on small tourism dependent economies As Fiji cr
1536	1265434045548302336	So Justice Department is partisan to allow crimes by government officials 2 go by the wayside If they did go after
1537	1265434045720276992	Twitter labels Trump tweets as potentially misleading for the first time informatique feedly
1538	1265434047377027080	must be sued by the families whose family members died
1539	1265434047410573312	Fuckin Morons led by the biggest idiotinthewhitehouse
1540	1265434048186515458	van hagarLIVES
1541	1265434049277034499	The current pandemic has been preparing schools for a future of distance learning one where climate change ramps u
1542	1265434049511714816	Trump You re guilty of CRIMES AGAINST HUMANITY It s estimated if you d acted just 1 week sooner
1543	1265434050505797633	Up Rev offers engineering services for innovative COVID 19 product solutions
1544	1265434053714620416	NowPlaying Mozzy Tunnel Vision Listen Here COVID19 STAY home as much as you can
1545	1265434055283052544	From Ride Sharing to Food Sharing Taxiville Stephenville s Taxi lends support to local food banks during the COVID
1546	1265434055413293056	Contact tracing is a key strategy to contain the coronavirus Some Ohio clergy and laity already have undergone tra
1547	1265434055618813953	Trump might finally be losing it The meltdowns are getting more severe Le
1548	1265434055685832704	coronavirus is invisible to the naked eye but as this photos of it shows the details of the covid 19 The
1549	1265434058097668106	This is like the second time they ve made this type of error LOL
1550	1265434058231820293	p Mass restarted here in Kentucky this past weekend with Covid 19 guidel
1551	1265434060769374215	via Why is the National Administration not Dealing with this
1552	1265434061310476288	From an unnecessary trade war to an increasingly desperate coronavirus war two angry countries are trapped in a b
1553	1265434061398577152	Why Immunity to COVID 19 Is So Complicated Science Smithsonian Magazine
1554	1265434061763260417	Brazil coronavirus deaths could surpass 125 000 by August U S study says
1555	1265434062811918336	This is exactly why I feel that most developing countries including India would see Coronavirus ru
1556	1265434064154030081	and Fixari your process to keep staff and patients safe due to this COVID19 pandemic is really good says Cynthi
1557	1265434064695234562	Why do you keep wanting to fix the things which you can do absolutely nothing about instead of DOI
1558	1265434067534831616	Someone thinks she is God LMAO How do these people get through law school
1559	1265434069464121344	Nearing 100000 COVID 19 Deaths U S Is Still Early In This Outbreak
1560	1265434073717075969	Pulling out all the stops to address learning loss Tap into our college students RPDPteacherleadership
1561	1265434075315257347	100k American lives lost to covid19 since March Many of those lost due to your mismanagement ina
1562	1265434075550019584	Thanks for live tweeting the event that was sweet It would be cool if you could do it for our next Stimulus Conne
1563	1265434075722067971	Doesn t Coronavirus hear it s mother calling The streetlights are on It s time for it to go home
1564	1265434075952807936	Dentists and hair salons are adopting COVID 19 surcharges even after backlash in the restaurant industry
1565	1265434076732968967	Sewer Surveillance OSU COVID 19 Detection Research Will Go to Congressional Committee The Corvallis Advocate R
1566	1265434078280667141	The show airs live on ESPN Deportes in the U S and ESPN Knockout elsewhere The headliner pits 2x title challenger
1567	1265434080197455872	Always be wary when they wheel out Stuart Ramsey They seem to think he has some sort of gravi
1568	1265434080205668352	Staying 6 feet away from others can help to slow the spread of COVID19 Wearing a mask or face covering is an add
1569	1265434080293912576	Temporary IG Account brazilian latina quarentena blonde miami gym brazil fitness animals coronavirus
1570	1265434080541212672	But when COVID19 is over and the new world order doesn t arrive the conspiracy will somehow be undiminished
1571	1265434085029281792	Today on Tuesday May 26th the official count of Americans who have died due to Coronavirus passed 100 000
1572	1265434086358822917	Nurse Sarasota COVID 19 critical care unit finally empty
1573	1265434088594386944	Well done Your book 12 Prayers During The COVID 19 Pandemic is featured in BookAuthority s list
1574	1265434088640360449	I still think the Scamdemic will be gone by at least Nov 5 2020 Coronavirus Could Disappear In U S By Novem
1575	1265434089227771905	Italy s emergency COVID 19 legislation to help businesses
1576	1265434089303269377	Canada neglected residents and rotten food found at care homes hit by Covid 19
1577	1265434089420664832	Nato is worse than coronavirus Why are the Nato criminals still on the loose How is it legal to watch videos
1578	1265434090192412682	Th blood of jesus will heal them akere amp they ll pray th corona away nationaldayofprayer
1579	1265434091211481088	How comes I see getting new followers but the number remains always the same How comes I have 65 profile v
1580	1265434094151692290	After a week of record breaking growth Utah had a mostly quiet Memorial Day weekend reporting only 99 new cases t
1581	1265434095036829702	Planned Parenthood really be looking out
1582	1265434095070449665	The government in MN responded to COVID 19 in an extreme way destroying the economy with many forc
1583	1265434095187906560	Huge shout out to and ford motors for providing us with a few hundred facemasks that will help protect
1584	1265434095192092677	Have you noticed that since CoronaVIRUS came out Nobody is posting I am sick please pray for me
1585	1265434095343095810	coronavirus update in CostaRica New cases confirmed 5 new recovered 6 Total cases in Costa Rica confirmed 956
1586	1265434095586357249	WaltDisneyWorld is presenting its plans for reopening after being shuttered since mid March because of the new cor
1587	1265434095909171200	First Fox this
1588	1265434096920035334	In early May the entire prison was tested for coronavirus More than 400 staff and inmates tested positive
1589	1265434097972740096	dan charity Here not retracted
1590	1265434098081947648	Seen on my walk this evening flowers covid19 coviddiaries Pittsburgh Pennsylvania
1591	1265434099721932800	Heads up handicap discrimination COVID chicago wickerpark
1592	1265434100200017925	The list of shops and services set to reopen on June 15 amid coronavirus
1593	1265434100447543299	63205 people recovered from Corona today Total Corona virus recoveries 2229816 Source WHO Situation Reports
1594	1265434100502016002	Ask He continues to try to preach Fear I Am Not Scared Nor will I Ever Be NOT A SHEEPLE STAND UP F
1595	1265434100837552128	Let s see you want your doctor to prescribe an UNAPPROVED drug for coronavirus treatme
1596	1265434102330580992	Just type it all up as one giant Twitter thread like the other conferences were done Honestly we don t HAVE t
1597	1265434102758543360	One of the problems is that we have very little scientific knowledge about how such a situation might impact upon
1598	1265434106042757120	Hmmm who are really the brainwashed people coronavirus
1599	1265434106059522048	Harlem Fashion Row Launches ICON360 A Non Profit That Provides COVID 19 Grants For Designers Of Color
1600	1265434106139234305	much like how we ve been set up to blame individuals for plastic packaging waste climate change amp fossil fuel cons
1601	1265434109846970368	x iiiiii mamadeb vicki
1602	1265434110329143296	Delhi police can t arrest them for protesting only They are rioters U can t save crim
1603	1265434111134650368	Coronavirus is actually just a competition to see what corporation can be the most cringy when doing li
1604	1265434112422285312	Sad stories for sure But please stop showing photos of people wearing masks incorrectly You are normali
1605	1265434113537957889	wow almost as if this is a bad idea
1606	1265434113646792704	DO NOT BECOME COMPLACENT Coronavirus actually on the way up warns WHO as New York Stock Exchange reopens
1607	1265434113709731840	Awiiiit
1608	1265434116645949440	if you feel the need to tie trans people into every single issue to make a point then i think you ve got some skele
1609	1265434117749059584	Cruise ship murder trial to re start as courts return from coronavirus closures
1610	1265434122702348289	Scott Morrison has thrown out the industrial relations rulebook but can old enemies work together
1611	1265434123600044035	OVER GHS50 6 MILLION HAVE BEEN DONATED COVID 19 TRUST FUND SOPHIA AKUFFO
1612	1265434123616821249	CORONAVIRUS Op Ed Time to fight frustrations
1613	1265434124380246016	Here s the historical context of COVID19 I wish there were no events to cause major death tolls anywhere Life
1614	1265434125084708864	JOBMAKER JOBSEEKER JOB WHATEVS BUTTT SUPPORT SCIENCE WOMEN IN STEM MOST AT RISK NOT THE TIME FOR MORE CU
1615	1265434125416239109	We are an education intervention program NPO based in Soweto We need screening machine x1 sanitizers and masks f
1616	1265434126116626432	Hey Donny you are an ASS
1617	1265434126380929027	The COVID19 outbreak has quickly changed the way the world goes to work Here are the top tips from the team behin
1618	1265434126666084352	Coronavirus come like water because we didn t see it coming and it s flowing everywhere
1619	1265434128603926528	why haven t to shut down Donny s account Didn t I hear you are taking a stand agai
1620	1265434128750698497	Coronavirus and the Two Americas via
1621	1265434130482954240	My job loves telling me when I go on break when a mfer caught covid19
1622	1265434130621267971	Vote Democrat and this super great socialist country will be comming here
1623	1265434132181590017	Repost nbcnews Lester Holt shares some of the stories of those who died from coronavi
1624	1265434133641039872	NEW CASE Cagayan de Oro has 1 new confirmed COVID 19 case as of today May 26 COVID 19 Briefer No 109 May 26
1625	1265434133788065797	Nope
1626	1265434133792096258	Maybe cuz the CDC told them
1627	1265434134568189952	Biden has video clip up from CNN with inaccurate COVID19 with no warning Twitter bias is showing
1628	1265434136317235201	Opinion Hydroxycloroquine is effective in preventing coronavirus Well what do you know
1629	1265434139190231040	Back to school 1 in 5 teachers are unlikely to return to reopened classrooms this fall poll says
1630	1265434139433422849	Thank you Jack Dorsey Good start
1631	1265434139450241025	POOR RUMPY THE PANDEMIC WAS OUT TO GET HIM
1632	1265434140729651211	Charity worker found dead at her east London home with Covid 19 after failing to join memorial se
1633	1265434142084182016	Honestly that s not for clouts that merch is for raising funds for the people in need ngayong covid 19 crisis
1634	1265434142163927040	LA Sees Largest Coronavirus Spike As Stealth Spreaders Pose Risk Patch
1635	1265434143078469633	Florida coronavirus cases push past 52 000 as death toll rises to 2 259 Updated
1636	1265434143535620096	In the SA community there is a high level of anxiety but MentalHealth is not being prioritized they re being
1637	1265434144101842944	Andrea Bocelli Confirms He Tested Positive for COVID 19
1638	1265434144303087619	LIVE PODCAST After Further Review 2 0 aka The Sideline Pass on coronavirus nba nfl playoffs
1639	1265434144898719744	This infographic from shows nonprofit organizations how to strengthen security across users devic
1640	1265434145921970176	Sigh to think this could have been prevented Even worse are those yet to die because people are not taking this
1641	1265434147117547520	Best and Worst Email Signoffs During COVID 19 Marketing Infographic
1642	1265434148338089985	Are you a neck bandanna person or a ear loop tie coronavirus newnormal iwenttothestoretoday maskup
1643	1265434148476530689	more than 1 000 coronavirus deaths in 24 hours
1644	1265434150917439489	Are you fucking kidding me Our country is broke and this is what you re doing Since when did we become the cha
1645	1265434151009705985	How absolutely devastating Under the cover of COVID19 amp repealing heritage acts WA Gov amp Rio Tinto blasts 46 000
1646	1265434152230256641	Jharkhand returnees test COVID 19 positive in Belagavi
1647	1265434152750514182	How the House s new proxy voting system will work to limit coronavirus exposure NewsVerses
1648	1265434153044058113	Karyn Polito says the graduation party she attended over the weekend was allowed under coronavirus rules
1649	1265434153190752257	Enough You would suspend anyone else He hurt the woman s family and
1650	1265434153593511936	Meanwhile in Wisconsin
1651	1265434154772189185	Lol are you even a doctor Why question something you clearly don t know about It s called pronin
1652	1265434155229130752	There s not one shred of scientific evidence that demonstrates SD masks or loc
1653	1265434156013682690	coronavirus virus Please maintain social distancing and follow the government guidelines Stay home stay safe
1654	1265434157540356097	Could COVID 19 Vaccine Be Mandated Ep 258 via
1655	1265434159360741376	The Naija is a split in 3 The blind The frightened The mongers Covid 19 is a hit world over Fact check can confirm
1656	1265434161239805953	Mourning Our Losses is a crowd sourced memorial to honor the lives of people who died in prisons jails and immig
1657	1265434161369792512	Say hello to the well planned indoctrination by the main stream media COVID19 Masks Supermarket
1658	1265434162388963332	A simple way to know the difference between an epidemic and a pandemic is to remember the P in pandemic which me
1659	1265434165069004803	cw coronavirus so that s a fun flash of realization to have
1660	1265434165777842176	It was shameless and stupid This is one thing that Trump better not try to blame on someone else He OWNS the hydr
1661	1265434166134521861	Navajo amp Hopi Families COVID 19 Relief Fund
1662	1265434166759493632	National coronavirus updates FDA commissioner issues Memorial Day warning Coronavirus is not yet contained RE
1663	1265434170576289796	Liars do unwell in the open forum CAN T TRUST NEGLIGENCE CAN T TRUST INCOMPETENCE therefore CAN T TRUST TRUMP
1664	1265434171977216000	Merkel and Macron really click huh
1665	1265434172228636672	The WHO and the Deep State does not want HCQ because it is safe and Gates doesn t make money on it Fauci a know W
1666	1265434172786724864	Since we re being crystal clear you are personally responsible for every death in a LongTerm Care f
1667	1265434173097095168	with KHNaging outlines some of the unique challenges of hospice care in the age of COVID19
1668	1265434173247860736	Inside Amazon How a Central Ohio fulfillment center is working to prevent the spread of Covid 19 Columbus Busine
1669	1265434174330191872	The latest RadioKankan Daily Africtivistes covid19
1670	1265434174778998787	If this isn t the most needed article right now we don t now what it is parenting children parents health
1671	1265434176225972224	That has been only good thing about covid19 All the replay games on sportsnet larry bird and tom brady I could w
1672	1265434176578179072	Coronavirus Flightless Kiwi economy will land with a painful thud
1673	1265434176708210689	Blackmores taps investors for almost 120 million as coronavirus bites
1674	1265434178444840962	House Republicans sue Pelosi in bid to stop proxy voting amid coronavirus concerns
1675	1265434179493191685	You really didn t know measles can have a 2 mortality rate did
1676	1265434180495736832	Non of my business let me drink my coffee coronavirus NamFollowDrive
1677	1265434181095641094	Excellent Stay vigilant though
1678	1265434181972066306	Human trials of potential coronavirus vaccine begin in Melbourne
1679	1265434182244761602	Its well
1680	1265434183553310721	This is a true tragedy some of the least powerful people in the U S forced to work in unsafe conditions getting
1681	1265434183851225088	Daily Status Update on COVID19 May 26 FlattenTheCurve Namaste TanAYuhYaad
1682	1265434184258117632	Covid 19 coronavirus Wuhan scientists says new virus is just the tip of the iceberg NZ Herald SmartNews
1683	1265434185382101005	Claire Sweeney says she was hospitalised with coronavirus symptoms in December
1684	1265434186137006080	Trump Team Killed Rule Designed To Protect Health Workers From Pandemic Like COVID 19
1685	1265434186980012032	1 The Real Uzi 2 Luv Is rage 3 Eternal Atake 4 Deluxe lofi hiphop liluzivert liluzivertedit
