	tweet_id	tweet_text
497	1265070802447282176	A 1 increase in the unemployment rate will be associated with 0 01 deaths on the population including heart atta
498	1265070804338868228	Thrilled that News and Munk are partnering on a conversation on the future of decent work featuri
499	1265070804833894401	How on earth is driving for four and a half hours in a car with two suspected coronavirus patients in the best inte
500	1265070805962104832	Hydroxychloroquine Works in lab not in people Lesson for funders There are no short cuts In 20 years unbiased
501	1265070806712954881	Did your Memorial Day plans include time at the pool News 3 s looks at pools that are open now and stil
502	1265070809200148482	I didn t realize had a podcast Reporters Notebook These are about a minute long and cover differen
503	1265070809892229124	Coronavirus The strangers reaching out to Kyrgyzstan s lonely teenagers
504	1265070810395533313	Ewing out of hospital after being treated for COVID 19 via
505	1265070810412138497	I work regularly with a blind man who he has experienced varying levels of disruption as a result of his disability
506	1265070843606032386	Another not a medical doctor blowhard who seeks to avoid accountability for his own words Annoying arrogant and
507	1265070845384327169	Honestly I ve grown bored of this argument I don t
508	1265070845812244481	Covid19
509	1265070846122569728	Okay this is just creepy as hell to me
510	1265070846206451713	More awful news Even if I note non probability survey no strongly disagree to strongly agree on the conspira
511	1265070846231511041	is losing his mind Whatever smarmy agreement he had with the other liberal governors he s incapable of
512	1265070847867236352	Back up faculty in case your professor dies
513	1265070848974692359	Who on Earth is giving Donald Trump good reviews for his failing covid response Nobody that s who
514	1265070849067008000	The taste of Bordeaux is going to change Under threat from climate change and coronavirus French winemakers try
515	1265070849205436417	Constitutional or not Protesters and professors debate rights amid COVID 19 related shutdowns The Daily Times
516	1265070849662398465	USA Plan Militarized Control of Population The National Covid 19 Testing Action Plan
517	1265070851931566081	Wake tf up America The Chinese communist party is evil wake up
518	1265070853177425920	JOIN US THURSDAY NIGHT 6PM Register now Is the COVID 19 disrupting your career goals Ho
519	1265070854658043911	WHO pauses trial of hydroxychloroquine as coronavirus treatment amid safety concerns coronavirus COVID 19
520	1265070856696483842	We can t continue with a world like this
521	1265070856910364672	Slap in the face of all your medical colleagues
522	1265070858848088064	Charlotte councilman says Trump s desire for RNC capacity crowds is unrealistic SmartNews
523	1265070859787608064	As a nation we re about to go over 100 000 deaths due to coronavirus I wonder if Trump will go golfing tomorro
524	1265070860689305600	FUCK OUTTA HERE
525	1265070862492938241	Too bad that one of trumps golf clubs doesn t hit him on the back of his head and knock some sense into it
526	1265070862799187968	COVID 19 Resources The Conservation Fund
527	1265070866385137664	I will
528	1265070867094044678	On coronavirus men are calling all the shots We re seeing why it matters Women in politics The Guardian
529	1265070867723292674	WHO warns immediate second peak of coronavirus threatens countries that reopen too soon stayhome
530	1265070867928641536	Meanwhile research tarnish their fantastic reputation as researchers with Prof Marc Pellegrini going ahead wi
531	1265070869824430080	And your still closed why
532	1265070873465155585	I m so often in awe of my incredibly talented friends Here s on the danger of COVID19 to communit
533	1265070876585672704	Ops enjoying a family event with all the fixings Coronavirus
534	1265070878376685568	ya should be encouraging people NOT to lock em so they won t have to deal w this lmfaoo
535	1265070879148576769	Surviving Sepsis Campaign COVID19 Recommendations Safety awarenesssaveslives
536	1265070881014837248	I believe her took it just not as a preventative He must have had Covid19
537	1265070881287614464	kpop followtrick like rt if you stan bts red velvet bp blackpink exo nct twice suck gay nsfw porn thread au mutua
538	1265070882080395271	Even before coronavirus Social Security was staring at a shortfall The Washington Post
539	1265070882256564224	Another vaccine has entered the race
540	1265070882369617920	Coronavirus vaccine trials begin in Melbourne
541	1265070886111055873	Love to hear that keep it up
542	1265070889000792064	Just for YOU DONNY
543	1265070889818865664	Anatomy of a man made disaster 320 ways Donald Trump failed to protect us from the coronavirus Raw Story
544	1265070889877602304	If Biden and Obama had caused a CoronavirusPandemic which they wouldn t have because
545	1265070890808758275	Veterans Affairs Gives 1 300 Vets Unproven COVID 19 Drug Touted By Trump Hydroxychloroquine has not been shown to b
546	1265070891186167810	Wow You almost wonder if some places have people as bad as us
547	1265070891349598209	FDA Does Steve at FDA know that Democrat Governors amp Democrat Mayors FORCED nursing homes
548	1265070891702124549	Honestly Truly
549	1265070892012515328	Department of Health Coronavirus Advert DaHubRadio NowPlaying If Ur d Above So We Can Ment
550	1265070893522354177	The Search for a Covid 19 Research Animal Model
551	1265070894256394240	So Facebook is now deleting all comments with the word coronavirus even if you just post the word by itself I
552	1265070894394662912	How many people are anxiously desperately awaiting joining the covid19 victim class of 2020 Imagi
553	1265070895502184453	Tool that compares per country the COVID 19 deaths per million people confirmed total
554	1265070896190050306	Guidance issued by the Centers for Disease Control highlights how normal food waste sources rodents use for surviva
555	1265070896378777600	The Search for a Covid 19 Research Animal Model
556	1265070896462602246	What things do you miss most as a result of the COVID 19 pandemic What are you most looking forward to This
557	1265070897393741831	Wait til the mocking Republicans look at themselves wearing a hospital gown when they are admitted for
558	1265070897406152704	We love Conner s hot takes on current events in Cuba Never a dull moment COVID 19 amp Cuba May 2020
559	1265070897637011457	Really interesting helpful piece about how COVID19 spreads Turns out that yoga is safer than Zumba
560	1265070898526277632	Im sure you can check the veracity of his claims
561	1265070899151212546	The Australian community sector is suffering as a result of COVID 19 Please Give
562	1265070900325617664	LE Do u have the coronavirus
563	1265070901730717696	Trump has saved more lives than the left will ever be able to recognize unless they start thinking for themselves
564	1265070901977989124	It s COVID19 not one his hotel grand openings I remember when people didn t brag about b
565	1265070902015860737	rt 11 000 deaths avoided during lockdown in Europe thanks to cleaner ai
566	1265070903450169344	Hey Grandpa what was it like during the CoronavirusPandemic in the 20 s Well mostly people just argued over
567	1265070903487946753	Second person tests positive for COVID 19 in Sitka KCAW
568	1265070904427626499	California opens up coronavirus funding for IllegalAliens faces backlash CCOT
569	1265070905949949953	We were on the right path Numbers indicate that prior to the COVID 19 pandemic homeownership had hit an 8 year hi
570	1265070906138939392	Heading to the rippers post covid19 stripclub wearyourmask
571	1265070906537369600	Australian government responds to claims coronavirus was designed for humans
572	1265070906910617600	There s no playbook What local governments can legally limit during coronavirus IndyStar
573	1265070907770335232	Look who made the national news Our hero driver from Nampa Monica Salinas 7sHero
574	1265070908055728131	There are good people still I for one want to see more of these stories opposed to trumpian i
575	1265070908193947648	WWII Veteran Walking 100 Miles for 100th Birthday to Raise Money for Coronavirus Relief
576	1265070908567257088	China s top court vows to help companies stay afloat amid coronavirus fallout
577	1265070909477597187	PM says people should make up own minds on Dominic Cummings as it happened Coronavirus outbreak The Guardian
578	1265070910496747520	Gallois Tees has sadly passed away she caught breast cancer got taken into hospital where the hosp
579	1265070911612506119	Coronavirus the impact on the Travel and Tourism industry BBC News
580	1265070913504059392	Honor the healthcare care workers that died taking care of covid patients
581	1265070913889857536	Latest CoronaCheck out now
582	1265070913923551233	coronavirus update in Andorra New cases confirmed 1 new recovered 10 Total cases in Andorra confirmed 763 rec
583	1265070914640777216	Nurse not on county coronavirus list but COVID 19 underlying cause on death certificate
584	1265070914841874432	Jobs jobs jobs all lost
585	1265070917559844864	Australia s first human trials of a potential COVID 19 vaccine started in Melbourne today A guide to coronavirus v
586	1265070917949906944	Second immigrant dies of COVID 19 while in ICE custody
587	1265070917950017536	You sad fucking hypocrite If was president during the covid19 crisis and out playin
588	1265070918738427906	We teachers need to stop waiting for our states and districts to make plans for return and decide what conditions w
589	1265070920269312000	Dem governors are pulling the strings and manipulating the numbers by placing patients with Covid 19
590	1265070920433127424	Brit folks including myself wear a mask 2 protect other people from them It s being considerate of the
591	1265070920584105984	Well Mr Sunak that s your leadership chances torpedoed Congratulations ToryLiesCostLives
592	1265070920680398848	Coronavirus The search for antibody super donors
593	1265070921292951552	Nancy Pelosi will probably buy designer Ice cream and eat it with a mask on while visiting Coronavirus patients on
594	1265070921515229185	Toyota Nissan and Honda gear up for Mexico reboot after COVID 19 lockdowns via
595	1265070924077899779	Can pediatric COVID 19 testing sensitivity be improved with sequential tests
596	1265070924304392192	Another reason why the US has suffered with COVID19 so much worse than has S Korea team Trump incompetence
597	1265070924518195200	Someone on my feed last week said that the US also chose the herd immunity strategy but didn t tell anyone
598	1265070926174928896	Coronavirus case confirmed at Waverley College in Sydney s east
599	1265070926724382722	Does Steve at FDA know that Democrat Governors amp Democrat Mayors FORCED nursing homes to take in patients INFECTED
600	1265070927223668736	Jan 2020 met with Chinese Foreign Minister Wang Yi amp President Xi JinPing 23 Jan stated t
601	1265070927517306880	Tonight s COVID 19 Bulletin Testing issues persist Commercial rent relief program open Two long term care
602	1265070929845145608	My first thought was Twitter will definitely crash from all of the jokes amp memes After reading this I can honestl
603	1265070931220848640	She encourages the far fetched drama I mean really She says she went blind but was able to type bel
604	1265070931535376384	One of my best friend s dad just spent 3 weeks on a ventilator and barely survived COVID19 Statistically sure he
605	1265070932332351496	Feckin Numptys
606	1265070933267460096	How does Hertz rack up 17 billion in debt They do not own the vehicles they are leased A global pandemic slams
607	1265070933787635712	The race for coronavirus vaccines a graphical guide
608	1265070934022656009	Did your Memorial Day plans include time at the pool I took a look at pools that are open now and still closed ami
609	1265070936321032192	TRUMP these are trucks as long as the rose garden and they are pulling up to take out bodies and y
610	1265070936883179521	Both Gautam Navlakha and Anand Teltumbde who are more than 65 years old have underlying heart ailments Currently
611	1265070939060015106	The real motive perhaps
612	1265070941119242240	Democrats should be held liable for all the businesses they have caused to close for good because of their bad scie
613	1265070942687903744	The Coronavirus doesn t care how you look
614	1265070943124275200	Just like there s been a vaccine for AIDS
615	1265070943291965440	Weird how so many health care heroes get sick with Coronavirus despite wearing masks that
616	1265070943468224513	Ibuprofen does NOT make coronavirus symptoms worse insist scientists as desperate arthritis patients use indu
617	1265070943988256768	Ask mad scientist Democrat Pelosi what to do The USA would be totally lost without this geese
618	1265070945519259648	007 The hard truth is Donald Trump ignored the
619	1265070946915880961	Wow with coronavirus out here they must wanna keep this around covid 19
620	1265070947528257537	Cuomo attempts to deflect blame of deadly nursing home coronavirus debacle on to Trump cantapologizecuomo
621	1265070949197426688	NDTV of US
622	1265070949252190210	Tees has sadly passed away she caught breast cancer got taken into hospital where the hospital moved h
623	1265070949629661192	Although you are a bot I will answer amp then report an block so that others that see
624	1265070950200074240	Video shows how quickly coronavirus can spread
625	1265070953165393920	Video shows how quickly coronavirus can spread
626	1265070953664397312	The educated of this country are shaking their heads screaming why and praying for our frontline workers The e
627	1265070955128291333	I think there s a lot of good points to address here but I ll take on the last one since I agree w most of them h
628	1265070955186946048	A lot of people saying we should listen to the WHO also say the flow of alcohol should remain steady and be tax pa
629	1265070955803504640	Yes heaven forbid Trump actually appear to be a caring responsible human being for a few
630	1265070957691129856	US businesses wants immunity from coronavirus lawsuits Quartz
631	1265070957737111552	The video is about Coronavirus Your comment was about a video about Coronavirus Stay focused chief
632	1265070958013845504	Because of masks Asia Pacific stocks set to trade higher on vaccine hopes Japan lifts state of emergency
633	1265070960459186177	You get credit for mishandling the Coronavirus n
634	1265070960560033795	Dark blue dragons tail with insertable handle whip flogger via turn your coronavirus
635	1265070962342612993	no reallyyy
636	1265070964376813568	To be continued
637	1265070964443840517	NewYorkCity Doesn t Have to Suffer This Summer I said this from the start The poor will suffer while the ric
638	1265070966511714306	Still better than catching coronavirus
639	1265070967740665862	The United States has 1 25th of the World s Population The United States has 1 3rd of the World
640	1265070967925157889	I ve thought about many things during this but this was right at the top
641	1265070968977965056	So say we all sackCummings
642	1265070969028313088	Day 64 Thank you Healthcare workers amp Essential workers Cheer4HealthWorkers COVID19 COVIDHeroes
643	1265070970244599808	So I m sitting here during a Covid 19 pandemic quarantined in my bedroom suffering from what s most likely a debi
644	1265070970332680193	Study Cannabis Could Prevent COVID 19 Infections cannabis
645	1265070970710011904	Death toll would have been a lot higher If you remember
646	1265070971775406080	For those with eyes read this video to live This miracle drug known to me by extrat
647	1265070971863683073	More importantly why are all those millions being spent on contracts tracing now Shouldn t that go to the local
648	1265070971997745157	These 24 States Have Uncontrolled Coronavirus Outbreaks Study Says SmartNews
649	1265070972136296453	Over 600 000 dead children every year killed by abortion
650	1265070972295577600	Virginia Reports Highest One Day Increase in Coronavirus Cases After Gov Ralph Northam Criticized For N Topbuzz
651	1265070973021073408	That cannot be true still promotes it
652	1265070978184302593	Dr Bonnie Henry BC s daily dose of right information and calmness perfectly described Covid19 situation We re i
653	1265070978830340096	WOW Judging by the comments they have completely lost the room
654	1265070982332469248	Create a trickle up economy The citizens need to DEMAND UBI and FAIR Taxation Trickledown economy is immoral and
655	1265070982718521346	WHO suspends hydroxychloroquine trial as COVID 19 treatment via xpress
656	1265070984379367425	Association between vitamin D levels and mortality from COVID 19
657	1265070984392060928	If you are an RN howmany infected with covid19 habe you help without weari
658	1265070984828268550	As the number of deaths attributable to COVID 19 ticks upward the Tribune is working to chronicle those who have l
659	1265070984962248704	Pandemic takes toll on Trump properties while President golfs at one CNNPolitics
660	1265070985058770944	Trump knew the world already knew who is the source of covid 19 and why China is first epidemic of covid 19 no nee
661	1265070985235103744	Working from home is a solution for Small Businesses amid COVID 19 Social Distancing Read more
662	1265070986409308160	What impact will the COVID 19 pandemic have on jobs World Economic Forum SmartNews
663	1265070988338872324	you see a broken window and you re talking about lock your cars lmao
664	1265070990762971138	Hi there due to COVID 19 there are fewer drivers out on the road currently This can cause delays and wa
665	1265070991954391041	The number of confirmed cases of COVID 19 remains at 100 The Bahamas Ministry of Health has reported in its Monday
666	1265070992352784386	The Govt coronavirus guidance says we shd stay at home as much as possible to stay safe We are not permitted to ha
667	1265070992524587008	Myth Lockdowns are temporary measures to wait for vaccine or till get you drugs for covid19 Fact There are huge
668	1265070993640493069	Ford Motor Company donates COVID 19 face shields to the military fordmotorcompany
669	1265070994928132096	How do we let him get away with thanking troops for fighting the virus AND simultaneously saying that virus is a ho
670	1265070996077318147	Pogba s chances of moving to the Bernabeu or old club Juventus seem to have faded due to football taking a massive
671	1265070996555522054	Chicago Memorial Day weekend violence 36 shot 9 fatally so far in deadliest Memorial Day weekend since 2015 ABC
672	1265070996609994753	Mizzou law continuing to help veterans in the face of COVID 19 KOMU 8
673	1265070997142753280	Coronavirus Baffling observations from the front line
674	1265070998128336897	Here s How Facebook And YouTube Allowed Conspiracy Theorists To Turn Bill Gates Into The Villain Of The Coronavirus
675	1265071000389025794	Tees has sadly passed away she caught breast cancer got taken into hospital where the
676	1265071000837935107	You go and play golf clearly you are the most UNAMERICAN president in the history of our country
677	1265071001743867905	I want to know where they are
678	1265071002586939397	Trump says he ll pull GOP convention unless N C commits to full attendance despite coronavirus
679	1265071003450978304	My recent essay for about my kids growing up while the world is paused parenting dad coronavirus
680	1265071004503736322	20 new confirmed cases COVID19
681	1265071005577490432	coronavirus coronomics covid19 lockdown QuarantineLife wine winelovers mondaythoughts TuesdayThoughts
682	1265071007351496704	His facts include a magic box that cures coronavirus which he was advertising and selling illegally
683	1265071008383471618	By that time entire Istanbul will be on sale 25 off
684	1265071008828067840	NYC expected deaths 17 046 NYC deaths all causes 40 229 NYC of expected deaths 236 Table 2
685	1265071009406877696	Career criminal gets charges dropped because of the coronavirus pandemic abq albuquerque
686	1265071010669162496	The bleeting heart mantra Do as I Say NOT as I Do
687	1265071011139026944	Lol we know why
688	1265071011214614528	Trump s televised petulance is driving a key voting bloc away from the GOP amid the coronavirus pandemic columni
689	1265071011944267776	The threat of COVID19 makes the rebuilding and rehabilitation of Marawi City all the more urgent and necessary ac
690	1265071012724473856	Check this out marketing socialmedia COVID19
691	1265071013668089856	Look at the ages of these people Quarantine the elderly and open the country If they lis
692	1265071014653943808	Top story Register for Cybersecurity post COVID19 Big Data Artificial Intelligence AR Omnichannel Solutions Comp
693	1265071015811518466	Luxury Club Top story Register for Cybersecurity post COVID19 Big Data Artificial Intelligence AR Omnichannel So
694	1265071015832453120	StayHome There s no way anyone in Toronto should be doing anything other than getting essentials rn
695	1265071016038084613	Will we see an exodus of wealthy HongKongers looking to escape the reaches of CCP China with them buying
696	1265071016553918466	How the coronavirus is forever changing the way MLB connects to fans via App
697	1265071017405280256	MAY BE MORE THAN 10 0000 PEOPLE IN THE UNITED STATES NOW HAVE BEEN DEATH FROM CORONAVIRUS WHAT DID WHITE HOUSE DO
698	1265071018827231235	Egypt under fire over coronavirus deaths among healthcare workers HealthCare health via
699	1265071018835664896	St Louis County health department issues Lake of Ozarks travel advisory UI health via
700	1265071019473149953	Cuban graffiti depicts anguish urges courage UI
701	1265071019510857729	Greece reopens cafes restaurants as summer season nears UI
702	1265071019632603138	Report Coronavirus Lockdown in Italy Drives 30 Increase in Divorces via
703	1265071019837906944	I lost my old account for saying tar and feathers for all of you soon on an ABC News article fully shut off
704	1265071019909197824	Rajender Pls set strict guideline give a format and ensure its adherence for all states to repor
705	1265071021025120258	If yolo was a picture truly irresponsible and selfish thisisnotpublichealth covid19 publichealth
706	1265071021540941825	COVID 19 is a scam Wake up now
707	1265071022132408320	MemorialWeekend2020 and we re about to hit 100K deaths from COVID19 in the USA Everything about Trump s respons
708	1265071022132416512	Dolar Covid19
709	1265071023856074753	Praising Emissions Reductions Due to Coronavirus Plays Into Right Wing Strategy via
710	1265071023906607104	Cria o de Sites Baratos Staten Islanders with masks drive out non mask wearing person in grocery
711	1265071024573276162	California Gov Newsom issues detailed guidelines for reopening churches houses of worship after coronavirus outbr
712	1265071024627802113	All original clinical trials of this drug have asserted about its potency its ability to cause major heart arrhyth
713	1265071027828097025	Interesting how EASILY factually inaccurate and misleading info goes viral
714	1265071029698912257	This ll be the start of my covid19 workout
715	1265071029866491904	Messaging From Leaders Who Have Tamed Their Country s Coronavirus Outbreaks
716	1265071030252351488	Update coronavirus
717	1265071031301136384	It isn t I looked in early April He was presciently WRONG about Herd Immunity though I suspect he w
718	1265071032760561665	Obama Clinton 9th Circuit Judges Suspend Bill of Rights Until Coronavirus is Cured Frontpagemag
719	1265071033536536576	We face real and hard choices between investing in humans and investing in technology Because the brutal truth is
720	1265071033637199877	How I keep my Sanity While Working From Home A New Blog Post from Me covid19 Workfromhome
721	1265071034090360836	Coronavirus and the Chernobyl Analogy interviews WSJ has the most important and reasonabl
722	1265071034627174404	When the judge saw 6ix9ine for the first time 6ix9ine coronavirus 6ix9inebacktojailparty 6ix9ineiscancelled
723	1265071034904051712	Just please read this thread
724	1265071035000520706	May have Try certain housing crisis
725	1265071035478654977	Wow Doxxing are we you ok with this
726	1265071035763904512	Thanks idiots and disinformation campaigns
727	1265071036023914496	Stay at home Protect the NHS Save Lifes Unless you re Dominic Cummings In which case drive to the
728	1265071036636241920	Veterans Affairs Gives 1 300 Vets Unproven COVID 19 Drug Touted By Trump SmartNews
729	1265071036707594250	President Trump marks Memorial Day at Fort McHenry as Baltimore remains under coronavirus stay at home order Balt
730	1265071037047283720	At what point do we get to call people sheep if overnight they went from cooperation to complacency without any c
731	1265071038515294209	The consequences of a weak state in Guatemala include the potential for prolonging the covid19 crisis because ba
732	1265071038561427457	Not all Chinese have the coronavirus
733	1265071039060553730	Y all wanted hair cuts soooooo bad
734	1265071039232516096	WHO Halts Hydroxychloroquine Trial Over Safety Concerns
735	1265071039693721601	hope our brains trust Scotty from Marketing deputy Don halts our ADF and front line worker trials before too much h
736	1265071040922701824	Rule support and buy Making sense of Mafia strategies in the COVID 19 aftermath
737	1265071042298437633	Bad guys don t follow rules Do you
738	1265071042512351233	Betty and RBG are National Treasures Betty White 98 Doing Very Well amid Coronavirus Pandemic We Always Ha
739	1265071042848006144	Top story HIMYM Creators Remake Let s Go To The Mall For COVID 19 With Cobie Smulders
740	1265071043015839746	Hopefully there will be a class action suit filed against these jerks
741	1265071043514961921	CORONAVIRUS OPENING PAINT ByAsh via
742	1265071043628187650	The latest The Crop Scouting Report covid19 soybean
743	1265071049030250496	COVID19 CATASTROPHE We Need To Take Back Our Sovereignty The Phaser
